"x138203134","x1254857528506085376",2020-04-27 19:38:43,"AOC","Read this statement.

No matter who you support, it is extremely dangerous that New York is establishing a precedent of cancelling elections citing COVID. Ballots were certified &amp; neither candidate asked for this.

The decision should be overturned immediately. #LetUsVote https://t.co/ehgJlmXkMj","Twitter for iPhone",276,,,,TRUE,FALSE,38669,9451,,,"LetUsVote",,"twitter.com/BernieSanders/…","https://t.co/ehgJlmXkMj","https://twitter.com/BernieSanders/status/1254845389355827204",,,,,,,,,,,"en","x1254845389355827204","Our campaign statement on the New York State Board of Elections decision to cancel the state’s presidential primary: https://t.co/BzylNaqCaS",2020-04-27 18:50:29,"Twitter Web App",41489,9926,"x216776631","BernieSanders","Bernie Sanders",11897968,1460,17920,"Vermont","U.S. Senator from Vermont and candidate for President of the United States.",TRUE,,,,,,,,,,,,,,,,,,,,,,"NA NA","NA NA","NA NA NA NA NA NA NA NA","https://twitter.com/AOC/status/1254857528506085376","Alexandria Ocasio-Cortez","Bronx + Queens, NYC","US Representative,NY-14 (BX & Queens). In a modern, moral, & wealthy society, no American should be too poor to live. 💯% People-Funded, no lobbyist💰. She/her.","https://t.co/BYjH4stRnI",FALSE,6858654,2346,17201,10358,23329,2010-04-28 22:38:40,TRUE,"https://t.co/BYjH4stRnI","http://www.Ocasio2018.com/",,"https://pbs.twimg.com/profile_banners/138203134/1511815660","http://abs.twimg.com/images/themes/theme1/bg.png","http://pbs.twimg.com/profile_images/923274881197895680/AbHcStkl_normal.jpg"
"x138203134","x1254838478845743105",2020-04-27 18:23:01,"AOC","The best way to thank our essential workers is to guarantee them:

✅ living wages
✅ paid sick leave
✅ hazard pay
✅ labor protections
✅ healthcare, childcare, &amp; more

Join @ewarren and I on IG Live in 10 mins to rally for an Essential Workers Bill of Rights! 💪🏽 https://t.co/3ZZciehNdI","Twitter for iPhone",264,,,,TRUE,FALSE,19023,3164,,,,,"twitter.com/ewarren/status…","https://t.co/3ZZciehNdI","https://twitter.com/ewarren/status/1254760694857322504",,,,,,,,,"x357606935","ewarren","en","x1254760694857322504","I’ll be joining @AOC live on Instagram at 2:30pm ET to talk more about how Congress needs to pass an Essential Workers Bill of Rights and how we must all #StandWithEssentialWorkers—today and every day.",2020-04-27 13:13:56,"Twitter Web App",20356,2761,"x357606935","ewarren","Elizabeth Warren",4145497,547,9556,"Massachusetts","U.S. Senator, former teacher. Wife, mom (Amelia, Alex, Bailey, @CFPB), grandmother, and Okie. She/her. Official campaign account.",TRUE,,,,,,,,,,,,,,,,,,,,,,"NA NA","NA NA","NA NA NA NA NA NA NA NA","https://twitter.com/AOC/status/1254838478845743105","Alexandria Ocasio-Cortez","Bronx + Queens, NYC","US Representative,NY-14 (BX & Queens). In a modern, moral, & wealthy society, no American should be too poor to live. 💯% People-Funded, no lobbyist💰. She/her.","https://t.co/BYjH4stRnI",FALSE,6858654,2346,17201,10358,23329,2010-04-28 22:38:40,TRUE,"https://t.co/BYjH4stRnI","http://www.Ocasio2018.com/",,"https://pbs.twimg.com/profile_banners/138203134/1511815660","http://abs.twimg.com/images/themes/theme1/bg.png","http://pbs.twimg.com/profile_images/923274881197895680/AbHcStkl_normal.jpg"
"x138203134","x1254836123110645770",2020-04-27 18:13:40,"AOC","Again: NY is still holding primary elections on June 23rd. This decision does not change the fact that people will still be going outside to vote.

If NY doesn’t want to risk possibly millions of ppl voting in-person, we need to mail everyone a ballot. Not an application for one.","Twitter for iPhone",280,"x1254829322352893955","x138203134","AOC",FALSE,FALSE,5289,888,,,,,,,,,,,,,,,,,,"en",,,,,,,,,,,,,,,,,,,,,,,,,,,,,,,,,,,,,"NA NA","NA NA","NA NA NA NA NA NA NA NA","https://twitter.com/AOC/status/1254836123110645770","Alexandria Ocasio-Cortez","Bronx + Queens, NYC","US Representative,NY-14 (BX & Queens). In a modern, moral, & wealthy society, no American should be too poor to live. 💯% People-Funded, no lobbyist💰. She/her.","https://t.co/BYjH4stRnI",FALSE,6858654,2346,17201,10358,23329,2010-04-28 22:38:40,TRUE,"https://t.co/BYjH4stRnI","http://www.Ocasio2018.com/",,"https://pbs.twimg.com/profile_banners/138203134/1511815660","http://abs.twimg.com/images/themes/theme1/bg.png","http://pbs.twimg.com/profile_images/923274881197895680/AbHcStkl_normal.jpg"
"x138203134","x1254829322352893955",2020-04-27 17:46:38,"AOC","It is completely wrong for the BOE to cancel New York’s Presidential Primary.

This decision is not informed by public health: the state is still holding elections for every other seat that day, &amp; so far the only way your ballot will 100% be counted in NY is to vote in person! https://t.co/l8iT7mxm9c","Twitter for iPhone",281,,,,TRUE,FALSE,14426,3847,,,,,"twitter.com/LWVNYS/status/…","https://t.co/l8iT7mxm9c","https://twitter.com/LWVNYS/status/1254804375022768128",,,,,,,,,,,"en","x1254804375022768128","The State Board of Elections Democratic Commissioners have voted to cancel the Presidential Primary Election in New York.

Voters registered in a party will still have the opportunity to vote for Congressional and State representatives in the June primary. https://t.co/mRiryiR1PU",2020-04-27 16:07:30,"Twitter Web App",197,178,"x1504788613","LWVNYS","LWV of New York",1770,581,5528,"Albany, NY","nonpartisan political organization, encourages informed and active participation in government, influences public policy through education and advocacy",FALSE,,,,,,,,,,,,,,,,,,,,,,"NA NA","NA NA","NA NA NA NA NA NA NA NA","https://twitter.com/AOC/status/1254829322352893955","Alexandria Ocasio-Cortez","Bronx + Queens, NYC","US Representative,NY-14 (BX & Queens). In a modern, moral, & wealthy society, no American should be too poor to live. 💯% People-Funded, no lobbyist💰. She/her.","https://t.co/BYjH4stRnI",FALSE,6858654,2346,17201,10358,23329,2010-04-28 22:38:40,TRUE,"https://t.co/BYjH4stRnI","http://www.Ocasio2018.com/",,"https://pbs.twimg.com/profile_banners/138203134/1511815660","http://abs.twimg.com/images/themes/theme1/bg.png","http://pbs.twimg.com/profile_images/923274881197895680/AbHcStkl_normal.jpg"
"x138203134","x1254114395908640768",2020-04-25 18:25:46,"AOC","I say this bc I don’t want GOP lawmakers to lie to the public &amp; pretend they didn’t see a payment crisis coming. They know &amp; are choosing not to stop it.

Just like they pretended to act surprised when PPP went to the rich instead of mom &amp; pops, when they WROTE the bill that way.","Twitter for iPhone",292,"x1254112800915554304","x138203134","AOC",FALSE,FALSE,13428,2836,,,,,,,,,,,,,,,,,,"en",,,,,,,,,,,,,,,,,,,,,,,,,,,,,,,,,,,,,"NA NA","NA NA","NA NA NA NA NA NA NA NA","https://twitter.com/AOC/status/1254114395908640768","Alexandria Ocasio-Cortez","Bronx + Queens, NYC","US Representative,NY-14 (BX & Queens). In a modern, moral, & wealthy society, no American should be too poor to live. 💯% People-Funded, no lobbyist💰. She/her.","https://t.co/BYjH4stRnI",FALSE,6858654,2346,17201,10358,23329,2010-04-28 22:38:40,TRUE,"https://t.co/BYjH4stRnI","http://www.Ocasio2018.com/",,"https://pbs.twimg.com/profile_banners/138203134/1511815660","http://abs.twimg.com/images/themes/theme1/bg.png","http://pbs.twimg.com/profile_images/923274881197895680/AbHcStkl_normal.jpg"
"x138203134","x1254112800915554304",2020-04-25 18:19:26,"AOC","I want everyone to know that the White House, Mnuchin, McConnell &amp; Congress *know* that there is a housing crisis looming due to inaction on rent + mortgage relief.

If we don’t act ASAP, millions could face foreclosure &amp; eviction.

Dems have plans to stop it. It’s being blocked. https://t.co/93R7o1wHhh","Twitter for iPhone",288,,,,TRUE,FALSE,25108,7741,,,,,"twitter.com/ddayen/status/…","https://t.co/93R7o1wHhh","https://twitter.com/ddayen/status/1253818412939108354",,,,,,,,,,,"en","x1253818412939108354","This is going to be an enormous problem. The second wave is a foreclosure wave. https://t.co/xSllOtGaQm",2020-04-24 22:49:39,"Twitter Web App",4603,1699,"x7864222","ddayen","David Dayen",51787,1109,88885,"Los Angeles, CA","Executive editor @theprospect. Author, Chain of Title, Monopolized (coming 07/20). Unsanitized newsletter only at https://t.co/7y0W2B4aju. Tips: ddayen-at-prospect-dot-org",FALSE,,,,,,,,,,,,,,,,,,,,,,"NA NA","NA NA","NA NA NA NA NA NA NA NA","https://twitter.com/AOC/status/1254112800915554304","Alexandria Ocasio-Cortez","Bronx + Queens, NYC","US Representative,NY-14 (BX & Queens). In a modern, moral, & wealthy society, no American should be too poor to live. 💯% People-Funded, no lobbyist💰. She/her.","https://t.co/BYjH4stRnI",FALSE,6858654,2346,17201,10358,23329,2010-04-28 22:38:40,TRUE,"https://t.co/BYjH4stRnI","http://www.Ocasio2018.com/",,"https://pbs.twimg.com/profile_banners/138203134/1511815660","http://abs.twimg.com/images/themes/theme1/bg.png","http://pbs.twimg.com/profile_images/923274881197895680/AbHcStkl_normal.jpg"
"x138203134","x1253838100524081155",2020-04-25 00:07:53,"AOC","Our community is so thankful to each of you volunteering a check-in shift from home &amp;contributing to our on-the-ground relief effort.

So far #TeamAOC has called over 56,000 constituents + raised over $300,000 for local food pantries &amp; orgs.

Join us here: https://t.co/b2B8vjNZ9l https://t.co/GgQa1d4DoT","Twitter for iPhone",288,,,,TRUE,FALSE,4080,575,,,"TeamAOC",,"OcasioCortez.com/events twitter.com/voguemagazine/…","https://t.co/b2B8vjNZ9l https://t.co/GgQa1d4DoT","http://OcasioCortez.com/events https://twitter.com/voguemagazine/status/1253746328280150019",,,,,,,,,,,"en","x1253746328280150019","The office of New York Congresswoman @AOC has been directly reaching out to constituents in the Bronx and Queens to ask if their basic needs are being met during the COVID-19 pandemic. https://t.co/Qg9kPAvTpo",2020-04-24 18:03:12,"SocialFlow",3266,455,"x136361303","voguemagazine","Vogue Magazine",13789120,517,150209,"New York, NY","The official Twitter page of Vogue Magazine.",TRUE,,,,,,,,,,,,,,,,,,,,,,"NA NA","NA NA","NA NA NA NA NA NA NA NA","https://twitter.com/AOC/status/1253838100524081155","Alexandria Ocasio-Cortez","Bronx + Queens, NYC","US Representative,NY-14 (BX & Queens). In a modern, moral, & wealthy society, no American should be too poor to live. 💯% People-Funded, no lobbyist💰. She/her.","https://t.co/BYjH4stRnI",FALSE,6858654,2346,17201,10358,23329,2010-04-28 22:38:40,TRUE,"https://t.co/BYjH4stRnI","http://www.Ocasio2018.com/",,"https://pbs.twimg.com/profile_banners/138203134/1511815660","http://abs.twimg.com/images/themes/theme1/bg.png","http://pbs.twimg.com/profile_images/923274881197895680/AbHcStkl_normal.jpg"
"x138203134","x1253513493011214336",2020-04-24 02:38:00,"AOC","@krossny1 @jduffyrice Thanks! I wish I could help young women navigate these things more specifically because it took me a long time and a lot of effort to figure out when I was just starting out. I’m still learning. Doing your own gel mani at home w/ a peel off base coat is a life (and nail) saver!","Twitter for iPhone",278,"x1253505683561070605","x2831539793","krossny1",FALSE,FALSE,4134,35,,,,,,,,,,,,,,,,"x2831539793 x36261242","krossny1 jduffyrice","en",,,,,,,,,,,,,,,,,,,,,,,,,,,,,,,,,,,,,"NA NA","NA NA","NA NA NA NA NA NA NA NA","https://twitter.com/AOC/status/1253513493011214336","Alexandria Ocasio-Cortez","Bronx + Queens, NYC","US Representative,NY-14 (BX & Queens). In a modern, moral, & wealthy society, no American should be too poor to live. 💯% People-Funded, no lobbyist💰. She/her.","https://t.co/BYjH4stRnI",FALSE,6858654,2346,17201,10358,23329,2010-04-28 22:38:40,TRUE,"https://t.co/BYjH4stRnI","http://www.Ocasio2018.com/",,"https://pbs.twimg.com/profile_banners/138203134/1511815660","http://abs.twimg.com/images/themes/theme1/bg.png","http://pbs.twimg.com/profile_images/923274881197895680/AbHcStkl_normal.jpg"
"x138203134","x1253511407695474688",2020-04-24 02:29:43,"AOC","@jduffyrice I rented it :)","Twitter for iPhone",14,"x1253505138574180355","x36261242","jduffyrice",FALSE,FALSE,5780,47,,,,,,,,,,,,,,,,"x36261242","jduffyrice","en",,,,,,,,,,,,,,,,,,,,,,,,,,,,,,,,,,,,,"NA NA","NA NA","NA NA NA NA NA NA NA NA","https://twitter.com/AOC/status/1253511407695474688","Alexandria Ocasio-Cortez","Bronx + Queens, NYC","US Representative,NY-14 (BX & Queens). In a modern, moral, & wealthy society, no American should be too poor to live. 💯% People-Funded, no lobbyist💰. She/her.","https://t.co/BYjH4stRnI",FALSE,6858654,2346,17201,10358,23329,2010-04-28 22:38:40,TRUE,"https://t.co/BYjH4stRnI","http://www.Ocasio2018.com/",,"https://pbs.twimg.com/profile_banners/138203134/1511815660","http://abs.twimg.com/images/themes/theme1/bg.png","http://pbs.twimg.com/profile_images/923274881197895680/AbHcStkl_normal.jpg"
"x138203134","x1253478462632988677",2020-04-24 00:18:48,"AOC","Congress just voted for the first time in a MONTH on a bill that doesn’t address the core issues facing working families. Then they adjourned again until further notice.

“Someday” and “next time” doesn’t cut it.

Struggling families need a timeline.
https://t.co/nC1eegtlbY","Twitter for iPhone",274,,,,FALSE,FALSE,14967,3169,,,,,"huffpost.com/entry/squad-ti…","https://t.co/nC1eegtlbY","https://www.huffpost.com/entry/squad-timeline-house-progressives_n_5ea2248fc5b669fd8921ca04",,,,,,,,,,,"en",,,,,,,,,,,,,,,,,,,,,,,,,,,,,,,,,,,,,"NA NA","NA NA","NA NA NA NA NA NA NA NA","https://twitter.com/AOC/status/1253478462632988677","Alexandria Ocasio-Cortez","Bronx + Queens, NYC","US Representative,NY-14 (BX & Queens). In a modern, moral, & wealthy society, no American should be too poor to live. 💯% People-Funded, no lobbyist💰. She/her.","https://t.co/BYjH4stRnI",FALSE,6858654,2346,17201,10358,23329,2010-04-28 22:38:40,TRUE,"https://t.co/BYjH4stRnI","http://www.Ocasio2018.com/",,"https://pbs.twimg.com/profile_banners/138203134/1511815660","http://abs.twimg.com/images/themes/theme1/bg.png","http://pbs.twimg.com/profile_images/923274881197895680/AbHcStkl_normal.jpg"
"x138203134","x1253397983510573058",2020-04-23 18:59:00,"AOC","🗣 Rent is due on May 1st and Republicans are fighting against rent and mortgage relief https://t.co/YJmQxpTdvr","Twitter for iPhone",86,,,,TRUE,FALSE,80033,18407,,,,,"twitter.com/QuickTake/stat…","https://t.co/YJmQxpTdvr","https://twitter.com/QuickTake/status/1253396212386062337",,,,,,,,,,,"en","x1253396212386062337","During House debate on another #coronavirus rescue bill, @AOC said, “It is a joke when Republicans say they have urgency around this bill. The only folks they have urgency around are folks like Ruth’s Chris Steak House and Shake Shack” https://t.co/8baIb1wks6",2020-04-23 18:51:58,"Blackbird Video Platform/Amplify",19032,4339,"x252751061","QuickTake","Bloomberg QuickTake",1062318,1351,180975,"","Global news the world needs today. Subscribe to our daily newsletter 👉https://t.co/Y2IWiqb6dT",TRUE,,,,,,,,,,,,,,,,,,,,,,"NA NA","NA NA","NA NA NA NA NA NA NA NA","https://twitter.com/AOC/status/1253397983510573058","Alexandria Ocasio-Cortez","Bronx + Queens, NYC","US Representative,NY-14 (BX & Queens). In a modern, moral, & wealthy society, no American should be too poor to live. 💯% People-Funded, no lobbyist💰. She/her.","https://t.co/BYjH4stRnI",FALSE,6858654,2346,17201,10358,23329,2010-04-28 22:38:40,TRUE,"https://t.co/BYjH4stRnI","http://www.Ocasio2018.com/",,"https://pbs.twimg.com/profile_banners/138203134/1511815660","http://abs.twimg.com/images/themes/theme1/bg.png","http://pbs.twimg.com/profile_images/923274881197895680/AbHcStkl_normal.jpg"
"x138203134","x1253371898941104129",2020-04-23 17:15:21,"AOC","@SarahHuckabee Look who’s talking about showing up for work! The woman didn’t hold a press conference for months while holding a job as press sec.

If you’re so supportive of this admin’s plan, why don’t you go out and try delivering groceries for a living w/o health insurance or mass testing?","Twitter for iPhone",279,"x1253332701257424896","x5509762","SarahHuckabee",FALSE,FALSE,16120,2199,,,,,,,,,,,,,,,,"x5509762","SarahHuckabee","en",,,,,,,,,,,,,,,,,,,,,,,,,,,,,,,,,,,,,"NA NA","NA NA","NA NA NA NA NA NA NA NA","https://twitter.com/AOC/status/1253371898941104129","Alexandria Ocasio-Cortez","Bronx + Queens, NYC","US Representative,NY-14 (BX & Queens). In a modern, moral, & wealthy society, no American should be too poor to live. 💯% People-Funded, no lobbyist💰. She/her.","https://t.co/BYjH4stRnI",FALSE,6858654,2346,17201,10358,23329,2010-04-28 22:38:40,TRUE,"https://t.co/BYjH4stRnI","http://www.Ocasio2018.com/",,"https://pbs.twimg.com/profile_banners/138203134/1511815660","http://abs.twimg.com/images/themes/theme1/bg.png","http://pbs.twimg.com/profile_images/923274881197895680/AbHcStkl_normal.jpg"
"x138203134","x1253369283951951873",2020-04-23 17:04:58,"AOC","And by the way, setting up vulnerable workers to grind 70 hours a week to barely survive and STILL not have health insurance is unsafe too.","Twitter for iPhone",139,"x1253368962663972870","x138203134","AOC",FALSE,FALSE,16581,1917,,,,,,,,,,,,,,,,,,"en",,,,,,,,,,,,,,,,,,,,,,,,,,,,,,,,,,,,,"NA NA","NA NA","NA NA NA NA NA NA NA NA","https://twitter.com/AOC/status/1253369283951951873","Alexandria Ocasio-Cortez","Bronx + Queens, NYC","US Representative,NY-14 (BX & Queens). In a modern, moral, & wealthy society, no American should be too poor to live. 💯% People-Funded, no lobbyist💰. She/her.","https://t.co/BYjH4stRnI",FALSE,6858654,2346,17201,10358,23329,2010-04-28 22:38:40,TRUE,"https://t.co/BYjH4stRnI","http://www.Ocasio2018.com/",,"https://pbs.twimg.com/profile_banners/138203134/1511815660","http://abs.twimg.com/images/themes/theme1/bg.png","http://pbs.twimg.com/profile_images/923274881197895680/AbHcStkl_normal.jpg"
"x138203134","x1253368962663972870",2020-04-23 17:03:41,"AOC","Trump has NO PLAN to get people safely back to work. 

GOP Govs like Kemp are sending vulnerable workers to die w/ false claims of safety.

Trump also pushed an unproven, dangerous treatment as a “cure” &amp; firing experts who want to vet claims.

Last thing you care abt is safety. https://t.co/3yEgTp3dqf","Twitter for iPhone",283,,,,TRUE,FALSE,37858,6818,,,,,"twitter.com/SarahHuckabee/…","https://t.co/3yEgTp3dqf","https://twitter.com/SarahHuckabee/status/1253332701257424896",,,,,,,,,,,"en","x1253332701257424896",".@AOC says Americans should boycott work. As usual she’s wrong. The goal should be for Americans to SAFELY return to work because unlike AOC and members of Congress, most of us actually have to show up at work to get paid and support our families! #ProtectLivesProtectLivelihoods",2020-04-23 14:39:36,"Twitter for iPhone",22094,5877,"x5509762","SarahHuckabee","Sarah Huckabee Sanders",589143,2696,3964,"Little Rock, AR","Christian. Wife. Mom to three. Former Press Sec for @realdonaldtrump. @foxnews contributor. Presidential appointee @fulbrightboard. Traveler. Arkansan.",TRUE,,,,,,,,,,,,,,,,,,,,,,"NA NA","NA NA","NA NA NA NA NA NA NA NA","https://twitter.com/AOC/status/1253368962663972870","Alexandria Ocasio-Cortez","Bronx + Queens, NYC","US Representative,NY-14 (BX & Queens). In a modern, moral, & wealthy society, no American should be too poor to live. 💯% People-Funded, no lobbyist💰. She/her.","https://t.co/BYjH4stRnI",FALSE,6858654,2346,17201,10358,23329,2010-04-28 22:38:40,TRUE,"https://t.co/BYjH4stRnI","http://www.Ocasio2018.com/",,"https://pbs.twimg.com/profile_banners/138203134/1511815660","http://abs.twimg.com/images/themes/theme1/bg.png","http://pbs.twimg.com/profile_images/923274881197895680/AbHcStkl_normal.jpg"
"x138203134","x1253364990943387651",2020-04-23 16:47:54,"AOC","Helping people is why we’re here 💜 Glad you’re alright. https://t.co/srLaTG43rs","Twitter for iPhone",55,,,,TRUE,FALSE,15684,1409,,,,,"twitter.com/Buffalogal/sta…","https://t.co/srLaTG43rs","https://twitter.com/Buffalogal/status/1253341732101480449",,,,,,,,,,,"en","x1253341732101480449","So I just received an actual phone call from a real person volunteering for @AOC 's office, asking if I NEEDED ANYTHING--groceries, medication, etc. They are calling all constituents. I almost cried on the phone. Thankfully we are all set, but this is such a wonderful outreach.❤️",2020-04-23 15:15:29,"Twitter Web App",68578,7680,"x14500105","Buffalogal","Nicole Schuman🍕",7034,5063,171147,"Astoria, N.Y.","the older I get/I find that happiness is an extremely uneventful subject.  
✏  @PRNEWS  
Send tips: nschuman@prnewsonline.com #shepersisted",TRUE,,,,,,,,,,,,,,,,,,,,,,"NA NA","NA NA","NA NA NA NA NA NA NA NA","https://twitter.com/AOC/status/1253364990943387651","Alexandria Ocasio-Cortez","Bronx + Queens, NYC","US Representative,NY-14 (BX & Queens). In a modern, moral, & wealthy society, no American should be too poor to live. 💯% People-Funded, no lobbyist💰. She/her.","https://t.co/BYjH4stRnI",FALSE,6858654,2346,17201,10358,23329,2010-04-28 22:38:40,TRUE,"https://t.co/BYjH4stRnI","http://www.Ocasio2018.com/",,"https://pbs.twimg.com/profile_banners/138203134/1511815660","http://abs.twimg.com/images/themes/theme1/bg.png","http://pbs.twimg.com/profile_images/923274881197895680/AbHcStkl_normal.jpg"
"x138203134","x1253343354835869701",2020-04-23 15:21:56,"AOC","@ewarren My heart breaks for your family. I am so very sorry for your loss, and our prayers are with your family.","Twitter for iPhone",104,"x1253332675315724289","x357606935","ewarren",FALSE,FALSE,26052,531,,,,,,,,,,,,,,,,"x357606935","ewarren","en",,,,,,,,,,,,,,,,,,,,,,,,,,,,,,,,,,,,,"NA NA","NA NA","NA NA NA NA NA NA NA NA","https://twitter.com/AOC/status/1253343354835869701","Alexandria Ocasio-Cortez","Bronx + Queens, NYC","US Representative,NY-14 (BX & Queens). In a modern, moral, & wealthy society, no American should be too poor to live. 💯% People-Funded, no lobbyist💰. She/her.","https://t.co/BYjH4stRnI",FALSE,6858654,2346,17201,10358,23329,2010-04-28 22:38:40,TRUE,"https://t.co/BYjH4stRnI","http://www.Ocasio2018.com/",,"https://pbs.twimg.com/profile_banners/138203134/1511815660","http://abs.twimg.com/images/themes/theme1/bg.png","http://pbs.twimg.com/profile_images/923274881197895680/AbHcStkl_normal.jpg"
"x138203134","x1252970086559817728",2020-04-22 14:38:42,"AOC","GOP is seriously arguing that it’s worth sacrificing the lives of hourly workers so they can get a spray tan again.

If they really wanted to reopen the economy, they‘d fund mass testing, contact tracing,&amp; healthcare for people.

Instead they’re fighting against hospital funding.","Twitter for iPhone",284,,,,FALSE,FALSE,145821,33191,,,,,,,,,,,,,,,,,,"en",,,,,,,,,,,,,,,,,,,,,,,,,,,,,,,,,,,,,"NA NA","NA NA","NA NA NA NA NA NA NA NA","https://twitter.com/AOC/status/1252970086559817728","Alexandria Ocasio-Cortez","Bronx + Queens, NYC","US Representative,NY-14 (BX & Queens). In a modern, moral, & wealthy society, no American should be too poor to live. 💯% People-Funded, no lobbyist💰. She/her.","https://t.co/BYjH4stRnI",FALSE,6858654,2346,17201,10358,23329,2010-04-28 22:38:40,TRUE,"https://t.co/BYjH4stRnI","http://www.Ocasio2018.com/",,"https://pbs.twimg.com/profile_banners/138203134/1511815660","http://abs.twimg.com/images/themes/theme1/bg.png","http://pbs.twimg.com/profile_images/923274881197895680/AbHcStkl_normal.jpg"
