"x31013444","x1246028929758113792",2020-04-03 10:57:01,"AyannaPressley","Looking fwd to joining you @ramirotorres &amp; the rest of the @GetUpCrew969 at 7:30am TODAY to share resources, talk about how we cont to build community during #TheRona #QuarantineLife &amp;  #NetflixandFillOutYourCensus https://t.co/DHHaSk3gDn","Twitter for Android",222,,,,TRUE,FALSE,43,6,,,"TheRona QuarantineLife NetflixandFillOutYourCensus",,"twitter.com/ramirotorres/s…","https://t.co/DHHaSk3gDn","https://twitter.com/ramirotorres/status/1246018501967568901",,,,,,,,,"x18744959 x1229986141","ramirotorres GetUpCrew969","en","x1246018501967568901","Day whatever of #Quarantine and the @GetUpCrew969 is STILL HEEEEEEERE!! Check us out. We’ll make you laugh, we’ll make you smile, we’ll talk to @AyannaPressley, we’ll give you money and MoRe!",2020-04-03 10:15:35,"Twitter for iPhone",9,1,"x18744959","ramirotorres","Ramiro Torres",22096,491,21543,"","I say funny things on the Radio...",FALSE,,,,,,,,,,,,,,,,,,,,,,"NA NA","NA NA","NA NA NA NA NA NA NA NA","https://twitter.com/AyannaPressley/status/1246028929758113792","Ayanna Pressley","Dorchester, MA","Your Congresswoman. Proudly representing the MA 7th. Here to break concrete ceilings & shake the table. Personal account. She/hers. #ChangeCantWait","https://t.co/CiUeOmggQ1",FALSE,608126,15921,2843,21534,17828,2009-04-14 01:06:07,TRUE,"https://t.co/CiUeOmggQ1","http://ayannapressley.com/volunteer",,"https://pbs.twimg.com/profile_banners/31013444/1529090066","http://abs.twimg.com/images/themes/theme1/bg.png","http://pbs.twimg.com/profile_images/1015233088832655366/eWpQtTqh_normal.jpg"
"x31013444","x1245808412602109952",2020-04-02 20:20:46,"AyannaPressley","*why* you need","Twitter for Android",14,"x1245806732242116613","x31013444","AyannaPressley",FALSE,FALSE,131,7,,,,,,,,,,,,,,,,,,"en",,,,,,,,,,,,,,,,,,,,,,,,,,,,,,,,,,,,,"NA NA","NA NA","NA NA NA NA NA NA NA NA","https://twitter.com/AyannaPressley/status/1245808412602109952","Ayanna Pressley","Dorchester, MA","Your Congresswoman. Proudly representing the MA 7th. Here to break concrete ceilings & shake the table. Personal account. She/hers. #ChangeCantWait","https://t.co/CiUeOmggQ1",FALSE,608126,15921,2843,21534,17828,2009-04-14 01:06:07,TRUE,"https://t.co/CiUeOmggQ1","http://ayannapressley.com/volunteer",,"https://pbs.twimg.com/profile_banners/31013444/1529090066","http://abs.twimg.com/images/themes/theme1/bg.png","http://pbs.twimg.com/profile_images/1015233088832655366/eWpQtTqh_normal.jpg"
"x31013444","x1245806733479428100",2020-04-02 20:14:05,"AyannaPressley","The Occupant has the nerve to refer to some of our Govs as ""complainers"". They are doing their job, fighting &amp; advocating for their states. You've forced them to beg to save lives via Twitter videos because of your criminally incompetent, science denial, sluggish azz response.","Twitter for Android",281,"x1245806732242116613","x31013444","AyannaPressley",FALSE,FALSE,1550,241,,,,,,,,,,,,,,,,,,"en",,,,,,,,,,,,,,,,,,,,,,,,,,,,,,,,,,,,,"NA NA","NA NA","NA NA NA NA NA NA NA NA","https://twitter.com/AyannaPressley/status/1245806733479428100","Ayanna Pressley","Dorchester, MA","Your Congresswoman. Proudly representing the MA 7th. Here to break concrete ceilings & shake the table. Personal account. She/hers. #ChangeCantWait","https://t.co/CiUeOmggQ1",FALSE,608126,15921,2843,21534,17828,2009-04-14 01:06:07,TRUE,"https://t.co/CiUeOmggQ1","http://ayannapressley.com/volunteer",,"https://pbs.twimg.com/profile_banners/31013444/1529090066","http://abs.twimg.com/images/themes/theme1/bg.png","http://pbs.twimg.com/profile_images/1015233088832655366/eWpQtTqh_normal.jpg"
"x31013444","x1245806732242116613",2020-04-02 20:14:05,"AyannaPressley","To those who've expressed the opinion that we need elected leaders who are legislators, not activists. I hope this moment reaffirms while you need both. In the face of every izm, callous, cruel, &amp; criminal policies, it is the ONLY way to get anything.","Twitter for Android",255,,,,FALSE,FALSE,3298,417,,,,,,,,,,,,,,,,,,"en",,,,,,,,,,,,,,,,,,,,,,,,,,,,,,,,,,,,,"NA NA","NA NA","NA NA NA NA NA NA NA NA","https://twitter.com/AyannaPressley/status/1245806732242116613","Ayanna Pressley","Dorchester, MA","Your Congresswoman. Proudly representing the MA 7th. Here to break concrete ceilings & shake the table. Personal account. She/hers. #ChangeCantWait","https://t.co/CiUeOmggQ1",FALSE,608126,15921,2843,21534,17828,2009-04-14 01:06:07,TRUE,"https://t.co/CiUeOmggQ1","http://ayannapressley.com/volunteer",,"https://pbs.twimg.com/profile_banners/31013444/1529090066","http://abs.twimg.com/images/themes/theme1/bg.png","http://pbs.twimg.com/profile_images/1015233088832655366/eWpQtTqh_normal.jpg"
"x31013444","x1245780658678628352",2020-04-02 18:30:29,"AyannaPressley","@cturner3rd @AdamHSays Correct!","Twitter for Android",8,"x1245780172416208900","x440441695","cturner3rd",FALSE,FALSE,175,1,,,,,,,,,,,,,,,,"x440441695 x85764133","cturner3rd AdamHSays","en",,,,,,,,,,,,,,,,,,,,,,,,,,,,,,,,,,,,,"NA NA","NA NA","NA NA NA NA NA NA NA NA","https://twitter.com/AyannaPressley/status/1245780658678628352","Ayanna Pressley","Dorchester, MA","Your Congresswoman. Proudly representing the MA 7th. Here to break concrete ceilings & shake the table. Personal account. She/hers. #ChangeCantWait","https://t.co/CiUeOmggQ1",FALSE,608126,15921,2843,21534,17828,2009-04-14 01:06:07,TRUE,"https://t.co/CiUeOmggQ1","http://ayannapressley.com/volunteer",,"https://pbs.twimg.com/profile_banners/31013444/1529090066","http://abs.twimg.com/images/themes/theme1/bg.png","http://pbs.twimg.com/profile_images/1015233088832655366/eWpQtTqh_normal.jpg"
"x31013444","x1245751426904731649",2020-04-02 16:34:19,"AyannaPressley","@AdamHSays ""He possessed an incredibly shrewd, complicated, problem-solving intelligence, coupled with a supple, and often jaunty, verbal capacity.""","Twitter for Android",137,"x1245585085149011970","x85764133","AdamHSays",FALSE,FALSE,1854,50,,,,,,,,,,,,,,,,"x85764133","AdamHSays","en",,,,,,,,,,,,,,,,,,,,,,,,,,,,,,,,,,,,,"NA NA","NA NA","NA NA NA NA NA NA NA NA","https://twitter.com/AyannaPressley/status/1245751426904731649","Ayanna Pressley","Dorchester, MA","Your Congresswoman. Proudly representing the MA 7th. Here to break concrete ceilings & shake the table. Personal account. She/hers. #ChangeCantWait","https://t.co/CiUeOmggQ1",FALSE,608126,15921,2843,21534,17828,2009-04-14 01:06:07,TRUE,"https://t.co/CiUeOmggQ1","http://ayannapressley.com/volunteer",,"https://pbs.twimg.com/profile_banners/31013444/1529090066","http://abs.twimg.com/images/themes/theme1/bg.png","http://pbs.twimg.com/profile_images/1015233088832655366/eWpQtTqh_normal.jpg"
