"x216776631","x1238210867734380551",2020-03-12 21:10:50,"BernieSanders","Health care is a human right.","Twitter Web App",29,,,,FALSE,FALSE,410757,91619,,,,,,,,,,,,,,,,,,"en",,,,,,,,,,,,,,,,,,,,,,,,,,,,,,,,,,,,,"NA NA","NA NA","NA NA NA NA NA NA NA NA","https://twitter.com/BernieSanders/status/1238210867734380551","Bernie Sanders","Vermont","U.S. Senator from Vermont and candidate for President of the United States.","https://t.co/IzINQxlG01",FALSE,11404877,1460,22209,17650,975,2010-11-17 17:53:52,TRUE,"https://t.co/IzINQxlG01","https://BernieSanders.com/vote",,"https://pbs.twimg.com/profile_banners/216776631/1574466140","http://abs.twimg.com/images/themes/theme1/bg.png","http://pbs.twimg.com/profile_images/1097820307388334080/9ddg5F6v_normal.png"
"x216776631","x1238207884539944960",2020-03-12 20:58:59,"BernieSanders","Illinois: You have until 5 p.m. today to request a vote by mail ballot. It only takes a few minutes to apply. https://t.co/sYg8HB3z6K","Twitter Web App",109,,,,TRUE,FALSE,26643,6146,,,,,"twitter.com/chicagotribune…","https://t.co/sYg8HB3z6K","https://twitter.com/chicagotribune/status/1238130822009491458",,,,,,,,,,,"en","x1238130822009491458","Applications to vote by mail in Illinois' primary election on Tuesday need to be postmarked by 5 p.m. today https://t.co/oVUvOwOiAu",2020-03-12 15:52:45,"SocialFlow",214,187,"x7313362","chicagotribune","Chicago Tribune",1107451,403,202945,"Chicago, IL","Breaking news since 1847.",TRUE,,,,,,,,,,,,,,,,,,,,,,"NA NA","NA NA","NA NA NA NA NA NA NA NA","https://twitter.com/BernieSanders/status/1238207884539944960","Bernie Sanders","Vermont","U.S. Senator from Vermont and candidate for President of the United States.","https://t.co/IzINQxlG01",FALSE,11404877,1460,22209,17650,975,2010-11-17 17:53:52,TRUE,"https://t.co/IzINQxlG01","https://BernieSanders.com/vote",,"https://pbs.twimg.com/profile_banners/216776631/1574466140","http://abs.twimg.com/images/themes/theme1/bg.png","http://pbs.twimg.com/profile_images/1097820307388334080/9ddg5F6v_normal.png"
"x216776631","x1238204612093624328",2020-03-12 20:45:58,"BernieSanders","It is an absolute moral imperative that our response — as a government, as a society, as business communities, and as individuals — meets the enormity of this crisis.

Read and watch my full remarks to the nation today:
https://t.co/ik4Xq1Pkwz","Twitter Web App",243,,,,FALSE,FALSE,13274,3340,,,,,"berniesanders.com/bernie-address…","https://t.co/ik4Xq1Pkwz","https://berniesanders.com/bernie-addresses-nation-health-and-economic-crisis/",,,,,,,,,,,"en",,,,,,,,,,,,,,,,,,,,,,,,,,,,,,,,,,,,,"NA NA","NA NA","NA NA NA NA NA NA NA NA","https://twitter.com/BernieSanders/status/1238204612093624328","Bernie Sanders","Vermont","U.S. Senator from Vermont and candidate for President of the United States.","https://t.co/IzINQxlG01",FALSE,11404877,1460,22209,17650,975,2010-11-17 17:53:52,TRUE,"https://t.co/IzINQxlG01","https://BernieSanders.com/vote",,"https://pbs.twimg.com/profile_banners/216776631/1574466140","http://abs.twimg.com/images/themes/theme1/bg.png","http://pbs.twimg.com/profile_images/1097820307388334080/9ddg5F6v_normal.png"
"x216776631","x1238194533734797313",2020-03-12 20:05:56,"BernieSanders","In this economic crisis, we need to place an immediate moratorium on evictions, foreclosures, and utility shut-offs.","Twitter Web App",116,,,,FALSE,FALSE,82554,15498,,,,,,,,,,,,,,,,,,"en",,,,,,,,,,,,,,,,,,,,,,,,,,,,,,,,,,,,,"NA NA","NA NA","NA NA NA NA NA NA NA NA","https://twitter.com/BernieSanders/status/1238194533734797313","Bernie Sanders","Vermont","U.S. Senator from Vermont and candidate for President of the United States.","https://t.co/IzINQxlG01",FALSE,11404877,1460,22209,17650,975,2010-11-17 17:53:52,TRUE,"https://t.co/IzINQxlG01","https://BernieSanders.com/vote",,"https://pbs.twimg.com/profile_banners/216776631/1574466140","http://abs.twimg.com/images/themes/theme1/bg.png","http://pbs.twimg.com/profile_images/1097820307388334080/9ddg5F6v_normal.png"
"x216776631","x1238191326165962753",2020-03-12 19:53:11,"BernieSanders","While we work to pass Medicare for All, the U.S. government must be clear that in the midst of this emergency, everyone in our country—regardless of income or where they live—must be able to get the health care they need without cost. https://t.co/d1kkGJfqay","Twitter Media Studio",234,,,,FALSE,FALSE,16813,3763,,,,,,,,"http://pbs.twimg.com/media/ES7wTFFXgAE0tem.jpg","https://t.co/d1kkGJfqay","https://twitter.com/BernieSanders/status/1238191326165962753/video/1","photo","http://pbs.twimg.com/media/ES7wTFFXgAE0tem.jpg","https://t.co/d1kkGJfqay","https://twitter.com/BernieSanders/status/1238191326165962753/video/1",,,,"en",,,,,,,,,,,,,,,,,,,,,,,,,,,,,,,,,,,,,"NA NA","NA NA","NA NA NA NA NA NA NA NA","https://twitter.com/BernieSanders/status/1238191326165962753","Bernie Sanders","Vermont","U.S. Senator from Vermont and candidate for President of the United States.","https://t.co/IzINQxlG01",FALSE,11404877,1460,22209,17650,975,2010-11-17 17:53:52,TRUE,"https://t.co/IzINQxlG01","https://BernieSanders.com/vote",,"https://pbs.twimg.com/profile_banners/216776631/1574466140","http://abs.twimg.com/images/themes/theme1/bg.png","http://pbs.twimg.com/profile_images/1097820307388334080/9ddg5F6v_normal.png"
"x216776631","x1238189014399832066",2020-03-12 19:44:00,"BernieSanders","We are dealing with a national emergency and the president should declare one now.","Twitter Web App",82,,,,FALSE,FALSE,95214,10855,,,,,,,,,,,,,,,,,,"en",,,,,,,,,,,,,,,,,,,,,,,,,,,,,,,,,,,,,"NA NA","NA NA","NA NA NA NA NA NA NA NA","https://twitter.com/BernieSanders/status/1238189014399832066","Bernie Sanders","Vermont","U.S. Senator from Vermont and candidate for President of the United States.","https://t.co/IzINQxlG01",FALSE,11404877,1460,22209,17650,975,2010-11-17 17:53:52,TRUE,"https://t.co/IzINQxlG01","https://BernieSanders.com/vote",,"https://pbs.twimg.com/profile_banners/216776631/1574466140","http://abs.twimg.com/images/themes/theme1/bg.png","http://pbs.twimg.com/profile_images/1097820307388334080/9ddg5F6v_normal.png"
"x216776631","x1238180790376202240",2020-03-12 19:11:19,"BernieSanders","It will be easy to feel like we are in this alone, or that we must only worry about ourselves and let everyone else fend for themselves.

That would be a very dangerous mistake.

We must remember that we are in this together. https://t.co/rabSkn27cs","Twitter Media Studio",225,,,,FALSE,FALSE,53409,12695,,,,,,,,"http://pbs.twimg.com/media/ES7mvHfXsAIuoGV.jpg","https://t.co/rabSkn27cs","https://twitter.com/BernieSanders/status/1238180790376202240/video/1","photo","http://pbs.twimg.com/media/ES7mvHfXsAIuoGV.jpg","https://t.co/rabSkn27cs","https://twitter.com/BernieSanders/status/1238180790376202240/video/1",,,,"en",,,,,,,,,,,,,,,,,,,,,,,,,,,,,,,,,,,,,"NA NA","NA NA","NA NA NA NA NA NA NA NA","https://twitter.com/BernieSanders/status/1238180790376202240","Bernie Sanders","Vermont","U.S. Senator from Vermont and candidate for President of the United States.","https://t.co/IzINQxlG01",FALSE,11404877,1460,22209,17650,975,2010-11-17 17:53:52,TRUE,"https://t.co/IzINQxlG01","https://BernieSanders.com/vote",,"https://pbs.twimg.com/profile_banners/216776631/1574466140","http://abs.twimg.com/images/themes/theme1/bg.png","http://pbs.twimg.com/profile_images/1097820307388334080/9ddg5F6v_normal.png"
"x216776631","x1238176340370526208",2020-03-12 18:53:38,"BernieSanders","We need real action and leadership to protect the American people. I'm addressing the nation regarding the health and economic crisis facing the country. Watch live: https://t.co/Q0uOd4n2Vu","Periscope",189,,,,FALSE,FALSE,13238,3671,,,,,"pscp.tv/w/cTkrMjMyNzU3…","https://t.co/Q0uOd4n2Vu","https://www.pscp.tv/w/cTkrMjMyNzU3OTl8MXpxSlZscHlBWWxLQkG6UaJiG1qQmxuEE-0ecdwJCYYzeJ9SdEw-SlKsvcc3",,,,,,,,,,,"en",,,,,,,,,,,,,,,,,,,,,,,,,,,,,,,,,,,,,"NA NA","NA NA","NA NA NA NA NA NA NA NA","https://twitter.com/BernieSanders/status/1238176340370526208","Bernie Sanders","Vermont","U.S. Senator from Vermont and candidate for President of the United States.","https://t.co/IzINQxlG01",FALSE,11404877,1460,22209,17650,975,2010-11-17 17:53:52,TRUE,"https://t.co/IzINQxlG01","https://BernieSanders.com/vote",,"https://pbs.twimg.com/profile_banners/216776631/1574466140","http://abs.twimg.com/images/themes/theme1/bg.png","http://pbs.twimg.com/profile_images/1097820307388334080/9ddg5F6v_normal.png"
"x216776631","x1238170168842506240",2020-03-12 18:29:06,"BernieSanders","If there ever was a moment that showed us the need for all people to be able to get health care regardless of their income, this is that moment. Medicare for All now.","Twitter Web App",166,,,,FALSE,FALSE,150478,31019,,,,,,,,,,,,,,,,,,"en",,,,,,,,,,,,,,,,,,,,,,,,,,,,,,,,,,,,,"NA NA","NA NA","NA NA NA NA NA NA NA NA","https://twitter.com/BernieSanders/status/1238170168842506240","Bernie Sanders","Vermont","U.S. Senator from Vermont and candidate for President of the United States.","https://t.co/IzINQxlG01",FALSE,11404877,1460,22209,17650,975,2010-11-17 17:53:52,TRUE,"https://t.co/IzINQxlG01","https://BernieSanders.com/vote",,"https://pbs.twimg.com/profile_banners/216776631/1574466140","http://abs.twimg.com/images/themes/theme1/bg.png","http://pbs.twimg.com/profile_images/1097820307388334080/9ddg5F6v_normal.png"
"x216776631","x1238163036382400512",2020-03-12 18:00:46,"BernieSanders","I'll be addressing the public from Burlington at 3 p.m. ET today regarding the health and economic crisis facing the country. Please tune in at https://t.co/vreIiWfeoS.","Twitter for iPhone",168,,,,FALSE,FALSE,16768,2380,,,,,"live.berniesanders.com","https://t.co/vreIiWfeoS","http://live.berniesanders.com",,,,,,,,,,,"en",,,,,,,,,,,,,,,,,,,,,,,,,,,,,,,,,,,,,"NA NA","NA NA","NA NA NA NA NA NA NA NA","https://twitter.com/BernieSanders/status/1238163036382400512","Bernie Sanders","Vermont","U.S. Senator from Vermont and candidate for President of the United States.","https://t.co/IzINQxlG01",FALSE,11404877,1460,22209,17650,975,2010-11-17 17:53:52,TRUE,"https://t.co/IzINQxlG01","https://BernieSanders.com/vote",,"https://pbs.twimg.com/profile_banners/216776631/1574466140","http://abs.twimg.com/images/themes/theme1/bg.png","http://pbs.twimg.com/profile_images/1097820307388334080/9ddg5F6v_normal.png"
"x216776631","x1238158850899038210",2020-03-12 17:44:08,"BernieSanders","We need to join every other major country on Earth to guarantee paid leave to all people. And we should do it right now on an emergency basis.","Twitter Web App",142,,,,FALSE,FALSE,85536,13690,,,,,,,,,,,,,,,,,,"en",,,,,,,,,,,,,,,,,,,,,,,,,,,,,,,,,,,,,"NA NA","NA NA","NA NA NA NA NA NA NA NA","https://twitter.com/BernieSanders/status/1238158850899038210","Bernie Sanders","Vermont","U.S. Senator from Vermont and candidate for President of the United States.","https://t.co/IzINQxlG01",FALSE,11404877,1460,22209,17650,975,2010-11-17 17:53:52,TRUE,"https://t.co/IzINQxlG01","https://BernieSanders.com/vote",,"https://pbs.twimg.com/profile_banners/216776631/1574466140","http://abs.twimg.com/images/themes/theme1/bg.png","http://pbs.twimg.com/profile_images/1097820307388334080/9ddg5F6v_normal.png"
"x216776631","x1238131046157295616",2020-03-12 15:53:39,"BernieSanders","Our campaign continues to win the vast majority of the votes of younger people.

In order to win in the future, you need to win the voters who represent the future of our country, and you must speak to the issues of concern to them.

That is how you defeat Donald Trump.","Twitter Web App",270,,,,FALSE,FALSE,56496,7908,,,,,,,,,,,,,,,,,,"en",,,,,,,,,,,,,,,,,,,,,,,,,,,,,,,,,,,,,"NA NA","NA NA","NA NA NA NA NA NA NA NA","https://twitter.com/BernieSanders/status/1238131046157295616","Bernie Sanders","Vermont","U.S. Senator from Vermont and candidate for President of the United States.","https://t.co/IzINQxlG01",FALSE,11404877,1460,22209,17650,975,2010-11-17 17:53:52,TRUE,"https://t.co/IzINQxlG01","https://BernieSanders.com/vote",,"https://pbs.twimg.com/profile_banners/216776631/1574466140","http://abs.twimg.com/images/themes/theme1/bg.png","http://pbs.twimg.com/profile_images/1097820307388334080/9ddg5F6v_normal.png"
