"x939091","x1246119929809641472",2020-04-03 16:58:37,"JoeBiden","This is another clear warning sign that more needs to be done to keep as many people on payroll as possible. Fast, bold action to bolster American workers now will save more pain later. Congress must get to work immediately on the next package. We can't afford to waste time. https://t.co/MGOztrldFE","Twitter Web App",275,,,,TRUE,FALSE,4649,1600,,,,,"twitter.com/cnnbrk/status/…","https://t.co/MGOztrldFE","https://twitter.com/cnnbrk/status/1246056705693224960",,,,,,,,,,,"en","x1246056705693224960","The monthly jobs report shows the US economy shed 701,000 jobs in March and the unemployment rate rose to 4.4%. The report doesn't reflect the past two weeks of skyrocketing layoffs. https://t.co/NCWzvJJRaO https://t.co/LKFNyIZ40w",2020-04-03 12:47:23,"TweetDeck",632,293,"x428333","cnnbrk","CNN Breaking News",57304195,120,70145,"Everywhere","Breaking news from CNN Digital. Now 56M strong. Check @cnn for all things CNN, breaking and more. Download the app for custom alerts: https://t.co/UCHG9M367J",TRUE,,,,,,,,,,,,,,,,,,,,,,"NA NA","NA NA","NA NA NA NA NA NA NA NA","https://twitter.com/JoeBiden/status/1246119929809641472","Joe Biden","Wilmington, DE","Senator, Vice President, 2020 candidate for President of the United States, husband to @DrBiden, proud father & grandfather. Loves ice cream, aviators & @Amtrak","https://t.co/UClrPuJpyZ",FALSE,4825439,26,16766,4403,18,2007-03-11 17:51:24,TRUE,"https://t.co/UClrPuJpyZ","http://joebiden.com",,"https://pbs.twimg.com/profile_banners/939091/1569000846","http://abs.twimg.com/images/themes/theme1/bg.png","http://pbs.twimg.com/profile_images/1235244704859664385/oneP6BrA_normal.jpg"
"x939091","x1246106938104074242",2020-04-03 16:07:00,"JoeBiden","Now more than ever, we need to choose hope over fear. We will beat COVID-19. We will overcome this. Together.","TweetDeck",109,,,,FALSE,FALSE,61824,9119,,,,,,,,,,,,,,,,,,"en",,,,,,,,,,,,,,,,,,,,,,,,,,,,,,,,,,,,,"NA NA","NA NA","NA NA NA NA NA NA NA NA","https://twitter.com/JoeBiden/status/1246106938104074242","Joe Biden","Wilmington, DE","Senator, Vice President, 2020 candidate for President of the United States, husband to @DrBiden, proud father & grandfather. Loves ice cream, aviators & @Amtrak","https://t.co/UClrPuJpyZ",FALSE,4825439,26,16766,4403,18,2007-03-11 17:51:24,TRUE,"https://t.co/UClrPuJpyZ","http://joebiden.com",,"https://pbs.twimg.com/profile_banners/939091/1569000846","http://abs.twimg.com/images/themes/theme1/bg.png","http://pbs.twimg.com/profile_images/1235244704859664385/oneP6BrA_normal.jpg"
"x939091","x1246085043862339586",2020-04-03 14:40:00,"JoeBiden","Wisconsin — you have until 5 PM CT tonight to request your mail-in absentee ballot ahead of next week’s primary. Head to https://t.co/hkOfDswg34 to request yours today. https://t.co/6Ldcy3QBT6","TweetDeck",168,,,,FALSE,FALSE,6071,3388,,,,,"myvote.wi.gov/en-US/VoteAbse…","https://t.co/hkOfDswg34","https://myvote.wi.gov/en-US/VoteAbsentee","http://pbs.twimg.com/media/EUr67OlWAAEGM_1.jpg","https://t.co/6Ldcy3QBT6","https://twitter.com/JoeBiden/status/1246085043862339586/photo/1","photo","http://pbs.twimg.com/media/EUr67OlWAAEGM_1.jpg","https://t.co/6Ldcy3QBT6","https://twitter.com/JoeBiden/status/1246085043862339586/photo/1",,,,"en",,,,,,,,,,,,,,,,,,,,,,,,,,,,,,,,,,,,,"NA NA","NA NA","NA NA NA NA NA NA NA NA","https://twitter.com/JoeBiden/status/1246085043862339586","Joe Biden","Wilmington, DE","Senator, Vice President, 2020 candidate for President of the United States, husband to @DrBiden, proud father & grandfather. Loves ice cream, aviators & @Amtrak","https://t.co/UClrPuJpyZ",FALSE,4825439,26,16766,4403,18,2007-03-11 17:51:24,TRUE,"https://t.co/UClrPuJpyZ","http://joebiden.com",,"https://pbs.twimg.com/profile_banners/939091/1569000846","http://abs.twimg.com/images/themes/theme1/bg.png","http://pbs.twimg.com/profile_images/1235244704859664385/oneP6BrA_normal.jpg"
"x939091","x1245871134127443979",2020-04-03 00:30:00,"JoeBiden","The evidence is clear: Donald Trump ignored the warnings. He failed to act. And now Americans are paying the price. https://t.co/1qROBGtsSs","TweetDeck",139,,,,FALSE,FALSE,51072,16408,,,,,"thedailybeast.com/army-warned-in…","https://t.co/1qROBGtsSs","https://www.thedailybeast.com/army-warned-in-early-february-that-coronavirus-could-kill-150000-americans",,,,,,,,,,,"en",,,,,,,,,,,,,,,,,,,,,,,,,,,,,,,,,,,,,"NA NA","NA NA","NA NA NA NA NA NA NA NA","https://twitter.com/JoeBiden/status/1245871134127443979","Joe Biden","Wilmington, DE","Senator, Vice President, 2020 candidate for President of the United States, husband to @DrBiden, proud father & grandfather. Loves ice cream, aviators & @Amtrak","https://t.co/UClrPuJpyZ",FALSE,4825439,26,16766,4403,18,2007-03-11 17:51:24,TRUE,"https://t.co/UClrPuJpyZ","http://joebiden.com",,"https://pbs.twimg.com/profile_banners/939091/1569000846","http://abs.twimg.com/images/themes/theme1/bg.png","http://pbs.twimg.com/profile_images/1235244704859664385/oneP6BrA_normal.jpg"
"x939091","x1245857293045911558",2020-04-02 23:35:00,"JoeBiden","Real courage is confronting something that you're afraid to do and doing it anyway. That’s what people across this country are doing every single day in the face of this crisis. They are American heroes. https://t.co/KQQiU9P8xz","Twitter Media Studio",203,,,,FALSE,FALSE,12601,3414,,,,,,,,"http://pbs.twimg.com/amplify_video_thumb/1245853896867753984/img/NXg56T7ELRGx4q8g.jpg","https://t.co/KQQiU9P8xz","https://twitter.com/JoeBiden/status/1245857293045911558/video/1","photo","http://pbs.twimg.com/amplify_video_thumb/1245853896867753984/img/NXg56T7ELRGx4q8g.jpg","https://t.co/KQQiU9P8xz","https://twitter.com/JoeBiden/status/1245857293045911558/video/1",,,,"en",,,,,,,,,,,,,,,,,,,,,,,,,,,,,,,,,,,,,"NA NA","NA NA","NA NA NA NA NA NA NA NA","https://twitter.com/JoeBiden/status/1245857293045911558","Joe Biden","Wilmington, DE","Senator, Vice President, 2020 candidate for President of the United States, husband to @DrBiden, proud father & grandfather. Loves ice cream, aviators & @Amtrak","https://t.co/UClrPuJpyZ",FALSE,4825439,26,16766,4403,18,2007-03-11 17:51:24,TRUE,"https://t.co/UClrPuJpyZ","http://joebiden.com",,"https://pbs.twimg.com/profile_banners/939091/1569000846","http://abs.twimg.com/images/themes/theme1/bg.png","http://pbs.twimg.com/profile_images/1235244704859664385/oneP6BrA_normal.jpg"
"x939091","x1245824577516613636",2020-04-02 21:25:00,"JoeBiden","In order for our government to work for all Americans, it's important it be representative of all Americans. With openly LGBTQ individuals only making up .17% of elected officials, we have work to do.

This National #OutToWin Day, I'm asking: Will you run? https://t.co/QvM6IINN4T","TweetDeck",280,,,,FALSE,FALSE,4141,1113,,,"OutToWin",,"victoryinstitute.org/outtowin/","https://t.co/QvM6IINN4T","https://victoryinstitute.org/outtowin/",,,,,,,,,,,"en",,,,,,,,,,,,,,,,,,,,,,,,,,,,,,,,,,,,,"NA NA","NA NA","NA NA NA NA NA NA NA NA","https://twitter.com/JoeBiden/status/1245824577516613636","Joe Biden","Wilmington, DE","Senator, Vice President, 2020 candidate for President of the United States, husband to @DrBiden, proud father & grandfather. Loves ice cream, aviators & @Amtrak","https://t.co/UClrPuJpyZ",FALSE,4825439,26,16766,4403,18,2007-03-11 17:51:24,TRUE,"https://t.co/UClrPuJpyZ","http://joebiden.com",,"https://pbs.twimg.com/profile_banners/939091/1569000846","http://abs.twimg.com/images/themes/theme1/bg.png","http://pbs.twimg.com/profile_images/1235244704859664385/oneP6BrA_normal.jpg"
"x939091","x1245806188731621377",2020-04-02 20:11:56,"JoeBiden","I'm about to roll out my plan to make the economic recovery work. Tune in now: https://t.co/fLTDvwK1wf","Periscope",102,,,,FALSE,FALSE,7641,2413,,,,,"pscp.tv/w/cVTtCzFvUEVM…","https://t.co/fLTDvwK1wf","https://www.pscp.tv/w/cVTtCzFvUEVMQkJiT2xyS2R8MUx5R0JOQkJwanpHTvtgmJJB1YncBErRF6xfhlH83HCzNyN_rPM-a1hk5b2O",,,,,,,,,,,"en",,,,,,,,,,,,,,,,,,,,,,,,,,,,,,,,,,,,,"NA NA","NA NA","NA NA NA NA NA NA NA NA","https://twitter.com/JoeBiden/status/1245806188731621377","Joe Biden","Wilmington, DE","Senator, Vice President, 2020 candidate for President of the United States, husband to @DrBiden, proud father & grandfather. Loves ice cream, aviators & @Amtrak","https://t.co/UClrPuJpyZ",FALSE,4825439,26,16766,4403,18,2007-03-11 17:51:24,TRUE,"https://t.co/UClrPuJpyZ","http://joebiden.com",,"https://pbs.twimg.com/profile_banners/939091/1569000846","http://abs.twimg.com/images/themes/theme1/bg.png","http://pbs.twimg.com/profile_images/1235244704859664385/oneP6BrA_normal.jpg"
"x939091","x1245788730532810760",2020-04-02 19:02:33,"JoeBiden","My heart goes out to the millions of Americans who filed unemployment claims in recent weeks, and the millions more who worry what next week holds for them.

Donald Trump needs to take action to ensure Americans receive the economic relief they need as soon as possible. https://t.co/SprkkQzbTo","Twitter Web App",270,,,,TRUE,FALSE,13999,3827,,,,,"twitter.com/nytimes/status…","https://t.co/SprkkQzbTo","https://twitter.com/nytimes/status/1245691808492986375",,,,,,,,,,,"en","x1245691808492986375","Breaking News: Another 6.6 million joined the U.S. unemployment ranks, bringing the 2-week total to a staggering 10 million as the coronavirus pandemic upends the economy https://t.co/Vr7rN0qgkc",2020-04-02 12:37:25,"SocialFlow",967,781,"x807095","nytimes","The New York Times",46119149,899,392182,"New York City","News tips? Share them here: https://t.co/ghL9OoYKMM",TRUE,,,,,,,,,,,,,,,,,,,,,,"NA NA","NA NA","NA NA NA NA NA NA NA NA","https://twitter.com/JoeBiden/status/1245788730532810760","Joe Biden","Wilmington, DE","Senator, Vice President, 2020 candidate for President of the United States, husband to @DrBiden, proud father & grandfather. Loves ice cream, aviators & @Amtrak","https://t.co/UClrPuJpyZ",FALSE,4825439,26,16766,4403,18,2007-03-11 17:51:24,TRUE,"https://t.co/UClrPuJpyZ","http://joebiden.com",,"https://pbs.twimg.com/profile_banners/939091/1569000846","http://abs.twimg.com/images/themes/theme1/bg.png","http://pbs.twimg.com/profile_images/1235244704859664385/oneP6BrA_normal.jpg"
"x939091","x1245773239390883846",2020-04-02 18:01:00,"JoeBiden","I know many folks are feeling anxious and worried. I just want you to know that you're not alone. Americans in every corner of the country are feeling the same exact way you are. We may be physically apart, but we are all in this together — and we will overcome this. I promise.","TweetDeck",278,,,,FALSE,FALSE,61421,10971,,,,,,,,,,,,,,,,,,"en",,,,,,,,,,,,,,,,,,,,,,,,,,,,,,,,,,,,,"NA NA","NA NA","NA NA NA NA NA NA NA NA","https://twitter.com/JoeBiden/status/1245773239390883846","Joe Biden","Wilmington, DE","Senator, Vice President, 2020 candidate for President of the United States, husband to @DrBiden, proud father & grandfather. Loves ice cream, aviators & @Amtrak","https://t.co/UClrPuJpyZ",FALSE,4825439,26,16766,4403,18,2007-03-11 17:51:24,TRUE,"https://t.co/UClrPuJpyZ","http://joebiden.com",,"https://pbs.twimg.com/profile_banners/939091/1569000846","http://abs.twimg.com/images/themes/theme1/bg.png","http://pbs.twimg.com/profile_images/1235244704859664385/oneP6BrA_normal.jpg"
"x939091","x1245747570212823046",2020-04-02 16:19:00,"JoeBiden","Our health care workers on the front lines of this fight still don’t have the masks, gowns, and other protective equipment they need. It’s unacceptable.

Add your name to demand Donald Trump use his full authority to deliver these lifesaving supplies: https://t.co/bnHqHEIp1T","TweetDeck",275,,,,FALSE,FALSE,4860,1663,,,,,"go.joebiden.com/page/s/demand-…","https://t.co/bnHqHEIp1T","https://go.joebiden.com/page/s/demand-trump-take-action",,,,,,,,,,,"en",,,,,,,,,,,,,,,,,,,,,,,,,,,,,,,,,,,,,"NA NA","NA NA","NA NA NA NA NA NA NA NA","https://twitter.com/JoeBiden/status/1245747570212823046","Joe Biden","Wilmington, DE","Senator, Vice President, 2020 candidate for President of the United States, husband to @DrBiden, proud father & grandfather. Loves ice cream, aviators & @Amtrak","https://t.co/UClrPuJpyZ",FALSE,4825439,26,16766,4403,18,2007-03-11 17:51:24,TRUE,"https://t.co/UClrPuJpyZ","http://joebiden.com",,"https://pbs.twimg.com/profile_banners/939091/1569000846","http://abs.twimg.com/images/themes/theme1/bg.png","http://pbs.twimg.com/profile_images/1235244704859664385/oneP6BrA_normal.jpg"
"x939091","x1245727652255858690",2020-04-02 14:59:51,"JoeBiden","The economic damage from this public health crisis is both rising and deepening at an alarming rate. It is putting working families and the American middle class through unimaginable financial pain — and they need to be made whole as fast as possible. https://t.co/QNuB29JcGy","Twitter Web App",275,,,,FALSE,FALSE,15052,4580,,,,,"medium.com/@JoeBiden/stat…","https://t.co/QNuB29JcGy","https://medium.com/@JoeBiden/statement-from-vice-president-joe-biden-on-record-number-of-americans-filing-for-unemployment-ec9e50223e7e",,,,,,,,,,,"en",,,,,,,,,,,,,,,,,,,,,,,,,,,,,,,,,,,,,"NA NA","NA NA","NA NA NA NA NA NA NA NA","https://twitter.com/JoeBiden/status/1245727652255858690","Joe Biden","Wilmington, DE","Senator, Vice President, 2020 candidate for President of the United States, husband to @DrBiden, proud father & grandfather. Loves ice cream, aviators & @Amtrak","https://t.co/UClrPuJpyZ",FALSE,4825439,26,16766,4403,18,2007-03-11 17:51:24,TRUE,"https://t.co/UClrPuJpyZ","http://joebiden.com",,"https://pbs.twimg.com/profile_banners/939091/1569000846","http://abs.twimg.com/images/themes/theme1/bg.png","http://pbs.twimg.com/profile_images/1235244704859664385/oneP6BrA_normal.jpg"
