"x939091","x1261098722852777984",2020-05-15 00:59:00,"JoeBiden","We are months into this crisis. There is simply no excuse for President Trump's failure to implement a national testing strategy.","TweetDeck",129,,,,FALSE,FALSE,113303,20474,,,,,,,,,,,,,,,,,,"en",,,,,,,,,,,,,,,,,,,,,,,,,,,,,,,,,,,,,"NA NA","NA NA","NA NA NA NA NA NA NA NA","https://twitter.com/JoeBiden/status/1261098722852777984","Joe Biden","Wilmington, DE","Senator, Vice President, 2020 candidate for President of the United States, husband to @DrBiden, proud father & grandfather. Loves ice cream, aviators & @Amtrak","https://t.co/UClrPuJpyZ",FALSE,5506005,26,16693,4780,18,2007-03-11 17:51:24,TRUE,"https://t.co/UClrPuJpyZ","http://joebiden.com",,"https://pbs.twimg.com/profile_banners/939091/1589656080","http://abs.twimg.com/images/themes/theme1/bg.png","http://pbs.twimg.com/profile_images/1235244704859664385/oneP6BrA_normal.jpg"
"x939091","x1261090619285540864",2020-05-15 00:26:48,"JoeBiden","Tonight, @StaceyAbrams and I will be joining @Lawrence for a discussion on combating COVID-19 and how we can ensure everyone can make their voice heard this November.

Tune in to @MSNBC at 10 PM ET to watch live. https://t.co/yRr0RJRiu5","Twitter Web App",212,,,,TRUE,FALSE,11434,2620,,,,,"twitter.com/MSNBC/status/1…","https://t.co/yRr0RJRiu5","https://twitter.com/MSNBC/status/1261027503575089155",,,,,,,,,"x216065430 x158426909 x2836421","staceyabrams Lawrence MSNBC","en","x1261027503575089155","Tonight on @TheLastWord:

@Lawrence hosts A Last Word Special: Joe Biden with Stacey Abrams

Have a question you want answered?

Go to https://t.co/wHT2l7ahWt for a chance to participate in the conversation. https://t.co/8IRahTEAFr",2020-05-14 20:16:00,"Twitter Media Studio",431,160,"x2836421","MSNBC","MSNBC",3343064,689,206820,"","The place for in-depth analysis, political commentary and informed perspectives in 2020.",TRUE,,,,,,,,,,,,,,,,,,,,,,"NA NA","NA NA","NA NA NA NA NA NA NA NA","https://twitter.com/JoeBiden/status/1261090619285540864","Joe Biden","Wilmington, DE","Senator, Vice President, 2020 candidate for President of the United States, husband to @DrBiden, proud father & grandfather. Loves ice cream, aviators & @Amtrak","https://t.co/UClrPuJpyZ",FALSE,5506005,26,16693,4780,18,2007-03-11 17:51:24,TRUE,"https://t.co/UClrPuJpyZ","http://joebiden.com",,"https://pbs.twimg.com/profile_banners/939091/1589656080","http://abs.twimg.com/images/themes/theme1/bg.png","http://pbs.twimg.com/profile_images/1235244704859664385/oneP6BrA_normal.jpg"
"x939091","x1261077076465115141",2020-05-14 23:32:59,"JoeBiden","What he said. https://t.co/qfK5oHyFba","Twitter Web App",13,,,,TRUE,FALSE,251293,40655,,,,,"twitter.com/BarackObama/st…","https://t.co/qfK5oHyFba","https://twitter.com/BarackObama/status/1261004586359422979",,,,,,,,,,,"en","x1261004586359422979","Vote.",2020-05-14 18:44:56,"Twitter for iPhone",1859952,329071,"x813286","BarackObama","Barack Obama",117781215,606117,15806,"Washington, DC","Dad, husband, President, citizen.",TRUE,,,,,,,,,,,,,,,,,,,,,,"NA NA","NA NA","NA NA NA NA NA NA NA NA","https://twitter.com/JoeBiden/status/1261077076465115141","Joe Biden","Wilmington, DE","Senator, Vice President, 2020 candidate for President of the United States, husband to @DrBiden, proud father & grandfather. Loves ice cream, aviators & @Amtrak","https://t.co/UClrPuJpyZ",FALSE,5506005,26,16693,4780,18,2007-03-11 17:51:24,TRUE,"https://t.co/UClrPuJpyZ","http://joebiden.com",,"https://pbs.twimg.com/profile_banners/939091/1589656080","http://abs.twimg.com/images/themes/theme1/bg.png","http://pbs.twimg.com/profile_images/1235244704859664385/oneP6BrA_normal.jpg"
"x939091","x1261070033905577985",2020-05-14 23:05:00,"JoeBiden","Donald Trump can deflect and shift blame all he wants, but the hard truth is he failed to protect our nation from the worst public health and economic crisis in our lifetime. https://t.co/5kHQnJrK2a","Twitter Media Studio",174,,,,FALSE,FALSE,37682,14144,,,,,,,,"http://pbs.twimg.com/media/EYA2Le0WoAIqOzm.jpg","https://t.co/5kHQnJrK2a","https://twitter.com/JoeBiden/status/1261070033905577985/video/1","photo","http://pbs.twimg.com/media/EYA2Le0WoAIqOzm.jpg","https://t.co/5kHQnJrK2a","https://twitter.com/JoeBiden/status/1261070033905577985/video/1",,,,"en",,,,,,,,,,,,,,,,,,,,,,,,,,,,,,,,,,,,,"NA NA","NA NA","NA NA NA NA NA NA NA NA","https://twitter.com/JoeBiden/status/1261070033905577985","Joe Biden","Wilmington, DE","Senator, Vice President, 2020 candidate for President of the United States, husband to @DrBiden, proud father & grandfather. Loves ice cream, aviators & @Amtrak","https://t.co/UClrPuJpyZ",FALSE,5506005,26,16693,4780,18,2007-03-11 17:51:24,TRUE,"https://t.co/UClrPuJpyZ","http://joebiden.com",,"https://pbs.twimg.com/profile_banners/939091/1589656080","http://abs.twimg.com/images/themes/theme1/bg.png","http://pbs.twimg.com/profile_images/1235244704859664385/oneP6BrA_normal.jpg"
"x939091","x1261061226886574081",2020-05-14 22:30:00,"JoeBiden","Sherian, a small business owner from South Carolina, recently asked how I would help businesses like hers recover from this crisis and how we can tackle health care disparities among communities of color. They're important questions. Here's what I said: https://t.co/5gfIxhmIoG","TweetDeck",277,,,,FALSE,FALSE,4994,1456,,,,,"medium.com/sincerely-joe/…","https://t.co/5gfIxhmIoG","https://medium.com/sincerely-joe/sincerely-joe-340b5154fe9b",,,,,,,,,,,"en",,,,,,,,,,,,,,,,,,,,,,,,,,,,,,,,,,,,,"NA NA","NA NA","NA NA NA NA NA NA NA NA","https://twitter.com/JoeBiden/status/1261061226886574081","Joe Biden","Wilmington, DE","Senator, Vice President, 2020 candidate for President of the United States, husband to @DrBiden, proud father & grandfather. Loves ice cream, aviators & @Amtrak","https://t.co/UClrPuJpyZ",FALSE,5506005,26,16693,4780,18,2007-03-11 17:51:24,TRUE,"https://t.co/UClrPuJpyZ","http://joebiden.com",,"https://pbs.twimg.com/profile_banners/939091/1589656080","http://abs.twimg.com/images/themes/theme1/bg.png","http://pbs.twimg.com/profile_images/1235244704859664385/oneP6BrA_normal.jpg"
"x939091","x1261034759758675972",2020-05-14 20:44:50,"JoeBiden","The lives of tens of millions of Americans have been thrown into chaos through no fault of their own — and Donald Trump simply isn't doing enough to help them. https://t.co/l9dIMOD2aK","Twitter Web App",159,,,,TRUE,FALSE,19278,5138,,,,,"twitter.com/nytimes/status…","https://t.co/l9dIMOD2aK","https://twitter.com/nytimes/status/1260948066259132419",,,,,,,,,,,"en","x1260948066259132419","Scattered reopenings of stores, nail salons and restaurants around the U.S. have not halted the flood of layoffs. Nearly 3 million new jobless claims brought the 2-month total to more than 36 million, even with some still frustrated in seeking benefits. https://t.co/Lyocp3jFfq",2020-05-14 15:00:20,"SocialFlow",482,237,"x807095","nytimes","The New York Times",46569878,909,396573,"New York City","News tips? Share them here: https://t.co/ghL9OoYKMM",TRUE,,,,,,,,,,,,,,,,,,,,,,"NA NA","NA NA","NA NA NA NA NA NA NA NA","https://twitter.com/JoeBiden/status/1261034759758675972","Joe Biden","Wilmington, DE","Senator, Vice President, 2020 candidate for President of the United States, husband to @DrBiden, proud father & grandfather. Loves ice cream, aviators & @Amtrak","https://t.co/UClrPuJpyZ",FALSE,5506005,26,16693,4780,18,2007-03-11 17:51:24,TRUE,"https://t.co/UClrPuJpyZ","http://joebiden.com",,"https://pbs.twimg.com/profile_banners/939091/1589656080","http://abs.twimg.com/images/themes/theme1/bg.png","http://pbs.twimg.com/profile_images/1235244704859664385/oneP6BrA_normal.jpg"
"x939091","x1261018512920731648",2020-05-14 19:40:16,"JoeBiden","Join me for a virtual roundtable on COVID-19 with Governors Gretchen Whitmer, Phil Murphy and Ned Lamont who are at the forefront of this crisis: https://t.co/qMB1AT6ST1","Periscope",169,,,,FALSE,FALSE,5930,1973,,,,,"pscp.tv/w/cYxEoDFvUEVM…","https://t.co/qMB1AT6ST1","https://www.pscp.tv/w/cYxEoDFvUEVMQkJiT2xyS2R8MU1ZeE5rbnlFamJLdxb3J98w6hGyO2SjZ5B-RhP2mdgqBFKelpktKR1gWXJQ",,,,,,,,,,,"en",,,,,,,,,,,,,,,,,,,,,,,,,,,,,,,,,,,,,"NA NA","NA NA","NA NA NA NA NA NA NA NA","https://twitter.com/JoeBiden/status/1261018512920731648","Joe Biden","Wilmington, DE","Senator, Vice President, 2020 candidate for President of the United States, husband to @DrBiden, proud father & grandfather. Loves ice cream, aviators & @Amtrak","https://t.co/UClrPuJpyZ",FALSE,5506005,26,16693,4780,18,2007-03-11 17:51:24,TRUE,"https://t.co/UClrPuJpyZ","http://joebiden.com",,"https://pbs.twimg.com/profile_banners/939091/1589656080","http://abs.twimg.com/images/themes/theme1/bg.png","http://pbs.twimg.com/profile_images/1235244704859664385/oneP6BrA_normal.jpg"
"x939091","x1261013914025750528",2020-05-14 19:22:00,"JoeBiden","Small businesses are the backbone of this country. We have to do so much more to support them through this crisis. Here's what I would do if I were president: https://t.co/bXq5WtrytM","TweetDeck",182,,,,FALSE,FALSE,7839,2266,,,,,"joebiden.com/smallbusinesse…","https://t.co/bXq5WtrytM","https://joebiden.com/smallbusinesses/",,,,,,,,,,,"en",,,,,,,,,,,,,,,,,,,,,,,,,,,,,,,,,,,,,"NA NA","NA NA","NA NA NA NA NA NA NA NA","https://twitter.com/JoeBiden/status/1261013914025750528","Joe Biden","Wilmington, DE","Senator, Vice President, 2020 candidate for President of the United States, husband to @DrBiden, proud father & grandfather. Loves ice cream, aviators & @Amtrak","https://t.co/UClrPuJpyZ",FALSE,5506005,26,16693,4780,18,2007-03-11 17:51:24,TRUE,"https://t.co/UClrPuJpyZ","http://joebiden.com",,"https://pbs.twimg.com/profile_banners/939091/1589656080","http://abs.twimg.com/images/themes/theme1/bg.png","http://pbs.twimg.com/profile_images/1235244704859664385/oneP6BrA_normal.jpg"
"x939091","x1260986986820599812",2020-05-14 17:35:00,"JoeBiden","With the void of leadership in the White House, governors across the country have stepped up to meet this moment. This afternoon, I’ll be joined by a few of them for a roundtable discussion on COVID-19. 

Tune in at 3:30 PM ET to watch: https://t.co/xk0GcS7PGq https://t.co/1EONVfE0pk","TweetDeck",260,,,,FALSE,FALSE,5904,1800,,,,,"JoeBiden.com/Live","https://t.co/xk0GcS7PGq","http://JoeBiden.com/Live","http://pbs.twimg.com/media/EX_rRcIWoAIypMW.jpg","https://t.co/1EONVfE0pk","https://twitter.com/JoeBiden/status/1260986986820599812/photo/1","photo","http://pbs.twimg.com/media/EX_rRcIWoAIypMW.jpg","https://t.co/1EONVfE0pk","https://twitter.com/JoeBiden/status/1260986986820599812/photo/1",,,,"en",,,,,,,,,,,,,,,,,,,,,,,,,,,,,,,,,,,,,"NA NA","NA NA","NA NA NA NA NA NA NA NA","https://twitter.com/JoeBiden/status/1260986986820599812","Joe Biden","Wilmington, DE","Senator, Vice President, 2020 candidate for President of the United States, husband to @DrBiden, proud father & grandfather. Loves ice cream, aviators & @Amtrak","https://t.co/UClrPuJpyZ",FALSE,5506005,26,16693,4780,18,2007-03-11 17:51:24,TRUE,"https://t.co/UClrPuJpyZ","http://joebiden.com",,"https://pbs.twimg.com/profile_banners/939091/1589656080","http://abs.twimg.com/images/themes/theme1/bg.png","http://pbs.twimg.com/profile_images/1235244704859664385/oneP6BrA_normal.jpg"
"x939091","x1260968615450271744",2020-05-14 16:22:00,"JoeBiden","As the economy continues to spiral downwards and unemployment soars to Great Depression-era levels, we cannot ignore the hard truth: This crisis hit us harder and will take longer to recover from because of Donald Trump’s failures. https://t.co/PYVWy6yG2w","TweetDeck",255,,,,FALSE,FALSE,27433,7964,,,,,"medium.com/@JoeBiden/stat…","https://t.co/PYVWy6yG2w","https://medium.com/@JoeBiden/statement-by-vice-president-joe-biden-on-new-unemployment-insurance-claims-18256a6e32c6",,,,,,,,,,,"en",,,,,,,,,,,,,,,,,,,,,,,,,,,,,,,,,,,,,"NA NA","NA NA","NA NA NA NA NA NA NA NA","https://twitter.com/JoeBiden/status/1260968615450271744","Joe Biden","Wilmington, DE","Senator, Vice President, 2020 candidate for President of the United States, husband to @DrBiden, proud father & grandfather. Loves ice cream, aviators & @Amtrak","https://t.co/UClrPuJpyZ",FALSE,5506005,26,16693,4780,18,2007-03-11 17:51:24,TRUE,"https://t.co/UClrPuJpyZ","http://joebiden.com",,"https://pbs.twimg.com/profile_banners/939091/1589656080","http://abs.twimg.com/images/themes/theme1/bg.png","http://pbs.twimg.com/profile_images/1235244704859664385/oneP6BrA_normal.jpg"
"x939091","x1260936654858137601",2020-05-14 14:15:00,"JoeBiden","There's nothing that the American people cannot accomplish when we stand together — one nation, united in purpose.","TweetDeck",114,,,,FALSE,FALSE,51165,8292,,,,,,,,,,,,,,,,,,"en",,,,,,,,,,,,,,,,,,,,,,,,,,,,,,,,,,,,,"NA NA","NA NA","NA NA NA NA NA NA NA NA","https://twitter.com/JoeBiden/status/1260936654858137601","Joe Biden","Wilmington, DE","Senator, Vice President, 2020 candidate for President of the United States, husband to @DrBiden, proud father & grandfather. Loves ice cream, aviators & @Amtrak","https://t.co/UClrPuJpyZ",FALSE,5506005,26,16693,4780,18,2007-03-11 17:51:24,TRUE,"https://t.co/UClrPuJpyZ","http://joebiden.com",,"https://pbs.twimg.com/profile_banners/939091/1589656080","http://abs.twimg.com/images/themes/theme1/bg.png","http://pbs.twimg.com/profile_images/1235244704859664385/oneP6BrA_normal.jpg"
"x939091","x1260764765556740098",2020-05-14 02:51:58,"JoeBiden","Happy Birthday to the one and only @StevieWonder. https://t.co/AnjAnNiGxB","Twitter Web App",49,,,,FALSE,FALSE,18268,2109,,,,,,,,"http://pbs.twimg.com/media/EX8iZuhXQAckBNw.jpg","https://t.co/AnjAnNiGxB","https://twitter.com/JoeBiden/status/1260764765556740098/photo/1","photo","http://pbs.twimg.com/media/EX8iZuhXQAckBNw.jpg","https://t.co/AnjAnNiGxB","https://twitter.com/JoeBiden/status/1260764765556740098/photo/1",,"x3002508978","StevieWonder","en",,,,,,,,,,,,,,,,,,,,,,,,,,,,,,,,,,,,,"NA NA","NA NA","NA NA NA NA NA NA NA NA","https://twitter.com/JoeBiden/status/1260764765556740098","Joe Biden","Wilmington, DE","Senator, Vice President, 2020 candidate for President of the United States, husband to @DrBiden, proud father & grandfather. Loves ice cream, aviators & @Amtrak","https://t.co/UClrPuJpyZ",FALSE,5506005,26,16693,4780,18,2007-03-11 17:51:24,TRUE,"https://t.co/UClrPuJpyZ","http://joebiden.com",,"https://pbs.twimg.com/profile_banners/939091/1589656080","http://abs.twimg.com/images/themes/theme1/bg.png","http://pbs.twimg.com/profile_images/1235244704859664385/oneP6BrA_normal.jpg"
"x939091","x1260751685959417858",2020-05-14 02:00:00,"JoeBiden","“60 days into the coronavirus crisis, the White House does not have a plan, a framework, a philosophy, or a goal.”

Real presidents lead. Reality TV presidents don’t. https://t.co/hn7GkkPv5Y","TweetDeck",190,,,,FALSE,FALSE,45739,11891,,,,,"vox.com/2020/5/13/2125…","https://t.co/hn7GkkPv5Y","https://www.vox.com/2020/5/13/21255221/trump-coronavirus-plan-covid-reopening-lockdown-liberate",,,,,,,,,,,"en",,,,,,,,,,,,,,,,,,,,,,,,,,,,,,,,,,,,,"NA NA","NA NA","NA NA NA NA NA NA NA NA","https://twitter.com/JoeBiden/status/1260751685959417858","Joe Biden","Wilmington, DE","Senator, Vice President, 2020 candidate for President of the United States, husband to @DrBiden, proud father & grandfather. Loves ice cream, aviators & @Amtrak","https://t.co/UClrPuJpyZ",FALSE,5506005,26,16693,4780,18,2007-03-11 17:51:24,TRUE,"https://t.co/UClrPuJpyZ","http://joebiden.com",,"https://pbs.twimg.com/profile_banners/939091/1589656080","http://abs.twimg.com/images/themes/theme1/bg.png","http://pbs.twimg.com/profile_images/1235244704859664385/oneP6BrA_normal.jpg"
"x939091","x1260744136212140034",2020-05-14 01:30:00,"JoeBiden","Not only does the Trump Administration want to take away health coverage for millions in the middle of a pandemic, but now they want to let people go hungry, too. Their cruelty truly knows no bounds. https://t.co/12JpuMOXEH","TweetDeck",223,,,,FALSE,FALSE,19060,7566,,,,,"time.com/5836504/usda-s…","https://t.co/12JpuMOXEH","https://time.com/5836504/usda-snap-appeal-rule-change/",,,,,,,,,,,"en",,,,,,,,,,,,,,,,,,,,,,,,,,,,,,,,,,,,,"NA NA","NA NA","NA NA NA NA NA NA NA NA","https://twitter.com/JoeBiden/status/1260744136212140034","Joe Biden","Wilmington, DE","Senator, Vice President, 2020 candidate for President of the United States, husband to @DrBiden, proud father & grandfather. Loves ice cream, aviators & @Amtrak","https://t.co/UClrPuJpyZ",FALSE,5506005,26,16693,4780,18,2007-03-11 17:51:24,TRUE,"https://t.co/UClrPuJpyZ","http://joebiden.com",,"https://pbs.twimg.com/profile_banners/939091/1589656080","http://abs.twimg.com/images/themes/theme1/bg.png","http://pbs.twimg.com/profile_images/1235244704859664385/oneP6BrA_normal.jpg"
"x939091","x1260733099652022273",2020-05-14 00:46:08,"JoeBiden","Moments of crisis require swift and decisive action from our leaders, but Donald Trump and his administration have done nothing but dither and delay. They have failed the American people on every single front. https://t.co/Bl4104WqEG","Twitter Web App",209,,,,TRUE,FALSE,18016,4983,,,,,"twitter.com/NPR/status/126…","https://t.co/Bl4104WqEG","https://twitter.com/NPR/status/1260403384106070018",,,,,,,,,,,"en","x1260403384106070018","Despite early warnings about supply shortages, the federal government took months to ramp up production of swabs — a key component most COVID-19 tests need to get started. https://t.co/8yljXWUpTQ",2020-05-13 02:55:58,"SocialFlow",906,550,"x5392522","NPR","NPR",8190520,70078,199078,"","News. Arts & Life. Music & more. This is NPR.

🕵️ Securely send us news tips: https://t.co/LPkf6Tsozm",TRUE,,,,,,,,,,,,,,,,,,,,,,"NA NA","NA NA","NA NA NA NA NA NA NA NA","https://twitter.com/JoeBiden/status/1260733099652022273","Joe Biden","Wilmington, DE","Senator, Vice President, 2020 candidate for President of the United States, husband to @DrBiden, proud father & grandfather. Loves ice cream, aviators & @Amtrak","https://t.co/UClrPuJpyZ",FALSE,5506005,26,16693,4780,18,2007-03-11 17:51:24,TRUE,"https://t.co/UClrPuJpyZ","http://joebiden.com",,"https://pbs.twimg.com/profile_banners/939091/1589656080","http://abs.twimg.com/images/themes/theme1/bg.png","http://pbs.twimg.com/profile_images/1235244704859664385/oneP6BrA_normal.jpg"
"x939091","x1260717021840445452",2020-05-13 23:42:15,"JoeBiden","I would trust the guy who’s one of our nation's top public health experts, not the one who pondered injecting disinfectant into the body and looked directly at a solar eclipse. https://t.co/nMJz1nogpW","Twitter Web App",176,,,,TRUE,FALSE,148095,31685,,,,,"twitter.com/CNN/status/126…","https://t.co/nMJz1nogpW","https://twitter.com/CNN/status/1260335570628366337",,,,,,,,,,,"en","x1260335570628366337","Republican senators are conceding that Dr. Anthony Fauci's testimony warning about moving too quickly to reopen the US economy is inconsistent with President Trump's reopening push, but the GOP is split about which assessment to back https://t.co/RA3pDmgsPO",2020-05-12 22:26:30,"SocialFlow",7099,2273,"x759251","CNN","CNN",48125334,1107,301446,"","It’s our job to #GoThere & tell the most difficult stories. Join us! For more breaking news updates follow @CNNBRK  & Download our app https://t.co/UCHG9M367J",TRUE,,,,,,,,,,,,,,,,,,,,,,"NA NA","NA NA","NA NA NA NA NA NA NA NA","https://twitter.com/JoeBiden/status/1260717021840445452","Joe Biden","Wilmington, DE","Senator, Vice President, 2020 candidate for President of the United States, husband to @DrBiden, proud father & grandfather. Loves ice cream, aviators & @Amtrak","https://t.co/UClrPuJpyZ",FALSE,5506005,26,16693,4780,18,2007-03-11 17:51:24,TRUE,"https://t.co/UClrPuJpyZ","http://joebiden.com",,"https://pbs.twimg.com/profile_banners/939091/1589656080","http://abs.twimg.com/images/themes/theme1/bg.png","http://pbs.twimg.com/profile_images/1235244704859664385/oneP6BrA_normal.jpg"
"x939091","x1260701573765836805",2020-05-13 22:40:52,"JoeBiden","Enough with the anger and division and fear-mongering, Mr. President. It's time for you to step up, appeal to our better angels, and unite the country. We'll overcome this crisis by coming together — not by tearing each other apart. https://t.co/jySlLNWoHG","Twitter Web App",232,,,,TRUE,FALSE,47259,10011,,,,,"twitter.com/realDonaldTrum…","https://t.co/jySlLNWoHG","https://twitter.com/realDonaldTrump/status/1260167707741368320",,,,,,,,,,,"en","x1260167707741368320","Asian Americans are VERY angry at what China has done to our Country, and the World. Chinese Americans are the most angry of all. I don’t blame them!",2020-05-12 11:19:28,"Twitter for iPhone",194998,39140,"x25073877","realDonaldTrump","Donald J. Trump",80130475,46,51868,"Washington, DC","45th President of the United States of America🇺🇸",TRUE,,,,,,,,,,,,,,,,,,,,,,"NA NA","NA NA","NA NA NA NA NA NA NA NA","https://twitter.com/JoeBiden/status/1260701573765836805","Joe Biden","Wilmington, DE","Senator, Vice President, 2020 candidate for President of the United States, husband to @DrBiden, proud father & grandfather. Loves ice cream, aviators & @Amtrak","https://t.co/UClrPuJpyZ",FALSE,5506005,26,16693,4780,18,2007-03-11 17:51:24,TRUE,"https://t.co/UClrPuJpyZ","http://joebiden.com",,"https://pbs.twimg.com/profile_banners/939091/1589656080","http://abs.twimg.com/images/themes/theme1/bg.png","http://pbs.twimg.com/profile_images/1235244704859664385/oneP6BrA_normal.jpg"
"x939091","x1260664864269381635",2020-05-13 20:15:00,"JoeBiden","It didn’t have to be this bad. Donald Trump utterly failed to prepare for this pandemic and delayed in taking the necessary steps to safeguard our nation against the near-worst-case-economic scenario we are now living. https://t.co/oFOuf4GbeB","TweetDeck",242,,,,FALSE,FALSE,25987,7541,,,,,"washingtonpost.com/politics/top-t…","https://t.co/oFOuf4GbeB","https://www.washingtonpost.com/politics/top-trump-economic-advisers-say-unemployment-rate-could-surpass-20-percent-job-market-could-worsen/2020/05/10/3547c296-92e2-11ea-91d7-cf4423d47683_story.html",,,,,,,,,,,"en",,,,,,,,,,,,,,,,,,,,,,,,,,,,,,,,,,,,,"NA NA","NA NA","NA NA NA NA NA NA NA NA","https://twitter.com/JoeBiden/status/1260664864269381635","Joe Biden","Wilmington, DE","Senator, Vice President, 2020 candidate for President of the United States, husband to @DrBiden, proud father & grandfather. Loves ice cream, aviators & @Amtrak","https://t.co/UClrPuJpyZ",FALSE,5506005,26,16693,4780,18,2007-03-11 17:51:24,TRUE,"https://t.co/UClrPuJpyZ","http://joebiden.com",,"https://pbs.twimg.com/profile_banners/939091/1589656080","http://abs.twimg.com/images/themes/theme1/bg.png","http://pbs.twimg.com/profile_images/1235244704859664385/oneP6BrA_normal.jpg"
"x939091","x1260639698529193986",2020-05-13 18:35:00,"JoeBiden","We owe so much to every single worker on the front lines of this crisis. The least we can do is provide them the pay and protection they need and deserve. Here's what I would do if I were president: https://t.co/DBDyKVHt1m","TweetDeck",222,,,,FALSE,FALSE,13724,3760,,,,,"joebiden.com/joe-bidens-4-p…","https://t.co/DBDyKVHt1m","https://joebiden.com/joe-bidens-4-point-plan-for-our-essential-workers/",,,,,,,,,,,"en",,,,,,,,,,,,,,,,,,,,,,,,,,,,,,,,,,,,,"NA NA","NA NA","NA NA NA NA NA NA NA NA","https://twitter.com/JoeBiden/status/1260639698529193986","Joe Biden","Wilmington, DE","Senator, Vice President, 2020 candidate for President of the United States, husband to @DrBiden, proud father & grandfather. Loves ice cream, aviators & @Amtrak","https://t.co/UClrPuJpyZ",FALSE,5506005,26,16693,4780,18,2007-03-11 17:51:24,TRUE,"https://t.co/UClrPuJpyZ","http://joebiden.com",,"https://pbs.twimg.com/profile_banners/939091/1589656080","http://abs.twimg.com/images/themes/theme1/bg.png","http://pbs.twimg.com/profile_images/1235244704859664385/oneP6BrA_normal.jpg"
