"x939091","x1262897980799102976",2020-05-20 00:08:36,"JoeBiden","Fundamentally, this is about whose side the government is on and whether it is accountable to the American people. This is a case I will continue to make, and if elected president will deliver on. https://t.co/x19ZeMOz4v","Twitter Web App",220,"x1262897979666706435","x939091","JoeBiden",FALSE,FALSE,15894,3599,,,,,"miamiherald.com/article2423504…","https://t.co/x19ZeMOz4v","https://www.miamiherald.com/article242350451.html",,,,,,,,,,,"en",,,,,,,,,,,,,,,,,,,,,,,,,,,,,,,,,,,,,"NA NA","NA NA","NA NA NA NA NA NA NA NA","https://twitter.com/JoeBiden/status/1262897980799102976","Joe Biden","Wilmington, DE","Senator, Vice President, 2020 candidate for President of the United States, husband to @DrBiden, proud father & grandfather. Loves ice cream, aviators & @Amtrak","https://t.co/UClrPuJpyZ",FALSE,5506005,26,16693,4780,18,2007-03-11 17:51:24,TRUE,"https://t.co/UClrPuJpyZ","http://joebiden.com",,"https://pbs.twimg.com/profile_banners/939091/1589656080","http://abs.twimg.com/images/themes/theme1/bg.png","http://pbs.twimg.com/profile_images/1235244704859664385/oneP6BrA_normal.jpg"
"x939091","x1262897979666706435",2020-05-20 00:08:36,"JoeBiden","That's exactly why @EWarren and I have called for more oversight. We need more conditions on corporations to ensure relief goes to their workers, not their CEOs. No $500 billion slush fund. No blank checks. The Trump Administration is prioritizing big corporations over workers.","Twitter Web App",278,"x1262897978890768384","x939091","JoeBiden",FALSE,FALSE,19089,3896,,,,,,,,,,,,,,,,"x357606935","ewarren","en",,,,,,,,,,,,,,,,,,,,,,,,,,,,,,,,,,,,,"NA NA","NA NA","NA NA NA NA NA NA NA NA","https://twitter.com/JoeBiden/status/1262897979666706435","Joe Biden","Wilmington, DE","Senator, Vice President, 2020 candidate for President of the United States, husband to @DrBiden, proud father & grandfather. Loves ice cream, aviators & @Amtrak","https://t.co/UClrPuJpyZ",FALSE,5506005,26,16693,4780,18,2007-03-11 17:51:24,TRUE,"https://t.co/UClrPuJpyZ","http://joebiden.com",,"https://pbs.twimg.com/profile_banners/939091/1589656080","http://abs.twimg.com/images/themes/theme1/bg.png","http://pbs.twimg.com/profile_images/1235244704859664385/oneP6BrA_normal.jpg"
"x939091","x1262897978890768384",2020-05-20 00:08:36,"JoeBiden","During today’s Senate Banking Committee hearing, Secretary @StevenMnuchin1 refused to require corporations benefiting from $500 billion in CARES Act funds to keep workers on their payrolls. @EWarren asked him several times, each time he ducked and refused.","Twitter Web App",256,,,,FALSE,FALSE,40337,12847,,,,,,,,,,,,,,,,"x799764016885329921 x357606935","stevenmnuchin1 ewarren","en",,,,,,,,,,,,,,,,,,,,,,,,,,,,,,,,,,,,,"NA NA","NA NA","NA NA NA NA NA NA NA NA","https://twitter.com/JoeBiden/status/1262897978890768384","Joe Biden","Wilmington, DE","Senator, Vice President, 2020 candidate for President of the United States, husband to @DrBiden, proud father & grandfather. Loves ice cream, aviators & @Amtrak","https://t.co/UClrPuJpyZ",FALSE,5506005,26,16693,4780,18,2007-03-11 17:51:24,TRUE,"https://t.co/UClrPuJpyZ","http://joebiden.com",,"https://pbs.twimg.com/profile_banners/939091/1589656080","http://abs.twimg.com/images/themes/theme1/bg.png","http://pbs.twimg.com/profile_images/1235244704859664385/oneP6BrA_normal.jpg"
"x939091","x1262885244509671424",2020-05-19 23:18:00,"JoeBiden","Today, @DrBiden and I are mourning the death of our dear friend, Annie Glenn. Her long life was filled with great love and great meaning, with purpose and her own brand of uncommon courage. https://t.co/JnAuBlF41P","TweetDeck",213,,,,FALSE,FALSE,12487,2318,,,,,"medium.com/@JoeBiden/stat…","https://t.co/JnAuBlF41P","https://medium.com/@JoeBiden/statement-by-vice-president-joe-biden-on-the-passing-of-annie-glenn-1c3ea6d27b9b",,,,,,,,,"x821784477076750338","DrBiden","en",,,,,,,,,,,,,,,,,,,,,,,,,,,,,,,,,,,,,"NA NA","NA NA","NA NA NA NA NA NA NA NA","https://twitter.com/JoeBiden/status/1262885244509671424","Joe Biden","Wilmington, DE","Senator, Vice President, 2020 candidate for President of the United States, husband to @DrBiden, proud father & grandfather. Loves ice cream, aviators & @Amtrak","https://t.co/UClrPuJpyZ",FALSE,5506005,26,16693,4780,18,2007-03-11 17:51:24,TRUE,"https://t.co/UClrPuJpyZ","http://joebiden.com",,"https://pbs.twimg.com/profile_banners/939091/1589656080","http://abs.twimg.com/images/themes/theme1/bg.png","http://pbs.twimg.com/profile_images/1235244704859664385/oneP6BrA_normal.jpg"
"x939091","x1262863098702004224",2020-05-19 21:50:00,"JoeBiden","Tonight, I'll be joining @chefjoseandres for a virtual town hall to discuss the impact of COVID-19 on food security and the restaurant industry — and what our government should be doing to ensure no one in America goes hungry.

Watch live at 7 PM ET: https://t.co/KG9y39EA8s","TweetDeck",274,,,,FALSE,FALSE,7720,2070,,,,,"youtube.com/watch?v=9WyYIt…","https://t.co/KG9y39EA8s","https://www.youtube.com/watch?v=9WyYItglDUs",,,,,,,,,"x73206956","chefjoseandres","en",,,,,,,,,,,,,,,,,,,,,,,,,,,,,,,,,,,,,"NA NA","NA NA","NA NA NA NA NA NA NA NA","https://twitter.com/JoeBiden/status/1262863098702004224","Joe Biden","Wilmington, DE","Senator, Vice President, 2020 candidate for President of the United States, husband to @DrBiden, proud father & grandfather. Loves ice cream, aviators & @Amtrak","https://t.co/UClrPuJpyZ",FALSE,5506005,26,16693,4780,18,2007-03-11 17:51:24,TRUE,"https://t.co/UClrPuJpyZ","http://joebiden.com",,"https://pbs.twimg.com/profile_banners/939091/1589656080","http://abs.twimg.com/images/themes/theme1/bg.png","http://pbs.twimg.com/profile_images/1235244704859664385/oneP6BrA_normal.jpg"
"x939091","x1262835420108292101",2020-05-19 20:00:01,"JoeBiden","Donald Trump is the worst possible person to lead us through this crisis. https://t.co/0H3jyciMou","TweetDeck",97,,,,FALSE,FALSE,60327,11921,,,,,"washingtonpost.com/opinions/trump…","https://t.co/0H3jyciMou","https://www.washingtonpost.com/opinions/trumps-leadership-vacuum-makes-a-feeble-economy-and-resurgent-virus-more-likely/2020/05/17/b53a62c4-96cf-11ea-9f5e-56d8239bf9ad_story.html",,,,,,,,,,,"en",,,,,,,,,,,,,,,,,,,,,,,,,,,,,,,,,,,,,"NA NA","NA NA","NA NA NA NA NA NA NA NA","https://twitter.com/JoeBiden/status/1262835420108292101","Joe Biden","Wilmington, DE","Senator, Vice President, 2020 candidate for President of the United States, husband to @DrBiden, proud father & grandfather. Loves ice cream, aviators & @Amtrak","https://t.co/UClrPuJpyZ",FALSE,5506005,26,16693,4780,18,2007-03-11 17:51:24,TRUE,"https://t.co/UClrPuJpyZ","http://joebiden.com",,"https://pbs.twimg.com/profile_banners/939091/1589656080","http://abs.twimg.com/images/themes/theme1/bg.png","http://pbs.twimg.com/profile_images/1235244704859664385/oneP6BrA_normal.jpg"
"x939091","x1262797667677212672",2020-05-19 17:30:00,"JoeBiden","We need a president who believes in science.","TweetDeck",44,,,,FALSE,FALSE,331611,43254,,,,,,,,,,,,,,,,,,"en",,,,,,,,,,,,,,,,,,,,,,,,,,,,,,,,,,,,,"NA NA","NA NA","NA NA NA NA NA NA NA NA","https://twitter.com/JoeBiden/status/1262797667677212672","Joe Biden","Wilmington, DE","Senator, Vice President, 2020 candidate for President of the United States, husband to @DrBiden, proud father & grandfather. Loves ice cream, aviators & @Amtrak","https://t.co/UClrPuJpyZ",FALSE,5506005,26,16693,4780,18,2007-03-11 17:51:24,TRUE,"https://t.co/UClrPuJpyZ","http://joebiden.com",,"https://pbs.twimg.com/profile_banners/939091/1589656080","http://abs.twimg.com/images/themes/theme1/bg.png","http://pbs.twimg.com/profile_images/1235244704859664385/oneP6BrA_normal.jpg"
"x939091","x1262780460905660424",2020-05-19 16:21:37,"JoeBiden","I am proud to stand with @NationalNurses in calling for a strong OSHA standard for RNs and other frontline health care workers and full utilization of the Defense Production Act to mass produce personal protective equipment. https://t.co/ilhcLlB2Ws","Twitter Web App",224,,,,TRUE,FALSE,12429,3632,,,,,"twitter.com/NNUBonnie/stat…","https://t.co/ilhcLlB2Ws","https://twitter.com/NNUBonnie/status/1261777572494442497",,,,,,,,,"x21146733","NationalNurses","en","x1261777572494442497","Having to make masks from office supplies is unacceptable. We are not expendable!

""Nurses are there to do the job, all we are asking for is protective gear so that we can safely care for our patients. If #nurses aren't safe, patients aren't safe."" - NNU President Zenei Cortez https://t.co/nhePSiAh2w",2020-05-16 21:56:30,"Sprout Social",396,223,"x3506130508","NNUBonnie","Bonnie Castillo",13720,3492,6632,"Oakland, CA","Updates from the front lines of the #COVID19 crisis. Registered #Nurse and Executive Director of @NationalNurses and @Calnurses.",FALSE,,,,,,,,,,,,,,,,,,,,,,"NA NA","NA NA","NA NA NA NA NA NA NA NA","https://twitter.com/JoeBiden/status/1262780460905660424","Joe Biden","Wilmington, DE","Senator, Vice President, 2020 candidate for President of the United States, husband to @DrBiden, proud father & grandfather. Loves ice cream, aviators & @Amtrak","https://t.co/UClrPuJpyZ",FALSE,5506005,26,16693,4780,18,2007-03-11 17:51:24,TRUE,"https://t.co/UClrPuJpyZ","http://joebiden.com",,"https://pbs.twimg.com/profile_banners/939091/1589656080","http://abs.twimg.com/images/themes/theme1/bg.png","http://pbs.twimg.com/profile_images/1235244704859664385/oneP6BrA_normal.jpg"
"x939091","x1262749852976349184",2020-05-19 14:20:00,"JoeBiden","It’s time we reward the people who actually make this country work. Not Wall Street CEOs — but the middle class. Ordinary women and men who are capable of doing extraordinary things when given half a chance.

That's who I'll fight for every single day in the White House.","TweetDeck",271,,,,FALSE,FALSE,52182,10668,,,,,,,,,,,,,,,,,,"en",,,,,,,,,,,,,,,,,,,,,,,,,,,,,,,,,,,,,"NA NA","NA NA","NA NA NA NA NA NA NA NA","https://twitter.com/JoeBiden/status/1262749852976349184","Joe Biden","Wilmington, DE","Senator, Vice President, 2020 candidate for President of the United States, husband to @DrBiden, proud father & grandfather. Loves ice cream, aviators & @Amtrak","https://t.co/UClrPuJpyZ",FALSE,5506005,26,16693,4780,18,2007-03-11 17:51:24,TRUE,"https://t.co/UClrPuJpyZ","http://joebiden.com",,"https://pbs.twimg.com/profile_banners/939091/1589656080","http://abs.twimg.com/images/themes/theme1/bg.png","http://pbs.twimg.com/profile_images/1235244704859664385/oneP6BrA_normal.jpg"
"x939091","x1262548526094929928",2020-05-19 01:00:00,"JoeBiden","Donald Trump is not responsible for the coronavirus. But he does bear full responsibility for failing to protect our nation from the worst public health and economic crisis in our lifetime.","TweetDeck",189,,,,FALSE,FALSE,143201,24936,,,,,,,,,,,,,,,,,,"en",,,,,,,,,,,,,,,,,,,,,,,,,,,,,,,,,,,,,"NA NA","NA NA","NA NA NA NA NA NA NA NA","https://twitter.com/JoeBiden/status/1262548526094929928","Joe Biden","Wilmington, DE","Senator, Vice President, 2020 candidate for President of the United States, husband to @DrBiden, proud father & grandfather. Loves ice cream, aviators & @Amtrak","https://t.co/UClrPuJpyZ",FALSE,5506005,26,16693,4780,18,2007-03-11 17:51:24,TRUE,"https://t.co/UClrPuJpyZ","http://joebiden.com",,"https://pbs.twimg.com/profile_banners/939091/1589656080","http://abs.twimg.com/images/themes/theme1/bg.png","http://pbs.twimg.com/profile_images/1235244704859664385/oneP6BrA_normal.jpg"
"x939091","x1262535439715405824",2020-05-19 00:08:00,"JoeBiden","With your help, we'll defeat Donald Trump. And we won't just rebuild this nation — we’ll transform it. I know times are tough, but if you're able, please chip in today to help make it happen: https://t.co/Wje8LYRL0J","TweetDeck",215,,,,FALSE,FALSE,11259,2825,,,,,"secure.actblue.com/donate/biden20…","https://t.co/Wje8LYRL0J","https://secure.actblue.com/donate/biden2020_fr_q22020-social7?refcode=social-tw-20200518mon&utm_medium=social&utm_source=tw&utm_campaign=20200518mon",,,,,,,,,,,"en",,,,,,,,,,,,,,,,,,,,,,,,,,,,,,,,,,,,,"NA NA","NA NA","NA NA NA NA NA NA NA NA","https://twitter.com/JoeBiden/status/1262535439715405824","Joe Biden","Wilmington, DE","Senator, Vice President, 2020 candidate for President of the United States, husband to @DrBiden, proud father & grandfather. Loves ice cream, aviators & @Amtrak","https://t.co/UClrPuJpyZ",FALSE,5506005,26,16693,4780,18,2007-03-11 17:51:24,TRUE,"https://t.co/UClrPuJpyZ","http://joebiden.com",,"https://pbs.twimg.com/profile_banners/939091/1589656080","http://abs.twimg.com/images/themes/theme1/bg.png","http://pbs.twimg.com/profile_images/1235244704859664385/oneP6BrA_normal.jpg"
"x939091","x1262508260411621377",2020-05-18 22:20:00,"JoeBiden","One of President Trump's top advisors admitted that this administration ""really let the country down"" on testing.

He's right. It's long past time for Trump to step up and implement a national testing strategy so we can begin safely reopening the economy. https://t.co/jDawbgdAzl","TweetDeck",279,,,,FALSE,FALSE,16951,4604,,,,,"cnn.com/2020/05/17/pol…","https://t.co/jDawbgdAzl","https://www.cnn.com/2020/05/17/politics/cdc-official-responds-peter-navarro-coronavirus-response-testing/index.html",,,,,,,,,,,"en",,,,,,,,,,,,,,,,,,,,,,,,,,,,,,,,,,,,,"NA NA","NA NA","NA NA NA NA NA NA NA NA","https://twitter.com/JoeBiden/status/1262508260411621377","Joe Biden","Wilmington, DE","Senator, Vice President, 2020 candidate for President of the United States, husband to @DrBiden, proud father & grandfather. Loves ice cream, aviators & @Amtrak","https://t.co/UClrPuJpyZ",FALSE,5506005,26,16693,4780,18,2007-03-11 17:51:24,TRUE,"https://t.co/UClrPuJpyZ","http://joebiden.com",,"https://pbs.twimg.com/profile_banners/939091/1589656080","http://abs.twimg.com/images/themes/theme1/bg.png","http://pbs.twimg.com/profile_images/1235244704859664385/oneP6BrA_normal.jpg"
"x939091","x1262480579624235008",2020-05-18 20:30:00,"JoeBiden","- Expand vote-by-mail and early voting
- Implement online voter registration
- Ensure everyone can safely vote in-person

We need to do everything in our power to ensure every American can safely make their voice heard this November.","TweetDeck",233,,,,FALSE,FALSE,37540,9178,,,,,,,,,,,,,,,,,,"en",,,,,,,,,,,,,,,,,,,,,,,,,,,,,,,,,,,,,"NA NA","NA NA","NA NA NA NA NA NA NA NA","https://twitter.com/JoeBiden/status/1262480579624235008","Joe Biden","Wilmington, DE","Senator, Vice President, 2020 candidate for President of the United States, husband to @DrBiden, proud father & grandfather. Loves ice cream, aviators & @Amtrak","https://t.co/UClrPuJpyZ",FALSE,5506005,26,16693,4780,18,2007-03-11 17:51:24,TRUE,"https://t.co/UClrPuJpyZ","http://joebiden.com",,"https://pbs.twimg.com/profile_banners/939091/1589656080","http://abs.twimg.com/images/themes/theme1/bg.png","http://pbs.twimg.com/profile_images/1235244704859664385/oneP6BrA_normal.jpg"
"x939091","x1262448924608139269",2020-05-18 18:24:13,"JoeBiden","Companies getting relief from taxpayers have an obligation to protect workers' paychecks, and the Trump Administration has an obligation to hold their feet to the fire to ensure they do.

We need real relief paired with real oversight—not no-strings-attached corporate bailouts. https://t.co/N7MlkNODqh","Twitter Web App",278,,,,TRUE,FALSE,9451,2685,,,,,"twitter.com/MachinistsUnio…","https://t.co/N7MlkNODqh","https://twitter.com/MachinistsUnion/status/1257822271315509248",,,,,,,,,,,"en","x1257822271315509248","If @United wants a fight, we're ready for a fight. https://t.co/VIBLY3XKXI",2020-05-05 23:59:33,"Twitter Web App",414,158,"x74829020","MachinistsUnion","Machinists Union ✈️🚊🚀",21855,2096,16465,"U.S. & Canada","The International Association of Machinists & Aerospace Workers. 600,000 people making North America move. Stay in touch: https://t.co/gcgPb2FbNc",TRUE,,,,,,,,,,,,,,,,,,,,,,"NA NA","NA NA","NA NA NA NA NA NA NA NA","https://twitter.com/JoeBiden/status/1262448924608139269","Joe Biden","Wilmington, DE","Senator, Vice President, 2020 candidate for President of the United States, husband to @DrBiden, proud father & grandfather. Loves ice cream, aviators & @Amtrak","https://t.co/UClrPuJpyZ",FALSE,5506005,26,16693,4780,18,2007-03-11 17:51:24,TRUE,"https://t.co/UClrPuJpyZ","http://joebiden.com",,"https://pbs.twimg.com/profile_banners/939091/1589656080","http://abs.twimg.com/images/themes/theme1/bg.png","http://pbs.twimg.com/profile_images/1235244704859664385/oneP6BrA_normal.jpg"
"x939091","x1262420180690505733",2020-05-18 16:30:00,"JoeBiden","Donald Trump is the most corrupt president in modern American history — and his recovery efforts are making that clearer than ever.","TweetDeck",131,,,,FALSE,FALSE,205997,37708,,,,,,,,,,,,,,,,,,"en",,,,,,,,,,,,,,,,,,,,,,,,,,,,,,,,,,,,,"NA NA","NA NA","NA NA NA NA NA NA NA NA","https://twitter.com/JoeBiden/status/1262420180690505733","Joe Biden","Wilmington, DE","Senator, Vice President, 2020 candidate for President of the United States, husband to @DrBiden, proud father & grandfather. Loves ice cream, aviators & @Amtrak","https://t.co/UClrPuJpyZ",FALSE,5506005,26,16693,4780,18,2007-03-11 17:51:24,TRUE,"https://t.co/UClrPuJpyZ","http://joebiden.com",,"https://pbs.twimg.com/profile_banners/939091/1589656080","http://abs.twimg.com/images/themes/theme1/bg.png","http://pbs.twimg.com/profile_images/1235244704859664385/oneP6BrA_normal.jpg"
"x939091","x1262386206865797124",2020-05-18 14:15:00,"JoeBiden","In the middle of the worst public health crisis in our lifetime, President Trump is actively trying to terminate health insurance for millions of Americans. It's unthinkable.

Here's what I would do to ensure everyone has access to the coverage they need: https://t.co/7kvok6B6if","TweetDeck",279,,,,FALSE,FALSE,19442,5998,,,,,"joebiden.com/fact-sheet-how…","https://t.co/7kvok6B6if","https://joebiden.com/fact-sheet-how-joe-biden-would-help-you-get-health-insurance-coverage-during-the-coronavirus-crisis/",,,,,,,,,,,"en",,,,,,,,,,,,,,,,,,,,,,,,,,,,,,,,,,,,,"NA NA","NA NA","NA NA NA NA NA NA NA NA","https://twitter.com/JoeBiden/status/1262386206865797124","Joe Biden","Wilmington, DE","Senator, Vice President, 2020 candidate for President of the United States, husband to @DrBiden, proud father & grandfather. Loves ice cream, aviators & @Amtrak","https://t.co/UClrPuJpyZ",FALSE,5506005,26,16693,4780,18,2007-03-11 17:51:24,TRUE,"https://t.co/UClrPuJpyZ","http://joebiden.com",,"https://pbs.twimg.com/profile_banners/939091/1589656080","http://abs.twimg.com/images/themes/theme1/bg.png","http://pbs.twimg.com/profile_images/1235244704859664385/oneP6BrA_normal.jpg"
"x939091","x1262186137868595200",2020-05-18 01:00:00,"JoeBiden","In times of crisis, Americans stand as one. It's who we are. And it's how we're going to get through this — together.","TweetDeck",117,,,,FALSE,FALSE,54685,8974,,,,,,,,,,,,,,,,,,"en",,,,,,,,,,,,,,,,,,,,,,,,,,,,,,,,,,,,,"NA NA","NA NA","NA NA NA NA NA NA NA NA","https://twitter.com/JoeBiden/status/1262186137868595200","Joe Biden","Wilmington, DE","Senator, Vice President, 2020 candidate for President of the United States, husband to @DrBiden, proud father & grandfather. Loves ice cream, aviators & @Amtrak","https://t.co/UClrPuJpyZ",FALSE,5506005,26,16693,4780,18,2007-03-11 17:51:24,TRUE,"https://t.co/UClrPuJpyZ","http://joebiden.com",,"https://pbs.twimg.com/profile_banners/939091/1589656080","http://abs.twimg.com/images/themes/theme1/bg.png","http://pbs.twimg.com/profile_images/1235244704859664385/oneP6BrA_normal.jpg"
"x939091","x1262171039863394305",2020-05-18 00:00:00,"JoeBiden","A year ago today, the House passed the #EqualityAct, a long-overdue bill that would ensure LGBTQ+ people are treated with dignity and respect under the law. But @SenateMajLdr won't bring it up for a vote. It's unacceptable.

Passing it will be a top legislative priority of mine.","TweetDeck",279,,,,FALSE,FALSE,26325,6843,,,"EqualityAct",,,,,,,,,,,,,"x1249982359","senatemajldr","en",,,,,,,,,,,,,,,,,,,,,,,,,,,,,,,,,,,,,"NA NA","NA NA","NA NA NA NA NA NA NA NA","https://twitter.com/JoeBiden/status/1262171039863394305","Joe Biden","Wilmington, DE","Senator, Vice President, 2020 candidate for President of the United States, husband to @DrBiden, proud father & grandfather. Loves ice cream, aviators & @Amtrak","https://t.co/UClrPuJpyZ",FALSE,5506005,26,16693,4780,18,2007-03-11 17:51:24,TRUE,"https://t.co/UClrPuJpyZ","http://joebiden.com",,"https://pbs.twimg.com/profile_banners/939091/1589656080","http://abs.twimg.com/images/themes/theme1/bg.png","http://pbs.twimg.com/profile_images/1235244704859664385/oneP6BrA_normal.jpg"
"x939091","x1262154177221808130",2020-05-17 22:53:00,"JoeBiden","I'm incredibly grateful for everyone who has chipped in to help fuel this campaign — especially in times as tough as these. @EWarren and I called a few folks to thank them for their support: https://t.co/FPpttl2wkc","Twitter Media Studio",190,,,,FALSE,FALSE,36550,6849,,,,,,,,"http://pbs.twimg.com/media/EYQMLi6U8AAUbLA.jpg","https://t.co/FPpttl2wkc","https://twitter.com/JoeBiden/status/1262154177221808130/video/1","photo","http://pbs.twimg.com/media/EYQMLi6U8AAUbLA.jpg","https://t.co/FPpttl2wkc","https://twitter.com/JoeBiden/status/1262154177221808130/video/1",,"x357606935","ewarren","en",,,,,,,,,,,,,,,,,,,,,,,,,,,,,,,,,,,,,"NA NA","NA NA","NA NA NA NA NA NA NA NA","https://twitter.com/JoeBiden/status/1262154177221808130","Joe Biden","Wilmington, DE","Senator, Vice President, 2020 candidate for President of the United States, husband to @DrBiden, proud father & grandfather. Loves ice cream, aviators & @Amtrak","https://t.co/UClrPuJpyZ",FALSE,5506005,26,16693,4780,18,2007-03-11 17:51:24,TRUE,"https://t.co/UClrPuJpyZ","http://joebiden.com",,"https://pbs.twimg.com/profile_banners/939091/1589656080","http://abs.twimg.com/images/themes/theme1/bg.png","http://pbs.twimg.com/profile_images/1235244704859664385/oneP6BrA_normal.jpg"
"x939091","x1262133289982164992",2020-05-17 21:30:00,"JoeBiden","As we reflect on the incredible legacy of Brown v. Board of Education, we’re reminded of the urgent work that remains before us 66 years later. We can’t rest until every kid gets a fair shot, and we finally live up to our founding ideals of liberty, justice, and equality for all.","TweetDeck",280,,,,FALSE,FALSE,30713,6167,,,,,,,,,,,,,,,,,,"en",,,,,,,,,,,,,,,,,,,,,,,,,,,,,,,,,,,,,"NA NA","NA NA","NA NA NA NA NA NA NA NA","https://twitter.com/JoeBiden/status/1262133289982164992","Joe Biden","Wilmington, DE","Senator, Vice President, 2020 candidate for President of the United States, husband to @DrBiden, proud father & grandfather. Loves ice cream, aviators & @Amtrak","https://t.co/UClrPuJpyZ",FALSE,5506005,26,16693,4780,18,2007-03-11 17:51:24,TRUE,"https://t.co/UClrPuJpyZ","http://joebiden.com",,"https://pbs.twimg.com/profile_banners/939091/1589656080","http://abs.twimg.com/images/themes/theme1/bg.png","http://pbs.twimg.com/profile_images/1235244704859664385/oneP6BrA_normal.jpg"
"x939091","x1262096469785485318",2020-05-17 19:03:41,"JoeBiden","Moments of crisis require presidents to step up, transcend partisan politics, and unite the nation to achieve a common goal. But Donald Trump has done nothing but stoke division—and we're seeing the effect every day. He is the worst possible person to lead us through this crisis. https://t.co/PEArBTK2id","Twitter Web App",280,,,,TRUE,FALSE,27508,7957,,,,,"twitter.com/NPR/status/126…","https://t.co/PEArBTK2id","https://twitter.com/NPR/status/1261606076853768195",,,,,,,,,,,"en","x1261606076853768195","Disputes over emergency measures have turned into shootings. Armed right-wing groups have threatened contract tracers. 

Researchers who track polarization warn that the pandemic has the potential to inflame divisions to dangerous levels if left unchecked. https://t.co/bVlQn6n4mg",2020-05-16 10:35:02,"SocialFlow",2349,1507,"x5392522","NPR","NPR",8190520,70078,199078,"","News. Arts & Life. Music & more. This is NPR.

🕵️ Securely send us news tips: https://t.co/LPkf6Tsozm",TRUE,,,,,,,,,,,,,,,,,,,,,,"NA NA","NA NA","NA NA NA NA NA NA NA NA","https://twitter.com/JoeBiden/status/1262096469785485318","Joe Biden","Wilmington, DE","Senator, Vice President, 2020 candidate for President of the United States, husband to @DrBiden, proud father & grandfather. Loves ice cream, aviators & @Amtrak","https://t.co/UClrPuJpyZ",FALSE,5506005,26,16693,4780,18,2007-03-11 17:51:24,TRUE,"https://t.co/UClrPuJpyZ","http://joebiden.com",,"https://pbs.twimg.com/profile_banners/939091/1589656080","http://abs.twimg.com/images/themes/theme1/bg.png","http://pbs.twimg.com/profile_images/1235244704859664385/oneP6BrA_normal.jpg"
