"user_id","status_id","created_at","screen_name","text","source","display_text_width","reply_to_status_id","reply_to_user_id","reply_to_screen_name","is_quote","is_retweet","favorite_count","retweet_count","quote_count","reply_count","hashtags","symbols","urls_url","urls_t.co","urls_expanded_url","media_url","media_t.co","media_expanded_url","media_type","ext_media_url","ext_media_t.co","ext_media_expanded_url","ext_media_type","mentions_user_id","mentions_screen_name","lang","quoted_status_id","quoted_text","quoted_created_at","quoted_source","quoted_favorite_count","quoted_retweet_count","quoted_user_id","quoted_screen_name","quoted_name","quoted_followers_count","quoted_friends_count","quoted_statuses_count","quoted_location","quoted_description","quoted_verified","retweet_status_id","retweet_text","retweet_created_at","retweet_source","retweet_favorite_count","retweet_retweet_count","retweet_user_id","retweet_screen_name","retweet_name","retweet_followers_count","retweet_friends_count","retweet_statuses_count","retweet_location","retweet_description","retweet_verified","place_url","place_name","place_full_name","place_type","country","country_code","geo_coords","coords_coords","bbox_coords","status_url","name","location","description","url","protected","followers_count","friends_count","listed_count","statuses_count","favourites_count","account_created_at","verified","profile_url","profile_expanded_url","account_lang","profile_banner_url","profile_background_url","profile_image_url"
"x1082334352711790593","x1253429275685818368",2020-04-23 21:03:21,"Ilhan","Ramadan Mubarak!
 
I know Ramadan will be different this year, but let this season be a reminder to us all of the importance of community, compassion, and prosperity for all.","Twitter Web App",174,,,,FALSE,FALSE,4593,767,,,,,,,,,,,,,,,,,,"en",,,,,,,,,,,,,,,,,,,,,,,,,,,,,,,,,,,,,"NA NA","NA NA","NA NA NA NA NA NA NA NA","https://twitter.com/Ilhan/status/1253429275685818368","Rep. Ilhan Omar","Minneapolis, MN and Washington, DC","Representing Minnesota's 5th District in the People's House. @USProgressives Whip and Midwest Regional Whip.","https://t.co/etKOoQglhI",FALSE,676674,357,1816,2156,1048,2019-01-07 17:53:13,TRUE,"https://t.co/etKOoQglhI","http://omar.house.gov",,"https://pbs.twimg.com/profile_banners/1082334352711790593/1579139444",,"http://pbs.twimg.com/profile_images/1082685661621178373/ledtkemL_normal.jpg"
"x1082334352711790593","x1253414065461841922",2020-04-23 20:02:55,"Ilhan","Absolutely devastating. I just visited this facility last year. 

We need to get more resources and expertise for long-term care facilities ASAP—and make sure their workers are protected too. https://t.co/jlqEtMPzWp","Twitter Web App",191,,,,TRUE,FALSE,281,46,,,,,"twitter.com/KSTP/status/12…","https://t.co/jlqEtMPzWp","https://twitter.com/KSTP/status/1253292557766967297",,,,,,,,,,,"en","x1253292557766967297","Senior care facility hit hard by COVID-19 deaths increases infection prevention efforts https://t.co/SrcIzWMpD2",2020-04-23 12:00:05,"SocialNewsDesk",0,1,"x17278675","KSTP","KSTP",106844,539,145140,"Twin Cities | Minnesota","KSTP-TV, the home of 5 Eyewitness News and ABC in the Twin Cities.  KSTP-TV is a station of Hubbard Broadcasting, Inc., a pioneering broadcast company.",TRUE,,,,,,,,,,,,,,,,,,,,,,"NA NA","NA NA","NA NA NA NA NA NA NA NA","https://twitter.com/Ilhan/status/1253414065461841922","Rep. Ilhan Omar","Minneapolis, MN and Washington, DC","Representing Minnesota's 5th District in the People's House. @USProgressives Whip and Midwest Regional Whip.","https://t.co/etKOoQglhI",FALSE,676674,357,1816,2156,1048,2019-01-07 17:53:13,TRUE,"https://t.co/etKOoQglhI","http://omar.house.gov",,"https://pbs.twimg.com/profile_banners/1082334352711790593/1579139444",,"http://pbs.twimg.com/profile_images/1082685661621178373/ledtkemL_normal.jpg"
"x1082334352711790593","x1253407021216514048",2020-04-23 19:34:55,"Ilhan","We need to cancel rent and mortgages for the duration of the crisis.
We need to provide universal monthly payments to all Americans.
And we need to make sure our states and cities don’t go bankrupt. 
 
We need to pass a fourth relief package immediately. https://t.co/Z4MWPWWKtW","Twitter Media Studio",254,,,,FALSE,FALSE,1740,409,,,,,,,,"http://pbs.twimg.com/amplify_video_thumb/1253404071488339970/img/z1f0GuN9CjSTGCN_.jpg","https://t.co/Z4MWPWWKtW","https://twitter.com/Ilhan/status/1253407021216514048/video/1","photo","http://pbs.twimg.com/amplify_video_thumb/1253404071488339970/img/z1f0GuN9CjSTGCN_.jpg","https://t.co/Z4MWPWWKtW","https://twitter.com/Ilhan/status/1253407021216514048/video/1",,,,"en",,,,,,,,,,,,,,,,,,,,,,,,,,,,,,,,,,,,,"NA NA","NA NA","NA NA NA NA NA NA NA NA","https://twitter.com/Ilhan/status/1253407021216514048","Rep. Ilhan Omar","Minneapolis, MN and Washington, DC","Representing Minnesota's 5th District in the People's House. @USProgressives Whip and Midwest Regional Whip.","https://t.co/etKOoQglhI",FALSE,676674,357,1816,2156,1048,2019-01-07 17:53:13,TRUE,"https://t.co/etKOoQglhI","http://omar.house.gov",,"https://pbs.twimg.com/profile_banners/1082334352711790593/1579139444",,"http://pbs.twimg.com/profile_images/1082685661621178373/ledtkemL_normal.jpg"
"x1082334352711790593","x1253368415206735873",2020-04-23 17:01:31,"Ilhan","Testing has just expanded in Minnesota! 

We now will have the capacity to test 20,000 Minnesotans per day. 

Thank you @GovTimWalz for your leadership on this. https://t.co/YxMFBNorMY","Twitter Web App",160,,,,TRUE,FALSE,528,78,,,,,"twitter.com/GovTimWalz/sta…","https://t.co/YxMFBNorMY","https://twitter.com/GovTimWalz/status/1253041114975797259",,,,,,,,,"x1064603540956565504","GovTimWalz","en","x1253041114975797259","Today we announced a breakthrough in rapid, widespread testing of COVID-19. When Minnesota faces a challenge, we rise up—together. I’m proud to partner with Minnesota’s innovative research and health care systems to pioneer how states can begin to move forward amid COVID-19. https://t.co/82r2RF4UjK",2020-04-22 19:20:56,"Twitter Web App",3951,656,"x1064603540956565504","GovTimWalz","Governor Tim Walz",83764,976,1732,"Minnesota, USA","Dad, husband, teacher, coach, veteran. Governor of Minnesota. Working to build #OneMinnesota.

Visit https://t.co/GaWEw6YeFY for the latest on COVID-19.",TRUE,,,,,,,,,,,,,,,,,,,,,,"NA NA","NA NA","NA NA NA NA NA NA NA NA","https://twitter.com/Ilhan/status/1253368415206735873","Rep. Ilhan Omar","Minneapolis, MN and Washington, DC","Representing Minnesota's 5th District in the People's House. @USProgressives Whip and Midwest Regional Whip.","https://t.co/etKOoQglhI",FALSE,676674,357,1816,2156,1048,2019-01-07 17:53:13,TRUE,"https://t.co/etKOoQglhI","http://omar.house.gov",,"https://pbs.twimg.com/profile_banners/1082334352711790593/1579139444",,"http://pbs.twimg.com/profile_images/1082685661621178373/ledtkemL_normal.jpg"
"x1082334352711790593","x1253324704657444867",2020-04-23 14:07:49,"Ilhan","🚨Our unemployment insurance town hall with @MNDEED will now be held this Friday at 12pm CT. 

Tune in and get your questions answered! https://t.co/i5jmbigNaU","Twitter Web App",134,,,,FALSE,FALSE,139,39,,,,,,,,"http://pbs.twimg.com/media/EWSzllFUEAAtUCJ.jpg","https://t.co/i5jmbigNaU","https://twitter.com/Ilhan/status/1253324704657444867/photo/1","photo","http://pbs.twimg.com/media/EWSzllFUEAAtUCJ.jpg","https://t.co/i5jmbigNaU","https://twitter.com/Ilhan/status/1253324704657444867/photo/1",,"x54329002","mndeed","en",,,,,,,,,,,,,,,,,,,,,,,,,,,,,,,,,,,,,"NA NA","NA NA","NA NA NA NA NA NA NA NA","https://twitter.com/Ilhan/status/1253324704657444867","Rep. Ilhan Omar","Minneapolis, MN and Washington, DC","Representing Minnesota's 5th District in the People's House. @USProgressives Whip and Midwest Regional Whip.","https://t.co/etKOoQglhI",FALSE,676674,357,1816,2156,1048,2019-01-07 17:53:13,TRUE,"https://t.co/etKOoQglhI","http://omar.house.gov",,"https://pbs.twimg.com/profile_banners/1082334352711790593/1579139444",,"http://pbs.twimg.com/profile_images/1082685661621178373/ledtkemL_normal.jpg"
"x1082334352711790593","x1253303860380262401",2020-04-23 12:45:00,"Ilhan","Banks need to suspend all interest fees and penalties. 

No company should be profiting off the backs of hurting Americans.","TweetDeck",123,,,,FALSE,FALSE,3788,650,,,,,,,,,,,,,,,,,,"en",,,,,,,,,,,,,,,,,,,,,,,,,,,,,,,,,,,,,"NA NA","NA NA","NA NA NA NA NA NA NA NA","https://twitter.com/Ilhan/status/1253303860380262401","Rep. Ilhan Omar","Minneapolis, MN and Washington, DC","Representing Minnesota's 5th District in the People's House. @USProgressives Whip and Midwest Regional Whip.","https://t.co/etKOoQglhI",FALSE,676674,357,1816,2156,1048,2019-01-07 17:53:13,TRUE,"https://t.co/etKOoQglhI","http://omar.house.gov",,"https://pbs.twimg.com/profile_banners/1082334352711790593/1579139444",,"http://pbs.twimg.com/profile_images/1082685661621178373/ledtkemL_normal.jpg"
"x1082334352711790593","x1253070591583760385",2020-04-22 21:18:04,"Ilhan","This is exactly why we need vote by mail. https://t.co/j8ZGibhtTy","Twitter Web App",41,,,,TRUE,FALSE,5018,999,,,,,"twitter.com/ajplus/status/…","https://t.co/j8ZGibhtTy","https://twitter.com/ajplus/status/1252758127843217408",,,,,,,,,,,"en","x1252758127843217408","At least seven people are believed to have contracted #COVID19 after voting in Wisconsin's primary election.

Voters and poll workers faced long lines due to reduced polling stations. Many did not have protective gear.

Some officials fear ""this is just the beginning."" https://t.co/33jSgHi6B6",2020-04-22 00:36:27,"Twitter Web App",325,173,"x110396781","ajplus","AJ+",1111103,359,80565,"","AJ+ is news for the connected generation, sharing human struggles and challenging the status quo.",TRUE,,,,,,,,,,,,,,,,,,,,,,"NA NA","NA NA","NA NA NA NA NA NA NA NA","https://twitter.com/Ilhan/status/1253070591583760385","Rep. Ilhan Omar","Minneapolis, MN and Washington, DC","Representing Minnesota's 5th District in the People's House. @USProgressives Whip and Midwest Regional Whip.","https://t.co/etKOoQglhI",FALSE,676674,357,1816,2156,1048,2019-01-07 17:53:13,TRUE,"https://t.co/etKOoQglhI","http://omar.house.gov",,"https://pbs.twimg.com/profile_banners/1082334352711790593/1579139444",,"http://pbs.twimg.com/profile_images/1082685661621178373/ledtkemL_normal.jpg"
"x1082334352711790593","x1253054609599406082",2020-04-22 20:14:34,"Ilhan","Trump is trying to escalate tensions with Iran during a pandemic. 

NO WAR WITH IRAN. https://t.co/UvofDAooXD","Twitter Web App",85,,,,TRUE,FALSE,4573,1023,,,,,"twitter.com/realDonaldTrum…","https://t.co/UvofDAooXD","https://twitter.com/realDonaldTrump/status/1252932181447630848",,,,,,,,,,,"en","x1252932181447630848","I have instructed the United States Navy to shoot down and destroy any and all Iranian gunboats if they harass our ships at sea.",2020-04-22 12:08:05,"Twitter for iPhone",437636,87746,"x25073877","realDonaldTrump","Donald J. Trump",78280547,47,50907,"Washington, DC","45th President of the United States of America🇺🇸",TRUE,,,,,,,,,,,,,,,,,,,,,,"NA NA","NA NA","NA NA NA NA NA NA NA NA","https://twitter.com/Ilhan/status/1253054609599406082","Rep. Ilhan Omar","Minneapolis, MN and Washington, DC","Representing Minnesota's 5th District in the People's House. @USProgressives Whip and Midwest Regional Whip.","https://t.co/etKOoQglhI",FALSE,676674,357,1816,2156,1048,2019-01-07 17:53:13,TRUE,"https://t.co/etKOoQglhI","http://omar.house.gov",,"https://pbs.twimg.com/profile_banners/1082334352711790593/1579139444",,"http://pbs.twimg.com/profile_images/1082685661621178373/ledtkemL_normal.jpg"
"x1082334352711790593","x1253039988872273921",2020-04-22 19:16:28,"Ilhan","This pandemic is a reminder that our existence on Earth is fragile. 

Degraded environments and pollution has increased our vulnerability to contracting the coronavirus/other viruses. 

Climate change will make us more vulnerable to future pandemics if we fail to act. #EarthDay","Twitter Web App",278,,,,FALSE,FALSE,1053,243,,,"EarthDay",,,,,,,,,,,,,,,"en",,,,,,,,,,,,,,,,,,,,,,,,,,,,,,,,,,,,,"NA NA","NA NA","NA NA NA NA NA NA NA NA","https://twitter.com/Ilhan/status/1253039988872273921","Rep. Ilhan Omar","Minneapolis, MN and Washington, DC","Representing Minnesota's 5th District in the People's House. @USProgressives Whip and Midwest Regional Whip.","https://t.co/etKOoQglhI",FALSE,676674,357,1816,2156,1048,2019-01-07 17:53:13,TRUE,"https://t.co/etKOoQglhI","http://omar.house.gov",,"https://pbs.twimg.com/profile_banners/1082334352711790593/1579139444",,"http://pbs.twimg.com/profile_images/1082685661621178373/ledtkemL_normal.jpg"
"x1082334352711790593","x1253020415204773889",2020-04-22 17:58:41,"Ilhan","Refugees are the most vetted travelers in our country and deserve the same protections as everyone else.
 
It’s imperative we don’t turn our backs on those we promised to welcome.
 
I led a letter requesting they receive protections in the next COVID-19 relief package. https://t.co/Bh25u6N3MF","Twitter Web App",269,,,,FALSE,FALSE,567,107,,,,,,,,"http://pbs.twimg.com/media/EWOewlCXkAACnlU.jpg","https://t.co/Bh25u6N3MF","https://twitter.com/Ilhan/status/1253020415204773889/photo/1","photo","http://pbs.twimg.com/media/EWOewlCXkAACnlU.jpg http://pbs.twimg.com/media/EWOewlCWAAIfxt2.jpg","https://t.co/Bh25u6N3MF https://t.co/Bh25u6N3MF","https://twitter.com/Ilhan/status/1253020415204773889/photo/1 https://twitter.com/Ilhan/status/1253020415204773889/photo/1",,,,"en",,,,,,,,,,,,,,,,,,,,,,,,,,,,,,,,,,,,,"NA NA","NA NA","NA NA NA NA NA NA NA NA","https://twitter.com/Ilhan/status/1253020415204773889","Rep. Ilhan Omar","Minneapolis, MN and Washington, DC","Representing Minnesota's 5th District in the People's House. @USProgressives Whip and Midwest Regional Whip.","https://t.co/etKOoQglhI",FALSE,676674,357,1816,2156,1048,2019-01-07 17:53:13,TRUE,"https://t.co/etKOoQglhI","http://omar.house.gov",,"https://pbs.twimg.com/profile_banners/1082334352711790593/1579139444",,"http://pbs.twimg.com/profile_images/1082685661621178373/ledtkemL_normal.jpg"
"x1082334352711790593","x1253001564182261760",2020-04-22 16:43:47,"Ilhan","Important read from MN State Rep. Frank Hornstein.

""White nationalism thrives during times of economic distress and uncertainty...The current crisis is putting our basic values of decency and democracy to the test.""
https://t.co/lfFHfa6hpc","Twitter Web App",240,,,,FALSE,FALSE,506,145,,,,,"forward.com/opinion/444300…","https://t.co/lfFHfa6hpc","https://forward.com/opinion/444300/holocaust-trivialization-at-protests-isnt-just-offensive-it-threatens/",,,,,,,,,,,"en",,,,,,,,,,,,,,,,,,,,,,,,,,,,,,,,,,,,,"NA NA","NA NA","NA NA NA NA NA NA NA NA","https://twitter.com/Ilhan/status/1253001564182261760","Rep. Ilhan Omar","Minneapolis, MN and Washington, DC","Representing Minnesota's 5th District in the People's House. @USProgressives Whip and Midwest Regional Whip.","https://t.co/etKOoQglhI",FALSE,676674,357,1816,2156,1048,2019-01-07 17:53:13,TRUE,"https://t.co/etKOoQglhI","http://omar.house.gov",,"https://pbs.twimg.com/profile_banners/1082334352711790593/1579139444",,"http://pbs.twimg.com/profile_images/1082685661621178373/ledtkemL_normal.jpg"
"x1082334352711790593","x1252993317480136706",2020-04-22 16:11:01,"Ilhan","Sanctions haven’t worked in North Korea.
Sanctions haven’t worked in Iran.
Sanctions haven’t worked in Cuba.
 
It’s time Congress rethinks the humanitarian, human rights, and geographical impacts of our sanctions. https://t.co/fRPnmvF7Gi","Twitter Web App",237,,,,FALSE,FALSE,3795,746,,,,,,,,"http://pbs.twimg.com/ext_tw_video_thumb/1252971512841175041/pu/img/6EtwMSDXfF5qPQ4X.jpg","https://t.co/fRPnmvF7Gi","https://twitter.com/WomenCrossDMZ/status/1252982292261122051/video/1","photo","http://pbs.twimg.com/ext_tw_video_thumb/1252971512841175041/pu/img/6EtwMSDXfF5qPQ4X.jpg","https://t.co/fRPnmvF7Gi","https://twitter.com/WomenCrossDMZ/status/1252982292261122051/video/1",,,,"en",,,,,,,,,,,,,,,,,,,,,,,,,,,,,,,,,,,,,"NA NA","NA NA","NA NA NA NA NA NA NA NA","https://twitter.com/Ilhan/status/1252993317480136706","Rep. Ilhan Omar","Minneapolis, MN and Washington, DC","Representing Minnesota's 5th District in the People's House. @USProgressives Whip and Midwest Regional Whip.","https://t.co/etKOoQglhI",FALSE,676674,357,1816,2156,1048,2019-01-07 17:53:13,TRUE,"https://t.co/etKOoQglhI","http://omar.house.gov",,"https://pbs.twimg.com/profile_banners/1082334352711790593/1579139444",,"http://pbs.twimg.com/profile_images/1082685661621178373/ledtkemL_normal.jpg"
"x1082334352711790593","x1252945248671674370",2020-04-22 13:00:00,"Ilhan","Trump continues to project blame for his failings. https://t.co/bXdIxfvMy4","Twitter Media Studio",50,,,,FALSE,FALSE,1255,378,,,,,,,,"http://pbs.twimg.com/amplify_video_thumb/1252723902058504192/img/0rYBZ4YyeitBRsJI.jpg","https://t.co/bXdIxfvMy4","https://twitter.com/Ilhan/status/1252945248671674370/video/1","photo","http://pbs.twimg.com/amplify_video_thumb/1252723902058504192/img/0rYBZ4YyeitBRsJI.jpg","https://t.co/bXdIxfvMy4","https://twitter.com/Ilhan/status/1252945248671674370/video/1",,,,"en",,,,,,,,,,,,,,,,,,,,,,,,,,,,,,,,,,,,,"NA NA","NA NA","NA NA NA NA NA NA NA NA","https://twitter.com/Ilhan/status/1252945248671674370","Rep. Ilhan Omar","Minneapolis, MN and Washington, DC","Representing Minnesota's 5th District in the People's House. @USProgressives Whip and Midwest Regional Whip.","https://t.co/etKOoQglhI",FALSE,676674,357,1816,2156,1048,2019-01-07 17:53:13,TRUE,"https://t.co/etKOoQglhI","http://omar.house.gov",,"https://pbs.twimg.com/profile_banners/1082334352711790593/1579139444",,"http://pbs.twimg.com/profile_images/1082685661621178373/ledtkemL_normal.jpg"
"x1082334352711790593","x1252708714668326913",2020-04-21 21:20:06,"Ilhan","Do you have questions about unemployment benefits?
 
I’ll be answering your questions with @MNDEED this Thursday at 12pm CT on Facebook.
 
Make sure you tune in! https://t.co/qWDRCWLRWU https://t.co/AhERkUMURb","Twitter for iPhone",185,,,,FALSE,FALSE,109,31,,,,,"facebook.com/events/2995308…","https://t.co/qWDRCWLRWU","https://www.facebook.com/events/299530894363978/","http://pbs.twimg.com/media/EWKD7uUWkAAVUOo.jpg","https://t.co/AhERkUMURb","https://twitter.com/Ilhan/status/1252708714668326913/photo/1","photo","http://pbs.twimg.com/media/EWKD7uUWkAAVUOo.jpg","https://t.co/AhERkUMURb","https://twitter.com/Ilhan/status/1252708714668326913/photo/1",,"x54329002","mndeed","en",,,,,,,,,,,,,,,,,,,,,,,,,,,,,,,,,,,,,"NA NA","NA NA","NA NA NA NA NA NA NA NA","https://twitter.com/Ilhan/status/1252708714668326913","Rep. Ilhan Omar","Minneapolis, MN and Washington, DC","Representing Minnesota's 5th District in the People's House. @USProgressives Whip and Midwest Regional Whip.","https://t.co/etKOoQglhI",FALSE,676674,357,1816,2156,1048,2019-01-07 17:53:13,TRUE,"https://t.co/etKOoQglhI","http://omar.house.gov",,"https://pbs.twimg.com/profile_banners/1082334352711790593/1579139444",,"http://pbs.twimg.com/profile_images/1082685661621178373/ledtkemL_normal.jpg"
"x1082334352711790593","x1252690292735688705",2020-04-21 20:06:54,"Ilhan","Bailouts for fossil fuel corporations.

Breadcrumbs for working people. https://t.co/YMO0UVYxbf","Twitter Web App",71,,,,TRUE,FALSE,2362,557,,,,,"twitter.com/realDonaldTrum…","https://t.co/YMO0UVYxbf","https://twitter.com/realDonaldTrump/status/1252591306028785667",,,,,,,,,,,"en","x1252591306028785667","We will never let the great U.S. Oil &amp; Gas Industry down. I have instructed the Secretary of Energy and Secretary of the Treasury to formulate a plan which will make funds available so that these very important companies and jobs will be secured long into the future!",2020-04-21 13:33:34,"Twitter for iPhone",162454,32915,"x25073877","realDonaldTrump","Donald J. Trump",78280547,47,50907,"Washington, DC","45th President of the United States of America🇺🇸",TRUE,,,,,,,,,,,,,,,,,,,,,,"NA NA","NA NA","NA NA NA NA NA NA NA NA","https://twitter.com/Ilhan/status/1252690292735688705","Rep. Ilhan Omar","Minneapolis, MN and Washington, DC","Representing Minnesota's 5th District in the People's House. @USProgressives Whip and Midwest Regional Whip.","https://t.co/etKOoQglhI",FALSE,676674,357,1816,2156,1048,2019-01-07 17:53:13,TRUE,"https://t.co/etKOoQglhI","http://omar.house.gov",,"https://pbs.twimg.com/profile_banners/1082334352711790593/1579139444",,"http://pbs.twimg.com/profile_images/1082685661621178373/ledtkemL_normal.jpg"
"x1082334352711790593","x1252670672393953281",2020-04-21 18:48:56,"Ilhan","There are so many challenges before us.  

One thing I know: We are in this together. 

Read about how my office and I are #Fightingforthe5th during this pandemic. 

https://t.co/tw6YbtLgFe","Twitter Web App",189,,,,FALSE,FALSE,403,78,,,"Fightingforthe5th",,"medium.com/@RepIlhanOmar/…","https://t.co/tw6YbtLgFe","https://medium.com/@RepIlhanOmar/fighting-for-the-5th-during-the-coronavirus-pandemic-80779354625d",,,,,,,,,,,"en",,,,,,,,,,,,,,,,,,,,,,,,,,,,,,,,,,,,,"NA NA","NA NA","NA NA NA NA NA NA NA NA","https://twitter.com/Ilhan/status/1252670672393953281","Rep. Ilhan Omar","Minneapolis, MN and Washington, DC","Representing Minnesota's 5th District in the People's House. @USProgressives Whip and Midwest Regional Whip.","https://t.co/etKOoQglhI",FALSE,676674,357,1816,2156,1048,2019-01-07 17:53:13,TRUE,"https://t.co/etKOoQglhI","http://omar.house.gov",,"https://pbs.twimg.com/profile_banners/1082334352711790593/1579139444",,"http://pbs.twimg.com/profile_images/1082685661621178373/ledtkemL_normal.jpg"
"x1082334352711790593","x1252653449512194048",2020-04-21 17:40:30,"Ilhan","Proud to join @BettyMcCollum04 @RepAngieCraig @RepDeanPhillips and Collin Peterson to fight for more relief for Minnesotans! https://t.co/cM0MKYbhlR","Twitter Web App",124,,,,TRUE,FALSE,129,28,,,,,"twitter.com/BettyMcCollum0…","https://t.co/cM0MKYbhlR","https://twitter.com/BettyMcCollum04/status/1252644025573744640",,,,,,,,,"x516880804 x1080222360643485698 x1061310112013434882","BettyMcCollum04 RepAngieCraig RepDeanPhillips","en","x1252644025573744640","My MN Dem colleagues &amp; I are asking for $1 billion for the Community Development Financial Institutions (CDFI) Fund in the next #COVID19 emergency aid package. CDFIs play a crucial role in helping small businesses &amp; our most vulnerable communities stay afloat during this crisis. https://t.co/UtRUgIgk1t",2020-04-21 17:03:03,"Twitter Web App",23,5,"x516880804","BettyMcCollum04","BettyMcCollum04",37219,1072,8634,"Minnesota","Proudly representing Minnesota's Fourth District in the United States House of Representatives.",TRUE,,,,,,,,,,,,,,,,,,,,,,"NA NA","NA NA","NA NA NA NA NA NA NA NA","https://twitter.com/Ilhan/status/1252653449512194048","Rep. Ilhan Omar","Minneapolis, MN and Washington, DC","Representing Minnesota's 5th District in the People's House. @USProgressives Whip and Midwest Regional Whip.","https://t.co/etKOoQglhI",FALSE,676674,357,1816,2156,1048,2019-01-07 17:53:13,TRUE,"https://t.co/etKOoQglhI","http://omar.house.gov",,"https://pbs.twimg.com/profile_banners/1082334352711790593/1579139444",,"http://pbs.twimg.com/profile_images/1082685661621178373/ledtkemL_normal.jpg"
"x1082334352711790593","x1252642347902476288",2020-04-21 16:56:23,"Ilhan","ATTN: Recipients of Social Security and Railroad Retirement Board who don’t typically file tax returns AND have eligible dependents. You need to update your info with the IRS by tomorrow.  

If your info is not updated, you can’t claim the dependent tax credit until 2021.","Twitter Web App",272,,,,FALSE,FALSE,332,152,,,,,,,,,,,,,,,,,,"en",,,,,,,,,,,,,,,,,,,,,,,,,,,,,,,,,,,,,"NA NA","NA NA","NA NA NA NA NA NA NA NA","https://twitter.com/Ilhan/status/1252642347902476288","Rep. Ilhan Omar","Minneapolis, MN and Washington, DC","Representing Minnesota's 5th District in the People's House. @USProgressives Whip and Midwest Regional Whip.","https://t.co/etKOoQglhI",FALSE,676674,357,1816,2156,1048,2019-01-07 17:53:13,TRUE,"https://t.co/etKOoQglhI","http://omar.house.gov",,"https://pbs.twimg.com/profile_banners/1082334352711790593/1579139444",,"http://pbs.twimg.com/profile_images/1082685661621178373/ledtkemL_normal.jpg"
"x1082334352711790593","x1252613059543289862",2020-04-21 15:00:00,"Ilhan","Now would be a good time to stop drilling for oil. https://t.co/SaUwDgGEyN","Twitter Web App",50,,,,TRUE,FALSE,6074,726,,,,,"twitter.com/business/statu…","https://t.co/SaUwDgGEyN","https://twitter.com/business/status/1252282516154744834",,,,,,,,,,,"en","x1252282516154744834","Oil drops below $5 a barrel https://t.co/mlMSY87h74 https://t.co/rqCAeHxqEP",2020-04-20 17:06:32,"SocialFlow",1939,1552,"x34713362","business","Bloomberg",6288806,1286,566188,"New York and the World","The first word in business news.",TRUE,,,,,,,,,,,,,,,,,,,,,,"NA NA","NA NA","NA NA NA NA NA NA NA NA","https://twitter.com/Ilhan/status/1252613059543289862","Rep. Ilhan Omar","Minneapolis, MN and Washington, DC","Representing Minnesota's 5th District in the People's House. @USProgressives Whip and Midwest Regional Whip.","https://t.co/etKOoQglhI",FALSE,676674,357,1816,2156,1048,2019-01-07 17:53:13,TRUE,"https://t.co/etKOoQglhI","http://omar.house.gov",,"https://pbs.twimg.com/profile_banners/1082334352711790593/1579139444",,"http://pbs.twimg.com/profile_images/1082685661621178373/ledtkemL_normal.jpg"
