"user_id","status_id","created_at","screen_name","text","source","display_text_width","reply_to_status_id","reply_to_user_id","reply_to_screen_name","is_quote","is_retweet","favorite_count","retweet_count","quote_count","reply_count","hashtags","symbols","urls_url","urls_t.co","urls_expanded_url","media_url","media_t.co","media_expanded_url","media_type","ext_media_url","ext_media_t.co","ext_media_expanded_url","ext_media_type","mentions_user_id","mentions_screen_name","lang","quoted_status_id","quoted_text","quoted_created_at","quoted_source","quoted_favorite_count","quoted_retweet_count","quoted_user_id","quoted_screen_name","quoted_name","quoted_followers_count","quoted_friends_count","quoted_statuses_count","quoted_location","quoted_description","quoted_verified","retweet_status_id","retweet_text","retweet_created_at","retweet_source","retweet_favorite_count","retweet_retweet_count","retweet_user_id","retweet_screen_name","retweet_name","retweet_followers_count","retweet_friends_count","retweet_statuses_count","retweet_location","retweet_description","retweet_verified","place_url","place_name","place_full_name","place_type","country","country_code","geo_coords","coords_coords","bbox_coords","status_url","name","location","description","url","protected","followers_count","friends_count","listed_count","statuses_count","favourites_count","account_created_at","verified","profile_url","profile_expanded_url","account_lang","profile_banner_url","profile_background_url","profile_image_url"
"x1082334352711790593","x1255974885446254593",2020-04-30 21:38:42,"Ilhan","Rent is due tomorrow.

People shouldn’t have to choose between feeding their families or paying their bills. 

We need a full cancellation of rent and mortgage payments. https://t.co/RaxAQBiIC7","Twitter Media Studio",169,,,,FALSE,FALSE,1207,314,,,,,,,,"http://pbs.twimg.com/amplify_video_thumb/1255973848731828227/img/qftRxB9iKuHa_uPo.jpg","https://t.co/RaxAQBiIC7","https://twitter.com/Ilhan/status/1255974885446254593/video/1","photo","http://pbs.twimg.com/amplify_video_thumb/1255973848731828227/img/qftRxB9iKuHa_uPo.jpg","https://t.co/RaxAQBiIC7","https://twitter.com/Ilhan/status/1255974885446254593/video/1",,,,"en",,,,,,,,,,,,,,,,,,,,,,,,,,,,,,,,,,,,,"NA NA","NA NA","NA NA NA NA NA NA NA NA","https://twitter.com/Ilhan/status/1255974885446254593","Rep. Ilhan Omar","Minneapolis, MN and Washington, DC","Representing Minnesota's 5th District in the People's House. @USProgressives Whip and Midwest Regional Whip.","https://t.co/etKOoQglhI",FALSE,684581,357,1859,2192,1069,2019-01-07 17:53:13,TRUE,"https://t.co/etKOoQglhI","http://omar.house.gov",,"https://pbs.twimg.com/profile_banners/1082334352711790593/1579139444",,"http://pbs.twimg.com/profile_images/1082685661621178373/ledtkemL_normal.jpg"
"x1082334352711790593","x1255964788787752960",2020-04-30 20:58:35,"Ilhan","All people regardless of immigration status need access to free testing and treatment. Period.","Twitter Web App",94,,,,FALSE,FALSE,2592,426,,,,,,,,,,,,,,,,,,"en",,,,,,,,,,,,,,,,,,,,,,,,,,,,,,,,,,,,,"NA NA","NA NA","NA NA NA NA NA NA NA NA","https://twitter.com/Ilhan/status/1255964788787752960","Rep. Ilhan Omar","Minneapolis, MN and Washington, DC","Representing Minnesota's 5th District in the People's House. @USProgressives Whip and Midwest Regional Whip.","https://t.co/etKOoQglhI",FALSE,684581,357,1859,2192,1069,2019-01-07 17:53:13,TRUE,"https://t.co/etKOoQglhI","http://omar.house.gov",,"https://pbs.twimg.com/profile_banners/1082334352711790593/1579139444",,"http://pbs.twimg.com/profile_images/1082685661621178373/ledtkemL_normal.jpg"
"x1082334352711790593","x1255949715377717248",2020-04-30 19:58:41,"Ilhan","Heartbreaking. 

We must prioritize our long-term care facilities and their workers in the next relief package. https://t.co/uy9DDjFzLV","TweetDeck",111,,,,TRUE,FALSE,249,65,,,,,"twitter.com/TheoKeith/stat…","https://t.co/uy9DDjFzLV","https://twitter.com/TheoKeith/status/1255948501307011072",,,,,,,,,,,"en","x1255948501307011072","22 of the newest 24 deaths were residents of long-term care.

That's 271 of Minnesota's 343 total deaths, or 79%.",2020-04-30 19:53:51,"TweetDeck",14,10,"x100323796","TheoKeith","Theo Keith",6694,1153,21512,"Minneapolis, MN","Political reporter, KMSP-TV/FOX 9 Minneapolis-St. Paul. Proud Michigander. Missouri grad. I believe in the profession of journalism. Theo.Keith@foxtv.com",TRUE,,,,,,,,,,,,,,,,,,,,,,"NA NA","NA NA","NA NA NA NA NA NA NA NA","https://twitter.com/Ilhan/status/1255949715377717248","Rep. Ilhan Omar","Minneapolis, MN and Washington, DC","Representing Minnesota's 5th District in the People's House. @USProgressives Whip and Midwest Regional Whip.","https://t.co/etKOoQglhI",FALSE,684581,357,1859,2192,1069,2019-01-07 17:53:13,TRUE,"https://t.co/etKOoQglhI","http://omar.house.gov",,"https://pbs.twimg.com/profile_banners/1082334352711790593/1579139444",,"http://pbs.twimg.com/profile_images/1082685661621178373/ledtkemL_normal.jpg"
"x1082334352711790593","x1255931465944178688",2020-04-30 18:46:10,"Ilhan","72% of immigrants in detention facilities are expected to be infected with COVID-19 by their 90th day in ICE detention. 

Outrageous.

We need to release at-risk detainees from detention.

https://t.co/gfoAsgvh9n","Twitter Web App",212,,,,FALSE,FALSE,1111,364,,,,,"thehill.com/changing-ameri…","https://t.co/gfoAsgvh9n","https://thehill.com/changing-america/respect/diversity-inclusion/495145-could-ice-detention-centers-be-the-next",,,,,,,,,,,"en",,,,,,,,,,,,,,,,,,,,,,,,,,,,,,,,,,,,,"NA NA","NA NA","NA NA NA NA NA NA NA NA","https://twitter.com/Ilhan/status/1255931465944178688","Rep. Ilhan Omar","Minneapolis, MN and Washington, DC","Representing Minnesota's 5th District in the People's House. @USProgressives Whip and Midwest Regional Whip.","https://t.co/etKOoQglhI",FALSE,684581,357,1859,2192,1069,2019-01-07 17:53:13,TRUE,"https://t.co/etKOoQglhI","http://omar.house.gov",,"https://pbs.twimg.com/profile_banners/1082334352711790593/1579139444",,"http://pbs.twimg.com/profile_images/1082685661621178373/ledtkemL_normal.jpg"
"x1082334352711790593","x1255902868646879233",2020-04-30 16:52:32,"Ilhan","Thank you, Chairman! https://t.co/MQF5UFCZP5","TweetDeck",20,,,,TRUE,FALSE,453,95,,,,,"twitter.com/RepJerryNadler…","https://t.co/MQF5UFCZP5","https://twitter.com/RepJerryNadler/status/1255891944296910849",,,,,,,,,,,"en","x1255891944296910849","Over the last six weeks, 30 million Americans have filed for unemployment. And yet, rent is still due tomorrow. With so many already struggling to pay for food or medicine, not acting to remove this burden is unacceptable.

We must pass @IlhanMN's bill suspending rent payments. https://t.co/EO2oWPuy8n",2020-04-30 16:09:07,"Twitter Web App",2884,708,"x40302336","RepJerryNadler","(((Rep. Nadler)))",361132,2031,6751,"New York, NY","Representing parts of Manhattan and Brooklyn. Proud to serve as the Chair of @HouseJudiciary. Follow me at https://t.co/eAS0pRYbYu",TRUE,,,,,,,,,,,,,,,,,,,,,,"NA NA","NA NA","NA NA NA NA NA NA NA NA","https://twitter.com/Ilhan/status/1255902868646879233","Rep. Ilhan Omar","Minneapolis, MN and Washington, DC","Representing Minnesota's 5th District in the People's House. @USProgressives Whip and Midwest Regional Whip.","https://t.co/etKOoQglhI",FALSE,684581,357,1859,2192,1069,2019-01-07 17:53:13,TRUE,"https://t.co/etKOoQglhI","http://omar.house.gov",,"https://pbs.twimg.com/profile_banners/1082334352711790593/1579139444",,"http://pbs.twimg.com/profile_images/1082685661621178373/ledtkemL_normal.jpg"
"x1082334352711790593","x1255880817353646084",2020-04-30 15:24:54,"Ilhan","Federal dollars should go to workers and small businesses, not CEOs and corporations. https://t.co/DuOxXG4Iyw","Twitter Web App",85,,,,TRUE,FALSE,1310,273,,,,,"twitter.com/K_JeanPierre/s…","https://t.co/DuOxXG4Iyw","https://twitter.com/K_JeanPierre/status/1254714849625624578",,,,,,,,,,,"en","x1254714849625624578","""Roughly 95% of Black-owned businesses,91% of Latino-owned businesses,91% of Native Hawaiian or Pacific Islander-owned businesses,&amp; 75% of Asian-owned businesses stand close to no chance of receiving a PPP loan through a mainstream bank or credit union,..” https://t.co/iqUUkpKyYK",2020-04-27 10:11:46,"Twitter for iPhone",15487,12274,"x18533219","K_JeanPierre","Karine Jean-Pierre",235388,4396,19844,"","Chief Public Affairs Officer, @MoveOn. Author. @NBC & @MSNBC Political Analyst. @BarackObama 2008/12 Campaigns & @ObamaWhiteHouse alum. Professor @ColumbiaSIPA.",TRUE,,,,,,,,,,,,,,,,,,,,,,"NA NA","NA NA","NA NA NA NA NA NA NA NA","https://twitter.com/Ilhan/status/1255880817353646084","Rep. Ilhan Omar","Minneapolis, MN and Washington, DC","Representing Minnesota's 5th District in the People's House. @USProgressives Whip and Midwest Regional Whip.","https://t.co/etKOoQglhI",FALSE,684581,357,1859,2192,1069,2019-01-07 17:53:13,TRUE,"https://t.co/etKOoQglhI","http://omar.house.gov",,"https://pbs.twimg.com/profile_banners/1082334352711790593/1579139444",,"http://pbs.twimg.com/profile_images/1082685661621178373/ledtkemL_normal.jpg"
"x1082334352711790593","x1255616297687285760",2020-04-29 21:53:48,"Ilhan","Millions couldn’t pay rent on April 1st. 

Millions won’t be able to pay rent on May 1st. 

It’s time to cancel it.","Twitter Web App",115,,,,FALSE,FALSE,18400,3132,,,,,,,,,,,,,,,,,,"en",,,,,,,,,,,,,,,,,,,,,,,,,,,,,,,,,,,,,"NA NA","NA NA","NA NA NA NA NA NA NA NA","https://twitter.com/Ilhan/status/1255616297687285760","Rep. Ilhan Omar","Minneapolis, MN and Washington, DC","Representing Minnesota's 5th District in the People's House. @USProgressives Whip and Midwest Regional Whip.","https://t.co/etKOoQglhI",FALSE,684581,357,1859,2192,1069,2019-01-07 17:53:13,TRUE,"https://t.co/etKOoQglhI","http://omar.house.gov",,"https://pbs.twimg.com/profile_banners/1082334352711790593/1579139444",,"http://pbs.twimg.com/profile_images/1082685661621178373/ledtkemL_normal.jpg"
"x1082334352711790593","x1255600211868688385",2020-04-29 20:49:53,"Ilhan","This is heartbreaking.
 
A member of our community passed away after contracting COVID-19. He did not receive the necessary supplies to keep him safe while he was working. 

This tragedy highlights why all essential workers need PPE and hazard pay.
 
https://t.co/EUIryBsRu9","Twitter Web App",274,,,,FALSE,FALSE,693,184,,,,,"minnesotareformer.com/2020/04/29/twi…","https://t.co/EUIryBsRu9","https://minnesotareformer.com/2020/04/29/twin-cities-janitor-dies-from-covid-19-union-demands-ppe-and-hazard-pay/",,,,,,,,,,,"en",,,,,,,,,,,,,,,,,,,,,,,,,,,,,,,,,,,,,"NA NA","NA NA","NA NA NA NA NA NA NA NA","https://twitter.com/Ilhan/status/1255600211868688385","Rep. Ilhan Omar","Minneapolis, MN and Washington, DC","Representing Minnesota's 5th District in the People's House. @USProgressives Whip and Midwest Regional Whip.","https://t.co/etKOoQglhI",FALSE,684581,357,1859,2192,1069,2019-01-07 17:53:13,TRUE,"https://t.co/etKOoQglhI","http://omar.house.gov",,"https://pbs.twimg.com/profile_banners/1082334352711790593/1579139444",,"http://pbs.twimg.com/profile_images/1082685661621178373/ledtkemL_normal.jpg"
"x1082334352711790593","x1255579816780337154",2020-04-29 19:28:50,"Ilhan","🗣️Frontline workers deserve hazard pay.","Twitter Web App",39,,,,FALSE,FALSE,3020,471,,,,,,,,,,,,,,,,,,"en",,,,,,,,,,,,,,,,,,,,,,,,,,,,,,,,,,,,,"NA NA","NA NA","NA NA NA NA NA NA NA NA","https://twitter.com/Ilhan/status/1255579816780337154","Rep. Ilhan Omar","Minneapolis, MN and Washington, DC","Representing Minnesota's 5th District in the People's House. @USProgressives Whip and Midwest Regional Whip.","https://t.co/etKOoQglhI",FALSE,684581,357,1859,2192,1069,2019-01-07 17:53:13,TRUE,"https://t.co/etKOoQglhI","http://omar.house.gov",,"https://pbs.twimg.com/profile_banners/1082334352711790593/1579139444",,"http://pbs.twimg.com/profile_images/1082685661621178373/ledtkemL_normal.jpg"
"x1082334352711790593","x1255560578766123008",2020-04-29 18:12:23,"Ilhan","Love to see members of our community step up to help those in need!
 
https://t.co/vxxsPB0l54","Twitter Web App",93,,,,FALSE,FALSE,142,28,,,,,"sahanjournal.com/culture-commun…","https://t.co/vxxsPB0l54","https://sahanjournal.com/culture-community/were-just-scratching-the-surface-community-volunteers-team-up-with-adult-daycare-centers-to-help-the-elderly/",,,,,,,,,,,"en",,,,,,,,,,,,,,,,,,,,,,,,,,,,,,,,,,,,,"NA NA","NA NA","NA NA NA NA NA NA NA NA","https://twitter.com/Ilhan/status/1255560578766123008","Rep. Ilhan Omar","Minneapolis, MN and Washington, DC","Representing Minnesota's 5th District in the People's House. @USProgressives Whip and Midwest Regional Whip.","https://t.co/etKOoQglhI",FALSE,684581,357,1859,2192,1069,2019-01-07 17:53:13,TRUE,"https://t.co/etKOoQglhI","http://omar.house.gov",,"https://pbs.twimg.com/profile_banners/1082334352711790593/1579139444",,"http://pbs.twimg.com/profile_images/1082685661621178373/ledtkemL_normal.jpg"
"x1082334352711790593","x1255544741661495297",2020-04-29 17:09:27,"Ilhan","No person should face deportation during this crisis.","Twitter Web App",53,,,,FALSE,FALSE,6084,849,,,,,,,,,,,,,,,,,,"en",,,,,,,,,,,,,,,,,,,,,,,,,,,,,,,,,,,,,"NA NA","NA NA","NA NA NA NA NA NA NA NA","https://twitter.com/Ilhan/status/1255544741661495297","Rep. Ilhan Omar","Minneapolis, MN and Washington, DC","Representing Minnesota's 5th District in the People's House. @USProgressives Whip and Midwest Regional Whip.","https://t.co/etKOoQglhI",FALSE,684581,357,1859,2192,1069,2019-01-07 17:53:13,TRUE,"https://t.co/etKOoQglhI","http://omar.house.gov",,"https://pbs.twimg.com/profile_banners/1082334352711790593/1579139444",,"http://pbs.twimg.com/profile_images/1082685661621178373/ledtkemL_normal.jpg"
"x1082334352711790593","x1255531354827210759",2020-04-29 16:16:16,"Ilhan","We're live with @taraghuveer and @SalazarSenate discussing the need to cancel rent and mortgage payments for the duration of this crisis. 

We owe to our community to prevent evictions, displacement and homelessness! #CancelRent #RentStrike
https://t.co/RMBwYOMaeU","Twitter Web App",264,,,,FALSE,FALSE,139,31,,,"CancelRent RentStrike",,"pscp.tv/w/1YpJkQQXeoPKj","https://t.co/RMBwYOMaeU","https://www.pscp.tv/w/1YpJkQQXeoPKj",,,,,,,,,"x75797680 x981309087764934661","taraghuveer SalazarSenate","en",,,,,,,,,,,,,,,,,,,,,,,,,,,,,,,,,,,,,"NA NA","NA NA","NA NA NA NA NA NA NA NA","https://twitter.com/Ilhan/status/1255531354827210759","Rep. Ilhan Omar","Minneapolis, MN and Washington, DC","Representing Minnesota's 5th District in the People's House. @USProgressives Whip and Midwest Regional Whip.","https://t.co/etKOoQglhI",FALSE,684581,357,1859,2192,1069,2019-01-07 17:53:13,TRUE,"https://t.co/etKOoQglhI","http://omar.house.gov",,"https://pbs.twimg.com/profile_banners/1082334352711790593/1579139444",,"http://pbs.twimg.com/profile_images/1082685661621178373/ledtkemL_normal.jpg"
"x1082334352711790593","x1255525844774203393",2020-04-29 15:54:22,"Ilhan","Billionaires want to continue profiting off your labor even if it means risking millions of lives. 

They call this ""freedom."" https://t.co/9rRKeHDh4m","Twitter Web App",126,,,,FALSE,FALSE,28843,6152,,,,,,,,"http://pbs.twimg.com/media/EWyGAttX0AQM-th.png","https://t.co/9rRKeHDh4m","https://twitter.com/Ilhan/status/1255525844774203393/photo/1","photo","http://pbs.twimg.com/media/EWyGAttX0AQM-th.png","https://t.co/9rRKeHDh4m","https://twitter.com/Ilhan/status/1255525844774203393/photo/1",,,,"en",,,,,,,,,,,,,,,,,,,,,,,,,,,,,,,,,,,,,"NA NA","NA NA","NA NA NA NA NA NA NA NA","https://twitter.com/Ilhan/status/1255525844774203393","Rep. Ilhan Omar","Minneapolis, MN and Washington, DC","Representing Minnesota's 5th District in the People's House. @USProgressives Whip and Midwest Regional Whip.","https://t.co/etKOoQglhI",FALSE,684581,357,1859,2192,1069,2019-01-07 17:53:13,TRUE,"https://t.co/etKOoQglhI","http://omar.house.gov",,"https://pbs.twimg.com/profile_banners/1082334352711790593/1579139444",,"http://pbs.twimg.com/profile_images/1082685661621178373/ledtkemL_normal.jpg"
"x1082334352711790593","x1255508733205131265",2020-04-29 14:46:22,"Ilhan","Billionaires shouldn’t be profiting while millions struggle to pay their bills. https://t.co/zb5Xsz2BIY","Twitter Web App",79,,,,TRUE,FALSE,3494,924,,,,,"twitter.com/Public_Citizen…","https://t.co/zb5Xsz2BIY","https://twitter.com/Public_Citizen/status/1255489222242426881",,,,,,,,,,,"en","x1255489222242426881","The billionaire class has added $308B to its wealth during the pandemic.

8 billionaires have seen a net worth surge of $1 billion+, including:

Elon Musk

Jeff Bezos

MacKenzie Bezos

Steve Ballmer

Meanwhile, 26 million+ Americans have lost their jobs.
https://t.co/xRVP7jrhoJ",2020-04-29 13:28:51,"Twitter Web App",5048,3350,"x14335586","Public_Citizen","Public Citizen",235550,6709,32507,"Washington, DC","Public Citizen has been standing up to corporate power and holding government accountable for 49 years. We're people-powered and accept no corporate money.",TRUE,,,,,,,,,,,,,,,,,,,,,,"NA NA","NA NA","NA NA NA NA NA NA NA NA","https://twitter.com/Ilhan/status/1255508733205131265","Rep. Ilhan Omar","Minneapolis, MN and Washington, DC","Representing Minnesota's 5th District in the People's House. @USProgressives Whip and Midwest Regional Whip.","https://t.co/etKOoQglhI",FALSE,684581,357,1859,2192,1069,2019-01-07 17:53:13,TRUE,"https://t.co/etKOoQglhI","http://omar.house.gov",,"https://pbs.twimg.com/profile_banners/1082334352711790593/1579139444",,"http://pbs.twimg.com/profile_images/1082685661621178373/ledtkemL_normal.jpg"
"x1082334352711790593","x1255203207476895744",2020-04-28 18:32:19,"Ilhan","COVID-19 is exposing a crisis that has long existed in our prisons.  
 
Social distancing, diagnostic testing and access to hygiene supplies are all but nonexistent.
 
A prison sentence should not be a death sentence.","Twitter Web App",217,,,,FALSE,FALSE,1332,277,,,,,,,,,,,,,,,,,,"en",,,,,,,,,,,,,,,,,,,,,,,,,,,,,,,,,,,,,"NA NA","NA NA","NA NA NA NA NA NA NA NA","https://twitter.com/Ilhan/status/1255203207476895744","Rep. Ilhan Omar","Minneapolis, MN and Washington, DC","Representing Minnesota's 5th District in the People's House. @USProgressives Whip and Midwest Regional Whip.","https://t.co/etKOoQglhI",FALSE,684581,357,1859,2192,1069,2019-01-07 17:53:13,TRUE,"https://t.co/etKOoQglhI","http://omar.house.gov",,"https://pbs.twimg.com/profile_banners/1082334352711790593/1579139444",,"http://pbs.twimg.com/profile_images/1082685661621178373/ledtkemL_normal.jpg"
"x1082334352711790593","x1255145746841530368",2020-04-28 14:44:00,"Ilhan","*taps mic*

Cancel rent","Twitter Web App",23,,,,FALSE,FALSE,85865,13314,,,,,,,,,,,,,,,,,,"en",,,,,,,,,,,,,,,,,,,,,,,,,,,,,,,,,,,,,"NA NA","NA NA","NA NA NA NA NA NA NA NA","https://twitter.com/Ilhan/status/1255145746841530368","Rep. Ilhan Omar","Minneapolis, MN and Washington, DC","Representing Minnesota's 5th District in the People's House. @USProgressives Whip and Midwest Regional Whip.","https://t.co/etKOoQglhI",FALSE,684581,357,1859,2192,1069,2019-01-07 17:53:13,TRUE,"https://t.co/etKOoQglhI","http://omar.house.gov",,"https://pbs.twimg.com/profile_banners/1082334352711790593/1579139444",,"http://pbs.twimg.com/profile_images/1082685661621178373/ledtkemL_normal.jpg"
"x1082334352711790593","x1255141946109997057",2020-04-28 14:28:54,"Ilhan","We’ve tested less than 2% of the population. https://t.co/vDD9KeIThD","Twitter Web App",44,,,,TRUE,FALSE,3802,755,,,,,"twitter.com/realDonaldTrum…","https://t.co/vDD9KeIThD","https://twitter.com/realDonaldTrump/status/1255105998471249923",,,,,,,,,,,"en","x1255105998471249923","We are doing far more, and better, Testing than any other country in the world, and yet the media does nothing but complain. No matter how good a job is done, the same as with the Ventilators, they will never say we are doing a great job, they will only viciously gripe!",2020-04-28 12:06:03,"Twitter for iPhone",218533,38400,"x25073877","realDonaldTrump","Donald J. Trump",79077373,46,51120,"Washington, DC","45th President of the United States of America🇺🇸",TRUE,,,,,,,,,,,,,,,,,,,,,,"NA NA","NA NA","NA NA NA NA NA NA NA NA","https://twitter.com/Ilhan/status/1255141946109997057","Rep. Ilhan Omar","Minneapolis, MN and Washington, DC","Representing Minnesota's 5th District in the People's House. @USProgressives Whip and Midwest Regional Whip.","https://t.co/etKOoQglhI",FALSE,684581,357,1859,2192,1069,2019-01-07 17:53:13,TRUE,"https://t.co/etKOoQglhI","http://omar.house.gov",,"https://pbs.twimg.com/profile_banners/1082334352711790593/1579139444",,"http://pbs.twimg.com/profile_images/1082685661621178373/ledtkemL_normal.jpg"
"x1082334352711790593","x1255119575890440192",2020-04-28 13:00:00,"Ilhan","The Census is a vital foundation of our democracy, by and for the people.

Organizing our communities is critical to making sure no one is left out.

Watch to see why the Census matters ⬇️ https://t.co/CYq1KMMz5X","Twitter Media Studio",188,,,,FALSE,FALSE,143,32,,,,,,,,"http://pbs.twimg.com/amplify_video_thumb/1254882317946032134/img/C7bHwU5V6KZS1He1.jpg","https://t.co/CYq1KMMz5X","https://twitter.com/Ilhan/status/1255119575890440192/video/1","photo","http://pbs.twimg.com/amplify_video_thumb/1254882317946032134/img/C7bHwU5V6KZS1He1.jpg","https://t.co/CYq1KMMz5X","https://twitter.com/Ilhan/status/1255119575890440192/video/1",,,,"en",,,,,,,,,,,,,,,,,,,,,,,,,,,,,,,,,,,,,"NA NA","NA NA","NA NA NA NA NA NA NA NA","https://twitter.com/Ilhan/status/1255119575890440192","Rep. Ilhan Omar","Minneapolis, MN and Washington, DC","Representing Minnesota's 5th District in the People's House. @USProgressives Whip and Midwest Regional Whip.","https://t.co/etKOoQglhI",FALSE,684581,357,1859,2192,1069,2019-01-07 17:53:13,TRUE,"https://t.co/etKOoQglhI","http://omar.house.gov",,"https://pbs.twimg.com/profile_banners/1082334352711790593/1579139444",,"http://pbs.twimg.com/profile_images/1082685661621178373/ledtkemL_normal.jpg"
"x1082334352711790593","x1254878014149660673",2020-04-27 21:00:07,"Ilhan","Trump and his administration are excluding taxpaying, mixed status families from receiving COVID-19 economic assistance. 

Over 140,000 Minnesotans live in mixed status families. 

I introduced legislation to fix this injustice. 

https://t.co/FMcT1rXTHq","Twitter Web App",254,,,,FALSE,FALSE,544,135,,,,,"omar.house.gov/media/press-re…","https://t.co/FMcT1rXTHq","https://omar.house.gov/media/press-releases/rep-omar-introduces-bill-and-leads-letter-expand-covid-19-economic-assistance",,,,,,,,,,,"en",,,,,,,,,,,,,,,,,,,,,,,,,,,,,,,,,,,,,"NA NA","NA NA","NA NA NA NA NA NA NA NA","https://twitter.com/Ilhan/status/1254878014149660673","Rep. Ilhan Omar","Minneapolis, MN and Washington, DC","Representing Minnesota's 5th District in the People's House. @USProgressives Whip and Midwest Regional Whip.","https://t.co/etKOoQglhI",FALSE,684581,357,1859,2192,1069,2019-01-07 17:53:13,TRUE,"https://t.co/etKOoQglhI","http://omar.house.gov",,"https://pbs.twimg.com/profile_banners/1082334352711790593/1579139444",,"http://pbs.twimg.com/profile_images/1082685661621178373/ledtkemL_normal.jpg"
"x1082334352711790593","x1254847938406297603",2020-04-27 19:00:37,"Ilhan","Amazon continues to exploit workers without guaranteeing workplace safety, hazard pay, or ability to organize.
 
Proud to stand alongside @RepJayapal in fighting to hold Amazon accountable. https://t.co/EodH6MWyQd","Twitter Web App",189,,,,TRUE,FALSE,477,117,,,,,"twitter.com/RepJayapal/sta…","https://t.co/EodH6MWyQd","https://twitter.com/RepJayapal/status/1253751130930151424",,,,,,,,,"x815733290955112448","RepJayapal","en","x1253751130930151424","Amazon’s work to distribute essential products has been critical during this pandemic &amp; I appreciate the steps the it has taken to expand its workforce &amp; help small businesses in #Seattle. But I have serious concerns about Amazon’s failure to do right by its workers in key areas. https://t.co/Y6OZ1516Db",2020-04-24 18:22:17,"Twitter for iPhone",330,75,"x815733290955112448","RepJayapal","Rep. Pramila Jayapal",264049,2754,19079,"Seattle, WA","Congresswoman & lifelong organizer. Proudly serving WA-07. Co-Chair of @USProgressives, Member of @HouseJudiciary, @EdLaborCmte and @HouseBudgetDems. She/her.",TRUE,,,,,,,,,,,,,,,,,,,,,,"NA NA","NA NA","NA NA NA NA NA NA NA NA","https://twitter.com/Ilhan/status/1254847938406297603","Rep. Ilhan Omar","Minneapolis, MN and Washington, DC","Representing Minnesota's 5th District in the People's House. @USProgressives Whip and Midwest Regional Whip.","https://t.co/etKOoQglhI",FALSE,684581,357,1859,2192,1069,2019-01-07 17:53:13,TRUE,"https://t.co/etKOoQglhI","http://omar.house.gov",,"https://pbs.twimg.com/profile_banners/1082334352711790593/1579139444",,"http://pbs.twimg.com/profile_images/1082685661621178373/ledtkemL_normal.jpg"
