"x1082334352711790593","x1252596000482570241",2020-04-21 13:52:13,"Ilhan","Trump will ban immigration but allow some Southern states to loosen restrictions. 

This has nothing to do with our safety and everything to do with his blatant xenophobia.  

Pathetic.","Twitter Web App",185,,,,FALSE,FALSE,10488,2146,,,,,,,,,,,,,,,,,,"en",,,,,,,,,,,,,,,,,,,,,,,,,,,,,,,,,,,,,"NA NA","NA NA","NA NA NA NA NA NA NA NA","https://twitter.com/Ilhan/status/1252596000482570241","Rep. Ilhan Omar","Minneapolis, MN and Washington, DC","Representing Minnesota's 5th District in the People's House. @USProgressives Whip and Midwest Regional Whip.","https://t.co/etKOoQglhI",FALSE,676674,357,1816,2156,1048,2019-01-07 17:53:13,TRUE,"https://t.co/etKOoQglhI","http://omar.house.gov",,"https://pbs.twimg.com/profile_banners/1082334352711790593/1579139444",,"http://pbs.twimg.com/profile_images/1082685661621178373/ledtkemL_normal.jpg"
"x1082334352711790593","x1252337928098861057",2020-04-20 20:46:44,"Ilhan","On Yom HaShoah, we honor and remember the 6 million Jews brutally murdered during the Holocaust. 
 
We must never forget this genocide and reject antisemitism and all forms of hate that give rise to violence. #NeverAgain","Twitter Web App",220,,,,FALSE,FALSE,2687,489,,,"NeverAgain",,,,,,,,,,,,,,,"en",,,,,,,,,,,,,,,,,,,,,,,,,,,,,,,,,,,,,"NA NA","NA NA","NA NA NA NA NA NA NA NA","https://twitter.com/Ilhan/status/1252337928098861057","Rep. Ilhan Omar","Minneapolis, MN and Washington, DC","Representing Minnesota's 5th District in the People's House. @USProgressives Whip and Midwest Regional Whip.","https://t.co/etKOoQglhI",FALSE,676674,357,1816,2156,1048,2019-01-07 17:53:13,TRUE,"https://t.co/etKOoQglhI","http://omar.house.gov",,"https://pbs.twimg.com/profile_banners/1082334352711790593/1579139444",,"http://pbs.twimg.com/profile_images/1082685661621178373/ledtkemL_normal.jpg"
"x1082334352711790593","x1252298631530663936",2020-04-20 18:10:34,"Ilhan","Nearly 1.7 million immigrants are healthcare workers and millions more are essential workers. 

They too are risking their lives to save others. 

They too are hurting in this crisis. 

And they too deserve relief. #DiversityIsOurStrength","Twitter Web App",238,,,,FALSE,FALSE,2512,560,,,"DiversityIsOurStrength",,,,,,,,,,,,,,,"en",,,,,,,,,,,,,,,,,,,,,,,,,,,,,,,,,,,,,"NA NA","NA NA","NA NA NA NA NA NA NA NA","https://twitter.com/Ilhan/status/1252298631530663936","Rep. Ilhan Omar","Minneapolis, MN and Washington, DC","Representing Minnesota's 5th District in the People's House. @USProgressives Whip and Midwest Regional Whip.","https://t.co/etKOoQglhI",FALSE,676674,357,1816,2156,1048,2019-01-07 17:53:13,TRUE,"https://t.co/etKOoQglhI","http://omar.house.gov",,"https://pbs.twimg.com/profile_banners/1082334352711790593/1579139444",,"http://pbs.twimg.com/profile_images/1082685661621178373/ledtkemL_normal.jpg"
"x1082334352711790593","x1252263939049771009",2020-04-20 15:52:43,"Ilhan","Trump is funneling half a billion dollars of taxpayer money to fund his border wall while we have NO nationwide coronavirus testing plan. 

Unconscionable. 
https://t.co/N8F31GlquD","Twitter Web App",180,,,,FALSE,FALSE,3070,1206,,,,,"vanityfair.com/news/2020/04/s…","https://t.co/N8F31GlquD","https://www.vanityfair.com/news/2020/04/sorry-hospitals-trumps-border-wall-is-getting-another-half-billion-dollars",,,,,,,,,,,"en",,,,,,,,,,,,,,,,,,,,,,,,,,,,,,,,,,,,,"NA NA","NA NA","NA NA NA NA NA NA NA NA","https://twitter.com/Ilhan/status/1252263939049771009","Rep. Ilhan Omar","Minneapolis, MN and Washington, DC","Representing Minnesota's 5th District in the People's House. @USProgressives Whip and Midwest Regional Whip.","https://t.co/etKOoQglhI",FALSE,676674,357,1816,2156,1048,2019-01-07 17:53:13,TRUE,"https://t.co/etKOoQglhI","http://omar.house.gov",,"https://pbs.twimg.com/profile_banners/1082334352711790593/1579139444",,"http://pbs.twimg.com/profile_images/1082685661621178373/ledtkemL_normal.jpg"
"x1082334352711790593","x1252007779826651136",2020-04-19 22:54:50,"Ilhan","Nationalize hospitals for the duration of this crisis. https://t.co/qRbyHGFow7","Twitter for iPhone",54,,,,TRUE,FALSE,2209,367,,,,,"twitter.com/ericawerner/st…","https://t.co/qRbyHGFow7","https://twitter.com/ericawerner/status/1251104919135883265",,,,,,,,,,,"en","x1251104919135883265","ICYMI from last night, our look at problems with the hospital funding in Cares Act. Some hotspots like NY have been shortchanged thus far. W/ ⁦@shaneharris⁩ @goldsteinamy https://t.co/tePU635G9A",2020-04-17 11:07:11,"Twitter for iPhone",40,36,"x33653195","ericawerner","Erica Werner",40795,989,8470,"Washington, DC","Washington Post congressional reporter. Formerly AP.                                (Header photo by Caroline Brehman/CQ Roll Call)",TRUE,,,,,,,,,,,,,,,,,,,,,,"NA NA","NA NA","NA NA NA NA NA NA NA NA","https://twitter.com/Ilhan/status/1252007779826651136","Rep. Ilhan Omar","Minneapolis, MN and Washington, DC","Representing Minnesota's 5th District in the People's House. @USProgressives Whip and Midwest Regional Whip.","https://t.co/etKOoQglhI",FALSE,676674,357,1816,2156,1048,2019-01-07 17:53:13,TRUE,"https://t.co/etKOoQglhI","http://omar.house.gov",,"https://pbs.twimg.com/profile_banners/1082334352711790593/1579139444",,"http://pbs.twimg.com/profile_images/1082685661621178373/ledtkemL_normal.jpg"
"x1082334352711790593","x1252003131363385345",2020-04-19 22:36:22,"Ilhan","Never forget this was preventable. 

https://t.co/Qr8e8G3PaA","Twitter Web App",60,,,,FALSE,FALSE,819,203,,,,,"nytimes.com/2020/04/15/nyr…","https://t.co/Qr8e8G3PaA","https://www.nytimes.com/2020/04/15/nyregion/coronavirus-woodhull-madhvi-aya-dead.html?referringSource=articleShare",,,,,,,,,,,"en",,,,,,,,,,,,,,,,,,,,,,,,,,,,,,,,,,,,,"NA NA","NA NA","NA NA NA NA NA NA NA NA","https://twitter.com/Ilhan/status/1252003131363385345","Rep. Ilhan Omar","Minneapolis, MN and Washington, DC","Representing Minnesota's 5th District in the People's House. @USProgressives Whip and Midwest Regional Whip.","https://t.co/etKOoQglhI",FALSE,676674,357,1816,2156,1048,2019-01-07 17:53:13,TRUE,"https://t.co/etKOoQglhI","http://omar.house.gov",,"https://pbs.twimg.com/profile_banners/1082334352711790593/1579139444",,"http://pbs.twimg.com/profile_images/1082685661621178373/ledtkemL_normal.jpg"
"x1082334352711790593","x1251916990102585344",2020-04-19 16:54:04,"Ilhan","🗣️Housing is a human right. Pass it on.","Twitter Web App",39,,,,FALSE,FALSE,14936,3220,,,,,,,,,,,,,,,,,,"en",,,,,,,,,,,,,,,,,,,,,,,,,,,,,,,,,,,,,"NA NA","NA NA","NA NA NA NA NA NA NA NA","https://twitter.com/Ilhan/status/1251916990102585344","Rep. Ilhan Omar","Minneapolis, MN and Washington, DC","Representing Minnesota's 5th District in the People's House. @USProgressives Whip and Midwest Regional Whip.","https://t.co/etKOoQglhI",FALSE,676674,357,1816,2156,1048,2019-01-07 17:53:13,TRUE,"https://t.co/etKOoQglhI","http://omar.house.gov",,"https://pbs.twimg.com/profile_banners/1082334352711790593/1579139444",,"http://pbs.twimg.com/profile_images/1082685661621178373/ledtkemL_normal.jpg"
"x1082334352711790593","x1251899620097249280",2020-04-19 15:45:03,"Ilhan","I’m hosting a town hall this Thursday with @mndeed to answer your questions about accessing unemployment insurance. 

Tune in and submit questions at https://t.co/xWIbGgfOaS https://t.co/c2yPIut8Oo","Buffer",173,,,,FALSE,FALSE,215,39,,,,,"facebook.com/repilhan","https://t.co/xWIbGgfOaS","http://facebook.com/repilhan","http://pbs.twimg.com/media/EV-kEfAWoAMduIb.jpg","https://t.co/c2yPIut8Oo","https://twitter.com/Ilhan/status/1251899620097249280/photo/1","photo","http://pbs.twimg.com/media/EV-kEfAWoAMduIb.jpg","https://t.co/c2yPIut8Oo","https://twitter.com/Ilhan/status/1251899620097249280/photo/1",,"x54329002","mndeed","en",,,,,,,,,,,,,,,,,,,,,,,,,,,,,,,,,,,,,"NA NA","NA NA","NA NA NA NA NA NA NA NA","https://twitter.com/Ilhan/status/1251899620097249280","Rep. Ilhan Omar","Minneapolis, MN and Washington, DC","Representing Minnesota's 5th District in the People's House. @USProgressives Whip and Midwest Regional Whip.","https://t.co/etKOoQglhI",FALSE,676674,357,1816,2156,1048,2019-01-07 17:53:13,TRUE,"https://t.co/etKOoQglhI","http://omar.house.gov",,"https://pbs.twimg.com/profile_banners/1082334352711790593/1579139444",,"http://pbs.twimg.com/profile_images/1082685661621178373/ledtkemL_normal.jpg"
"x1082334352711790593","x1251599505201541121",2020-04-18 19:52:30,"Ilhan","Thank you to our frontline workers who are working tirelessly to keep us safe. 

You embody the very best of our country.","Twitter Web App",121,,,,FALSE,FALSE,1758,265,,,,,,,,,,,,,,,,,,"en",,,,,,,,,,,,,,,,,,,,,,,,,,,,,,,,,,,,,"NA NA","NA NA","NA NA NA NA NA NA NA NA","https://twitter.com/Ilhan/status/1251599505201541121","Rep. Ilhan Omar","Minneapolis, MN and Washington, DC","Representing Minnesota's 5th District in the People's House. @USProgressives Whip and Midwest Regional Whip.","https://t.co/etKOoQglhI",FALSE,676674,357,1816,2156,1048,2019-01-07 17:53:13,TRUE,"https://t.co/etKOoQglhI","http://omar.house.gov",,"https://pbs.twimg.com/profile_banners/1082334352711790593/1579139444",,"http://pbs.twimg.com/profile_images/1082685661621178373/ledtkemL_normal.jpg"
"x1082334352711790593","x1251548720090546176",2020-04-18 16:30:42,"Ilhan","Congress has a responsibility to stabilize our housing market during this time of uncertainty and crisis. 

In 2008, we bailed out Wall Street. 

Now, it’s time to bail out the American people. https://t.co/AEt8qrigwX","Twitter Media Studio",193,,,,FALSE,FALSE,1795,386,,,,,,,,"http://pbs.twimg.com/amplify_video_thumb/1251546381011030019/img/Q6drCTRz6G5krw9O.jpg","https://t.co/AEt8qrigwX","https://twitter.com/Ilhan/status/1251548720090546176/video/1","photo","http://pbs.twimg.com/amplify_video_thumb/1251546381011030019/img/Q6drCTRz6G5krw9O.jpg","https://t.co/AEt8qrigwX","https://twitter.com/Ilhan/status/1251548720090546176/video/1",,,,"en",,,,,,,,,,,,,,,,,,,,,,,,,,,,,,,,,,,,,"NA NA","NA NA","NA NA NA NA NA NA NA NA","https://twitter.com/Ilhan/status/1251548720090546176","Rep. Ilhan Omar","Minneapolis, MN and Washington, DC","Representing Minnesota's 5th District in the People's House. @USProgressives Whip and Midwest Regional Whip.","https://t.co/etKOoQglhI",FALSE,676674,357,1816,2156,1048,2019-01-07 17:53:13,TRUE,"https://t.co/etKOoQglhI","http://omar.house.gov",,"https://pbs.twimg.com/profile_banners/1082334352711790593/1579139444",,"http://pbs.twimg.com/profile_images/1082685661621178373/ledtkemL_normal.jpg"
"x1082334352711790593","x1251255559233437697",2020-04-17 21:05:47,"Ilhan","Right now, we need:  

🏥Universal healthcare 
💵Universal cash assistance 
👩‍🎓Student debt cancellation 
🏠Cancellation of rent/mortgage payments

Let’s keep fighting to get the world we deserve.✊🏽","Twitter Web App",195,,,,FALSE,FALSE,3990,881,,,,,,,,,,,,,,,,,,"en",,,,,,,,,,,,,,,,,,,,,,,,,,,,,,,,,,,,,"NA NA","NA NA","NA NA NA NA NA NA NA NA","https://twitter.com/Ilhan/status/1251255559233437697","Rep. Ilhan Omar","Minneapolis, MN and Washington, DC","Representing Minnesota's 5th District in the People's House. @USProgressives Whip and Midwest Regional Whip.","https://t.co/etKOoQglhI",FALSE,676674,357,1816,2156,1048,2019-01-07 17:53:13,TRUE,"https://t.co/etKOoQglhI","http://omar.house.gov",,"https://pbs.twimg.com/profile_banners/1082334352711790593/1579139444",,"http://pbs.twimg.com/profile_images/1082685661621178373/ledtkemL_normal.jpg"
"x1082334352711790593","x1251223114320678912",2020-04-17 18:56:51,"Ilhan","Communities of color are bearing the brunt of this crisis. 

We need climate justice now. 

https://t.co/yAiNlCLNRV","Twitter Web App",115,,,,FALSE,FALSE,550,124,,,,,"nytimes.com/2020/04/07/cli…","https://t.co/yAiNlCLNRV","https://www.nytimes.com/2020/04/07/climate/air-pollution-coronavirus-covid.html",,,,,,,,,,,"en",,,,,,,,,,,,,,,,,,,,,,,,,,,,,,,,,,,,,"NA NA","NA NA","NA NA NA NA NA NA NA NA","https://twitter.com/Ilhan/status/1251223114320678912","Rep. Ilhan Omar","Minneapolis, MN and Washington, DC","Representing Minnesota's 5th District in the People's House. @USProgressives Whip and Midwest Regional Whip.","https://t.co/etKOoQglhI",FALSE,676674,357,1816,2156,1048,2019-01-07 17:53:13,TRUE,"https://t.co/etKOoQglhI","http://omar.house.gov",,"https://pbs.twimg.com/profile_banners/1082334352711790593/1579139444",,"http://pbs.twimg.com/profile_images/1082685661621178373/ledtkemL_normal.jpg"
"x1082334352711790593","x1251189937099153408",2020-04-17 16:45:01,"Ilhan","We need to take bold action to provide much needed support to renters and landlords. 

Today, I announced my bill to cancel *ALL* rent and mortgage payments during this crisis. 

https://t.co/sbtKdG7u7Q","Twitter Web App",202,,,,FALSE,FALSE,1263,325,,,,,"omar.house.gov/media/press-re…","https://t.co/sbtKdG7u7Q","https://omar.house.gov/media/press-releases/rep-ilhan-omar-introduces-bill-cancel-all-rent-and-mortgage-payments-during",,,,,,,,,,,"en",,,,,,,,,,,,,,,,,,,,,,,,,,,,,,,,,,,,,"NA NA","NA NA","NA NA NA NA NA NA NA NA","https://twitter.com/Ilhan/status/1251189937099153408","Rep. Ilhan Omar","Minneapolis, MN and Washington, DC","Representing Minnesota's 5th District in the People's House. @USProgressives Whip and Midwest Regional Whip.","https://t.co/etKOoQglhI",FALSE,676674,357,1816,2156,1048,2019-01-07 17:53:13,TRUE,"https://t.co/etKOoQglhI","http://omar.house.gov",,"https://pbs.twimg.com/profile_banners/1082334352711790593/1579139444",,"http://pbs.twimg.com/profile_images/1082685661621178373/ledtkemL_normal.jpg"
"x1082334352711790593","x1251148643261808651",2020-04-17 14:00:56,"Ilhan","🚨I’m holding a press conference on my new bill to cancel rent and mortgage payments through the duration of this crisis.
 
Watch now: https://t.co/hgj1lnwGIy","Twitter Web App",157,,,,FALSE,FALSE,2723,588,,,,,"facebook.com/RepIlhan/","https://t.co/hgj1lnwGIy","http://facebook.com/RepIlhan/",,,,,,,,,,,"en",,,,,,,,,,,,,,,,,,,,,,,,,,,,,,,,,,,,,"NA NA","NA NA","NA NA NA NA NA NA NA NA","https://twitter.com/Ilhan/status/1251148643261808651","Rep. Ilhan Omar","Minneapolis, MN and Washington, DC","Representing Minnesota's 5th District in the People's House. @USProgressives Whip and Midwest Regional Whip.","https://t.co/etKOoQglhI",FALSE,676674,357,1816,2156,1048,2019-01-07 17:53:13,TRUE,"https://t.co/etKOoQglhI","http://omar.house.gov",,"https://pbs.twimg.com/profile_banners/1082334352711790593/1579139444",,"http://pbs.twimg.com/profile_images/1082685661621178373/ledtkemL_normal.jpg"
"x1082334352711790593","x1250897251809067009",2020-04-16 21:22:00,"Ilhan","WE NEED TO STOP ALL DEPORTATIONS DURING THIS CRISIS https://t.co/Dqhx6n7IYP","Twitter Web App",51,,,,TRUE,FALSE,1892,392,,,,,"twitter.com/latimes/status…","https://t.co/Dqhx6n7IYP","https://twitter.com/latimes/status/1250499894349049856",,,,,,,,,,,"en","x1250499894349049856","Guatemala health chief says at least 50% of deportees from U.S. have coronavirus https://t.co/7REf9tsybD",2020-04-15 19:03:02,"Buffer",53,81,"x16664681","latimes","Los Angeles Times",3590584,6925,277787,"El Segundo, CA","Bringing L.A. to the world and the world to L.A. Subscribe now: https://t.co/KW9cHofnW4",TRUE,,,,,,,,,,,,,,,,,,,,,,"NA NA","NA NA","NA NA NA NA NA NA NA NA","https://twitter.com/Ilhan/status/1250897251809067009","Rep. Ilhan Omar","Minneapolis, MN and Washington, DC","Representing Minnesota's 5th District in the People's House. @USProgressives Whip and Midwest Regional Whip.","https://t.co/etKOoQglhI",FALSE,676674,357,1816,2156,1048,2019-01-07 17:53:13,TRUE,"https://t.co/etKOoQglhI","http://omar.house.gov",,"https://pbs.twimg.com/profile_banners/1082334352711790593/1579139444",,"http://pbs.twimg.com/profile_images/1082685661621178373/ledtkemL_normal.jpg"
"x1082334352711790593","x1250889265891942403",2020-04-16 20:50:16,"Ilhan","For millions of Americans, the $1200 stimulus checks will disappear before next month’s bills are due. 

Congress needs to authorize monthly payments until this pandemic ends.","Twitter Web App",175,,,,FALSE,FALSE,3005,652,,,,,,,,,,,,,,,,,,"en",,,,,,,,,,,,,,,,,,,,,,,,,,,,,,,,,,,,,"NA NA","NA NA","NA NA NA NA NA NA NA NA","https://twitter.com/Ilhan/status/1250889265891942403","Rep. Ilhan Omar","Minneapolis, MN and Washington, DC","Representing Minnesota's 5th District in the People's House. @USProgressives Whip and Midwest Regional Whip.","https://t.co/etKOoQglhI",FALSE,676674,357,1816,2156,1048,2019-01-07 17:53:13,TRUE,"https://t.co/etKOoQglhI","http://omar.house.gov",,"https://pbs.twimg.com/profile_banners/1082334352711790593/1579139444",,"http://pbs.twimg.com/profile_images/1082685661621178373/ledtkemL_normal.jpg"
"x1082334352711790593","x1250838937876258819",2020-04-16 17:30:16,"Ilhan","Coronavirus is disproportionally killing people of color. 

We need to prioritize funding to combat racial health disparities in the next COVID-19 package.","Twitter Web App",155,,,,FALSE,FALSE,2718,485,,,,,,,,,,,,,,,,,,"en",,,,,,,,,,,,,,,,,,,,,,,,,,,,,,,,,,,,,"NA NA","NA NA","NA NA NA NA NA NA NA NA","https://twitter.com/Ilhan/status/1250838937876258819","Rep. Ilhan Omar","Minneapolis, MN and Washington, DC","Representing Minnesota's 5th District in the People's House. @USProgressives Whip and Midwest Regional Whip.","https://t.co/etKOoQglhI",FALSE,676674,357,1816,2156,1048,2019-01-07 17:53:13,TRUE,"https://t.co/etKOoQglhI","http://omar.house.gov",,"https://pbs.twimg.com/profile_banners/1082334352711790593/1579139444",,"http://pbs.twimg.com/profile_images/1082685661621178373/ledtkemL_normal.jpg"
"x1082334352711790593","x1250817307548491787",2020-04-16 16:04:19,"Ilhan","Proud to join this effort by my sister @RepRashida! https://t.co/66NWIzx0Wc","TweetDeck",51,,,,TRUE,FALSE,1168,295,,,,,"twitter.com/RepRashida/sta…","https://t.co/66NWIzx0Wc","https://twitter.com/RepRashida/status/1250813086937858050",,,,,,,,,"x1079769536730140672","RepRashida","en","x1250813086937858050","Democrats fought hard for direct #COVID19 relief payments to everyone in need but it's clear many were left out. We need recurring payments *for all*. That's why @RepJayapal and I are introducing the #ABCAct. Read more about this landmark legislation here: https://t.co/ySSUZCnquZ https://t.co/WBJ6orX9WF",2020-04-16 15:47:33,"Twitter Web App",1000,398,"x1079769536730140672","RepRashida","Congresswoman Rashida Tlaib",290671,331,837,"Michigan, USA","Proudly serving Michigan's 13th Congressional District. #13thDistrictStrong",TRUE,,,,,,,,,,,,,,,,,,,,,,"NA NA","NA NA","NA NA NA NA NA NA NA NA","https://twitter.com/Ilhan/status/1250817307548491787","Rep. Ilhan Omar","Minneapolis, MN and Washington, DC","Representing Minnesota's 5th District in the People's House. @USProgressives Whip and Midwest Regional Whip.","https://t.co/etKOoQglhI",FALSE,676674,357,1816,2156,1048,2019-01-07 17:53:13,TRUE,"https://t.co/etKOoQglhI","http://omar.house.gov",,"https://pbs.twimg.com/profile_banners/1082334352711790593/1579139444",,"http://pbs.twimg.com/profile_images/1082685661621178373/ledtkemL_normal.jpg"
"x1082334352711790593","x1250808467968974855",2020-04-16 15:29:12,"Ilhan","We need to guarantee housing as a human right. https://t.co/5cHm4s5TEk","Twitter Web App",46,,,,TRUE,FALSE,3789,802,,,,,"twitter.com/SawyerHackett/…","https://t.co/5cHm4s5TEk","https://twitter.com/SawyerHackett/status/1250235063112957953",,,,,,,,,,,"en","x1250235063112957953","Dozens of homeless people sleeping in taped boxes on a concrete parking lot beneath $100M empty Las Vegas hotels. https://t.co/DIsJ2R0wWo",2020-04-15 01:30:41,"Twitter for iPhone",49916,22225,"x219141142","SawyerHackett","Sawyer Hackett",14971,3118,14010,"","Communications Director for @JulianCastro. He/Him Email: sawyer@julianforthefuture.com",TRUE,,,,,,,,,,,,,,,,,,,,,,"NA NA","NA NA","NA NA NA NA NA NA NA NA","https://twitter.com/Ilhan/status/1250808467968974855","Rep. Ilhan Omar","Minneapolis, MN and Washington, DC","Representing Minnesota's 5th District in the People's House. @USProgressives Whip and Midwest Regional Whip.","https://t.co/etKOoQglhI",FALSE,676674,357,1816,2156,1048,2019-01-07 17:53:13,TRUE,"https://t.co/etKOoQglhI","http://omar.house.gov",,"https://pbs.twimg.com/profile_banners/1082334352711790593/1579139444",,"http://pbs.twimg.com/profile_images/1082685661621178373/ledtkemL_normal.jpg"
