"x1082334352711790593","x1254829898725801986",2020-04-27 17:48:56,"Ilhan","The president and Stephen Miller are exploiting a global pandemic to ban LEGAL immigration. 

This xenophobic policy is their attempt to change the fabric of America and advance their anti-immigrant agenda.

Not on our watch. https://t.co/ufzA5e7cjR","Twitter Web App",225,,,,TRUE,FALSE,1216,303,,,,,"twitter.com/washingtonpost…","https://t.co/ufzA5e7cjR","https://twitter.com/washingtonpost/status/1253756701490241536",,,,,,,,,,,"en","x1253756701490241536","Stephen Miller has a long-term vision for Trump's ""temporary"" immigration order, according to a recording obtained by The Post https://t.co/15WelqJ1h4",2020-04-24 18:44:25,"SocialFlow",217,170,"x2467791","washingtonpost","The Washington Post",15662230,1658,357137,"Washington, DC","Breaking news, analysis, and opinion. Founded in 1877. Our staff on Twitter: https://t.co/VV0UBAMHg8",TRUE,,,,,,,,,,,,,,,,,,,,,,"NA NA","NA NA","NA NA NA NA NA NA NA NA","https://twitter.com/Ilhan/status/1254829898725801986","Rep. Ilhan Omar","Minneapolis, MN and Washington, DC","Representing Minnesota's 5th District in the People's House. @USProgressives Whip and Midwest Regional Whip.","https://t.co/etKOoQglhI",FALSE,684581,357,1859,2192,1069,2019-01-07 17:53:13,TRUE,"https://t.co/etKOoQglhI","http://omar.house.gov",,"https://pbs.twimg.com/profile_banners/1082334352711790593/1579139444",,"http://pbs.twimg.com/profile_images/1082685661621178373/ledtkemL_normal.jpg"
"x1082334352711790593","x1254814959667740673",2020-04-27 16:49:34,"Ilhan","We need to build a new foreign policy during this crisis. We must:

1) Ensure the COVID-19 vaccine is free
2) Forgive unsustainable debt burdens
3) Lift US economic sanctions
4) Halt all deportations during the outbreak

Read my op-ed w/ @Lhunthendrix👇🏽
https://t.co/REFhjb8tja","Twitter Web App",277,,,,FALSE,FALSE,400,111,,,,,"theguardian.com/commentisfree/…","https://t.co/REFhjb8tja","https://www.theguardian.com/commentisfree/2020/apr/27/trump-covid-19-global-response-ilhan-omar",,,,,,,,,"x153433246","Lhunthendrix","en",,,,,,,,,,,,,,,,,,,,,,,,,,,,,,,,,,,,,"NA NA","NA NA","NA NA NA NA NA NA NA NA","https://twitter.com/Ilhan/status/1254814959667740673","Rep. Ilhan Omar","Minneapolis, MN and Washington, DC","Representing Minnesota's 5th District in the People's House. @USProgressives Whip and Midwest Regional Whip.","https://t.co/etKOoQglhI",FALSE,684581,357,1859,2192,1069,2019-01-07 17:53:13,TRUE,"https://t.co/etKOoQglhI","http://omar.house.gov",,"https://pbs.twimg.com/profile_banners/1082334352711790593/1579139444",,"http://pbs.twimg.com/profile_images/1082685661621178373/ledtkemL_normal.jpg"
"x1082334352711790593","x1254414294902595586",2020-04-26 14:17:28,"Ilhan","It’s time for a universal basic income.","Twitter for iPhone",39,,,,FALSE,FALSE,72441,10181,,,,,,,,,,,,,,,,,,"en",,,,,,,,,,,,,,,,,,,,,,,,,,,,,,,,,,,,,"NA NA","NA NA","NA NA NA NA NA NA NA NA","https://twitter.com/Ilhan/status/1254414294902595586","Rep. Ilhan Omar","Minneapolis, MN and Washington, DC","Representing Minnesota's 5th District in the People's House. @USProgressives Whip and Midwest Regional Whip.","https://t.co/etKOoQglhI",FALSE,684581,357,1859,2192,1069,2019-01-07 17:53:13,TRUE,"https://t.co/etKOoQglhI","http://omar.house.gov",,"https://pbs.twimg.com/profile_banners/1082334352711790593/1579139444",,"http://pbs.twimg.com/profile_images/1082685661621178373/ledtkemL_normal.jpg"
"x1082334352711790593","x1254165353984413698",2020-04-25 21:48:16,"Ilhan","The  intimidation campaign by  against Harun Maruf is deeply disturbing. 

These attacks, along with the April 14 arrest of Abdiaziz Ahmed Gurbiye for his work covering the impacts of COVID-19 in Somalia, are an unacceptable violation of basic human rights. https://t.co/2EX7lnAYGo","Twitter Web App",257,,,,TRUE,FALSE,687,238,,,,,"twitter.com/Goobjoognews/s…","https://t.co/2EX7lnAYGo","https://twitter.com/Goobjoognews/status/1253371808033767433",,,,,,,,,,,"en","x1253371808033767433","#BREAKING: #Somalia’s spy agency NISA says it has submitted its findings to the Attorney General for prosecution of VOA journalist Harun Maruuf. The agency had claimed it was probing the journalist. https://t.co/dCZdBug7k0",2020-04-23 17:15:00,"Twitter for iPhone",67,35,"x1665083444","Goobjoognews","Goobjoog News.",69150,292,25728,"Mogadishu","Goobjoog News provides indepth coverage of Somalia and the Horn of Africa. Email: info@goobjoog.com",FALSE,,,,,,,,,,,,,,,,,,,,,,"NA NA","NA NA","NA NA NA NA NA NA NA NA","https://twitter.com/Ilhan/status/1254165353984413698","Rep. Ilhan Omar","Minneapolis, MN and Washington, DC","Representing Minnesota's 5th District in the People's House. @USProgressives Whip and Midwest Regional Whip.","https://t.co/etKOoQglhI",FALSE,684581,357,1859,2192,1069,2019-01-07 17:53:13,TRUE,"https://t.co/etKOoQglhI","http://omar.house.gov",,"https://pbs.twimg.com/profile_banners/1082334352711790593/1579139444",,"http://pbs.twimg.com/profile_images/1082685661621178373/ledtkemL_normal.jpg"
"x1082334352711790593","x1253797601985662976",2020-04-24 21:26:57,"Ilhan","Rent is due on May 1st. 

The American people need help NOW.","Twitter Web App",60,,,,FALSE,FALSE,9609,1622,,,,,,,,,,,,,,,,,,"en",,,,,,,,,,,,,,,,,,,,,,,,,,,,,,,,,,,,,"NA NA","NA NA","NA NA NA NA NA NA NA NA","https://twitter.com/Ilhan/status/1253797601985662976","Rep. Ilhan Omar","Minneapolis, MN and Washington, DC","Representing Minnesota's 5th District in the People's House. @USProgressives Whip and Midwest Regional Whip.","https://t.co/etKOoQglhI",FALSE,684581,357,1859,2192,1069,2019-01-07 17:53:13,TRUE,"https://t.co/etKOoQglhI","http://omar.house.gov",,"https://pbs.twimg.com/profile_banners/1082334352711790593/1579139444",,"http://pbs.twimg.com/profile_images/1082685661621178373/ledtkemL_normal.jpg"
"x1082334352711790593","x1253776974474067968",2020-04-24 20:04:59,"Ilhan","ICE is using this pandemic to deport a young girl who fled abuse and has endured the unthinkable. 

Shame. 
https://t.co/HsAGIB7Sfn","Twitter Web App",131,,,,FALSE,FALSE,658,271,,,,,"buzzfeednews.com/article/adolfo…","https://t.co/HsAGIB7Sfn","https://www.buzzfeednews.com/article/adolfoflores/ice-unaccompanied-immigrant-girl-deportation-honduras",,,,,,,,,,,"en",,,,,,,,,,,,,,,,,,,,,,,,,,,,,,,,,,,,,"NA NA","NA NA","NA NA NA NA NA NA NA NA","https://twitter.com/Ilhan/status/1253776974474067968","Rep. Ilhan Omar","Minneapolis, MN and Washington, DC","Representing Minnesota's 5th District in the People's House. @USProgressives Whip and Midwest Regional Whip.","https://t.co/etKOoQglhI",FALSE,684581,357,1859,2192,1069,2019-01-07 17:53:13,TRUE,"https://t.co/etKOoQglhI","http://omar.house.gov",,"https://pbs.twimg.com/profile_banners/1082334352711790593/1579139444",,"http://pbs.twimg.com/profile_images/1082685661621178373/ledtkemL_normal.jpg"
"x1082334352711790593","x1253768567004291072",2020-04-24 19:31:34,"Ilhan","I’m heartbroken over the news that there has been numerous deaths at the New Hope Senior Care Center.
 
Last year, I had the opportunity to visit and talk with caregivers and residents. Here’s a look into my visit that profoundly impacted me.
https://t.co/weaGmQBiX3","Twitter Web App",266,,,,FALSE,FALSE,268,40,,,,,"medium.com/@RepIlhanOmar/…","https://t.co/weaGmQBiX3","https://medium.com/@RepIlhanOmar/my-visit-to-the-new-hope-senior-care-center-87f740dfecd0",,,,,,,,,,,"en",,,,,,,,,,,,,,,,,,,,,,,,,,,,,,,,,,,,,"NA NA","NA NA","NA NA NA NA NA NA NA NA","https://twitter.com/Ilhan/status/1253768567004291072","Rep. Ilhan Omar","Minneapolis, MN and Washington, DC","Representing Minnesota's 5th District in the People's House. @USProgressives Whip and Midwest Regional Whip.","https://t.co/etKOoQglhI",FALSE,684581,357,1859,2192,1069,2019-01-07 17:53:13,TRUE,"https://t.co/etKOoQglhI","http://omar.house.gov",,"https://pbs.twimg.com/profile_banners/1082334352711790593/1579139444",,"http://pbs.twimg.com/profile_images/1082685661621178373/ledtkemL_normal.jpg"
"x1082334352711790593","x1253754424952000512",2020-04-24 18:35:23,"Ilhan","On this somber day, I join Armenians in Minnesota and around the world in mourning the lives lost and honor the extraordinary resilience of the Armenian people. #ArmenianGenocide","Twitter Web App",178,,,,FALSE,FALSE,2897,390,,,"ArmenianGenocide",,,,,,,,,,,,,,,"en",,,,,,,,,,,,,,,,,,,,,,,,,,,,,,,,,,,,,"NA NA","NA NA","NA NA NA NA NA NA NA NA","https://twitter.com/Ilhan/status/1253754424952000512","Rep. Ilhan Omar","Minneapolis, MN and Washington, DC","Representing Minnesota's 5th District in the People's House. @USProgressives Whip and Midwest Regional Whip.","https://t.co/etKOoQglhI",FALSE,684581,357,1859,2192,1069,2019-01-07 17:53:13,TRUE,"https://t.co/etKOoQglhI","http://omar.house.gov",,"https://pbs.twimg.com/profile_banners/1082334352711790593/1579139444",,"http://pbs.twimg.com/profile_images/1082685661621178373/ledtkemL_normal.jpg"
"x1082334352711790593","x1253731635348062208",2020-04-24 17:04:49,"Ilhan","We’re live on Facebook answering your questions about unemployment insurance. 

Join us! https://t.co/HPYO1d9cuF","Twitter Web App",112,,,,FALSE,FALSE,113,28,,,,,"facebook.com/RepIlhan/","https://t.co/HPYO1d9cuF","https://www.facebook.com/RepIlhan/",,,,,,,,,,,"en",,,,,,,,,,,,,,,,,,,,,,,,,,,,,,,,,,,,,"NA NA","NA NA","NA NA NA NA NA NA NA NA","https://twitter.com/Ilhan/status/1253731635348062208","Rep. Ilhan Omar","Minneapolis, MN and Washington, DC","Representing Minnesota's 5th District in the People's House. @USProgressives Whip and Midwest Regional Whip.","https://t.co/etKOoQglhI",FALSE,684581,357,1859,2192,1069,2019-01-07 17:53:13,TRUE,"https://t.co/etKOoQglhI","http://omar.house.gov",,"https://pbs.twimg.com/profile_banners/1082334352711790593/1579139444",,"http://pbs.twimg.com/profile_images/1082685661621178373/ledtkemL_normal.jpg"
"x1082334352711790593","x1253714730025390083",2020-04-24 15:57:39,"Ilhan","Our unemployment insurance town hall with @MNDEED will be today at 12pm CT. 

Tune in🎥: https://t.co/tb6Af5RaAR https://t.co/lip0z192Is","Twitter Web App",111,,,,FALSE,FALSE,82,14,,,,,"Facebook.com/RepIlhan","https://t.co/tb6Af5RaAR","http://Facebook.com/RepIlhan","http://pbs.twimg.com/media/EWYWsHdWkAA8QoT.jpg","https://t.co/lip0z192Is","https://twitter.com/Ilhan/status/1253714730025390083/photo/1","photo","http://pbs.twimg.com/media/EWYWsHdWkAA8QoT.jpg","https://t.co/lip0z192Is","https://twitter.com/Ilhan/status/1253714730025390083/photo/1",,"x54329002","mndeed","en",,,,,,,,,,,,,,,,,,,,,,,,,,,,,,,,,,,,,"NA NA","NA NA","NA NA NA NA NA NA NA NA","https://twitter.com/Ilhan/status/1253714730025390083","Rep. Ilhan Omar","Minneapolis, MN and Washington, DC","Representing Minnesota's 5th District in the People's House. @USProgressives Whip and Midwest Regional Whip.","https://t.co/etKOoQglhI",FALSE,684581,357,1859,2192,1069,2019-01-07 17:53:13,TRUE,"https://t.co/etKOoQglhI","http://omar.house.gov",,"https://pbs.twimg.com/profile_banners/1082334352711790593/1579139444",,"http://pbs.twimg.com/profile_images/1082685661621178373/ledtkemL_normal.jpg"
"x1082334352711790593","x1253703386748379138",2020-04-24 15:12:34,"Ilhan","We need to help the MILLIONS of people suffering with real relief. People need: 

-Monthly cash assistance 
-Universal healthcare 
-Vote by mail for all
-PPE and hazard pay for frontline workers 

It’s time to #PutPeopleFirst.","Twitter Web App",226,,,,FALSE,FALSE,1410,319,,,"PutPeopleFirst",,,,,,,,,,,,,,,"en",,,,,,,,,,,,,,,,,,,,,,,,,,,,,,,,,,,,,"NA NA","NA NA","NA NA NA NA NA NA NA NA","https://twitter.com/Ilhan/status/1253703386748379138","Rep. Ilhan Omar","Minneapolis, MN and Washington, DC","Representing Minnesota's 5th District in the People's House. @USProgressives Whip and Midwest Regional Whip.","https://t.co/etKOoQglhI",FALSE,684581,357,1859,2192,1069,2019-01-07 17:53:13,TRUE,"https://t.co/etKOoQglhI","http://omar.house.gov",,"https://pbs.twimg.com/profile_banners/1082334352711790593/1579139444",,"http://pbs.twimg.com/profile_images/1082685661621178373/ledtkemL_normal.jpg"
"x1082334352711790593","x1253429275685818368",2020-04-23 21:03:21,"Ilhan","Ramadan Mubarak!
 
I know Ramadan will be different this year, but let this season be a reminder to us all of the importance of community, compassion, and prosperity for all.","Twitter Web App",174,,,,FALSE,FALSE,5530,868,,,,,,,,,,,,,,,,,,"en",,,,,,,,,,,,,,,,,,,,,,,,,,,,,,,,,,,,,"NA NA","NA NA","NA NA NA NA NA NA NA NA","https://twitter.com/Ilhan/status/1253429275685818368","Rep. Ilhan Omar","Minneapolis, MN and Washington, DC","Representing Minnesota's 5th District in the People's House. @USProgressives Whip and Midwest Regional Whip.","https://t.co/etKOoQglhI",FALSE,684581,357,1859,2192,1069,2019-01-07 17:53:13,TRUE,"https://t.co/etKOoQglhI","http://omar.house.gov",,"https://pbs.twimg.com/profile_banners/1082334352711790593/1579139444",,"http://pbs.twimg.com/profile_images/1082685661621178373/ledtkemL_normal.jpg"
"x1082334352711790593","x1253414065461841922",2020-04-23 20:02:55,"Ilhan","Absolutely devastating. I just visited this facility last year. 

We need to get more resources and expertise for long-term care facilities ASAP—and make sure their workers are protected too. https://t.co/jlqEtMPzWp","Twitter Web App",191,,,,TRUE,FALSE,301,50,,,,,"twitter.com/KSTP/status/12…","https://t.co/jlqEtMPzWp","https://twitter.com/KSTP/status/1253292557766967297",,,,,,,,,,,"en","x1253292557766967297","Senior care facility hit hard by COVID-19 deaths increases infection prevention efforts https://t.co/SrcIzWMpD2",2020-04-23 12:00:05,"SocialNewsDesk",0,1,"x17278675","KSTP","KSTP",107025,539,145278,"Twin Cities | Minnesota","KSTP-TV, the home of 5 Eyewitness News and ABC in the Twin Cities.  KSTP-TV is a station of Hubbard Broadcasting, Inc., a pioneering broadcast company.",TRUE,,,,,,,,,,,,,,,,,,,,,,"NA NA","NA NA","NA NA NA NA NA NA NA NA","https://twitter.com/Ilhan/status/1253414065461841922","Rep. Ilhan Omar","Minneapolis, MN and Washington, DC","Representing Minnesota's 5th District in the People's House. @USProgressives Whip and Midwest Regional Whip.","https://t.co/etKOoQglhI",FALSE,684581,357,1859,2192,1069,2019-01-07 17:53:13,TRUE,"https://t.co/etKOoQglhI","http://omar.house.gov",,"https://pbs.twimg.com/profile_banners/1082334352711790593/1579139444",,"http://pbs.twimg.com/profile_images/1082685661621178373/ledtkemL_normal.jpg"
"x1082334352711790593","x1253407021216514048",2020-04-23 19:34:55,"Ilhan","We need to cancel rent and mortgages for the duration of the crisis.
We need to provide universal monthly payments to all Americans.
And we need to make sure our states and cities don’t go bankrupt. 
 
We need to pass a fourth relief package immediately. https://t.co/Z4MWPWWKtW","Twitter Media Studio",254,,,,FALSE,FALSE,2080,495,,,,,,,,"http://pbs.twimg.com/amplify_video_thumb/1253404071488339970/img/z1f0GuN9CjSTGCN_.jpg","https://t.co/Z4MWPWWKtW","https://twitter.com/Ilhan/status/1253407021216514048/video/1","photo","http://pbs.twimg.com/amplify_video_thumb/1253404071488339970/img/z1f0GuN9CjSTGCN_.jpg","https://t.co/Z4MWPWWKtW","https://twitter.com/Ilhan/status/1253407021216514048/video/1",,,,"en",,,,,,,,,,,,,,,,,,,,,,,,,,,,,,,,,,,,,"NA NA","NA NA","NA NA NA NA NA NA NA NA","https://twitter.com/Ilhan/status/1253407021216514048","Rep. Ilhan Omar","Minneapolis, MN and Washington, DC","Representing Minnesota's 5th District in the People's House. @USProgressives Whip and Midwest Regional Whip.","https://t.co/etKOoQglhI",FALSE,684581,357,1859,2192,1069,2019-01-07 17:53:13,TRUE,"https://t.co/etKOoQglhI","http://omar.house.gov",,"https://pbs.twimg.com/profile_banners/1082334352711790593/1579139444",,"http://pbs.twimg.com/profile_images/1082685661621178373/ledtkemL_normal.jpg"
"x1082334352711790593","x1253368415206735873",2020-04-23 17:01:31,"Ilhan","Testing has just expanded in Minnesota! 

We now will have the capacity to test 20,000 Minnesotans per day. 

Thank you @GovTimWalz for your leadership on this. https://t.co/YxMFBNorMY","Twitter Web App",160,,,,TRUE,FALSE,540,79,,,,,"twitter.com/GovTimWalz/sta…","https://t.co/YxMFBNorMY","https://twitter.com/GovTimWalz/status/1253041114975797259",,,,,,,,,"x1064603540956565504","GovTimWalz","en","x1253041114975797259","Today we announced a breakthrough in rapid, widespread testing of COVID-19. When Minnesota faces a challenge, we rise up—together. I’m proud to partner with Minnesota’s innovative research and health care systems to pioneer how states can begin to move forward amid COVID-19. https://t.co/82r2RF4UjK",2020-04-22 19:20:56,"Twitter Web App",4021,660,"x1064603540956565504","GovTimWalz","Governor Tim Walz",92006,976,1759,"Minnesota, USA","Dad, husband, teacher, coach, veteran. Governor of Minnesota. Working to build #OneMinnesota.

Visit https://t.co/GaWEw6YeFY for the latest on COVID-19.",TRUE,,,,,,,,,,,,,,,,,,,,,,"NA NA","NA NA","NA NA NA NA NA NA NA NA","https://twitter.com/Ilhan/status/1253368415206735873","Rep. Ilhan Omar","Minneapolis, MN and Washington, DC","Representing Minnesota's 5th District in the People's House. @USProgressives Whip and Midwest Regional Whip.","https://t.co/etKOoQglhI",FALSE,684581,357,1859,2192,1069,2019-01-07 17:53:13,TRUE,"https://t.co/etKOoQglhI","http://omar.house.gov",,"https://pbs.twimg.com/profile_banners/1082334352711790593/1579139444",,"http://pbs.twimg.com/profile_images/1082685661621178373/ledtkemL_normal.jpg"
"x1082334352711790593","x1253324704657444867",2020-04-23 14:07:49,"Ilhan","🚨Our unemployment insurance town hall with @MNDEED will now be held this Friday at 12pm CT. 

Tune in and get your questions answered! https://t.co/i5jmbigNaU","Twitter Web App",134,,,,FALSE,FALSE,148,42,,,,,,,,"http://pbs.twimg.com/media/EWSzllFUEAAtUCJ.jpg","https://t.co/i5jmbigNaU","https://twitter.com/Ilhan/status/1253324704657444867/photo/1","photo","http://pbs.twimg.com/media/EWSzllFUEAAtUCJ.jpg","https://t.co/i5jmbigNaU","https://twitter.com/Ilhan/status/1253324704657444867/photo/1",,"x54329002","mndeed","en",,,,,,,,,,,,,,,,,,,,,,,,,,,,,,,,,,,,,"NA NA","NA NA","NA NA NA NA NA NA NA NA","https://twitter.com/Ilhan/status/1253324704657444867","Rep. Ilhan Omar","Minneapolis, MN and Washington, DC","Representing Minnesota's 5th District in the People's House. @USProgressives Whip and Midwest Regional Whip.","https://t.co/etKOoQglhI",FALSE,684581,357,1859,2192,1069,2019-01-07 17:53:13,TRUE,"https://t.co/etKOoQglhI","http://omar.house.gov",,"https://pbs.twimg.com/profile_banners/1082334352711790593/1579139444",,"http://pbs.twimg.com/profile_images/1082685661621178373/ledtkemL_normal.jpg"
"x1082334352711790593","x1253303860380262401",2020-04-23 12:45:00,"Ilhan","Banks need to suspend all interest fees and penalties. 

No company should be profiting off the backs of hurting Americans.","TweetDeck",123,,,,FALSE,FALSE,3986,683,,,,,,,,,,,,,,,,,,"en",,,,,,,,,,,,,,,,,,,,,,,,,,,,,,,,,,,,,"NA NA","NA NA","NA NA NA NA NA NA NA NA","https://twitter.com/Ilhan/status/1253303860380262401","Rep. Ilhan Omar","Minneapolis, MN and Washington, DC","Representing Minnesota's 5th District in the People's House. @USProgressives Whip and Midwest Regional Whip.","https://t.co/etKOoQglhI",FALSE,684581,357,1859,2192,1069,2019-01-07 17:53:13,TRUE,"https://t.co/etKOoQglhI","http://omar.house.gov",,"https://pbs.twimg.com/profile_banners/1082334352711790593/1579139444",,"http://pbs.twimg.com/profile_images/1082685661621178373/ledtkemL_normal.jpg"
