"x25073877","x1267132763116838913",2020-05-31 16:36:07,"realDonaldTrump","The Lamestream Media is doing everything within their power to foment hatred and anarchy. As long as everybody understands what they are doing, that they are FAKE NEWS and truly bad people with a sick agenda, we can easily work through them to GREATNESS!","Twitter for iPhone",254,,,,FALSE,FALSE,305547,74698,,,,,,,,,,,,,,,,,,"en",,,,,,,,,,,,,,,,,,,,,,,,,,,,,,,,,,,,,"NA NA","NA NA","NA NA NA NA NA NA NA NA","https://twitter.com/realDonaldTrump/status/1267132763116838913","Donald J. Trump","Washington, DC","45th President of the United States of America🇺🇸","https://t.co/OMxB0x7xC5",FALSE,81802785,46,114863,52448,4,2009-03-18 13:46:38,TRUE,"https://t.co/OMxB0x7xC5","http://www.Instagram.com/realDonaldTrump",,"https://pbs.twimg.com/profile_banners/25073877/1583212785","http://abs.twimg.com/images/themes/theme1/bg.png","http://pbs.twimg.com/profile_images/874276197357596672/kUuht00m_normal.jpg"
"x25073877","x1267129644228247552",2020-05-31 16:23:43,"realDonaldTrump","The United States of America will be designating ANTIFA as a Terrorist Organization.","Twitter for iPhone",84,,,,FALSE,FALSE,832765,225929,,,,,,,,,,,,,,,,,,"en",,,,,,,,,,,,,,,,,,,,,,,,,,,,,,,,,,,,,"NA NA","NA NA","NA NA NA NA NA NA NA NA","https://twitter.com/realDonaldTrump/status/1267129644228247552","Donald J. Trump","Washington, DC","45th President of the United States of America🇺🇸","https://t.co/OMxB0x7xC5",FALSE,81802785,46,114863,52448,4,2009-03-18 13:46:38,TRUE,"https://t.co/OMxB0x7xC5","http://www.Instagram.com/realDonaldTrump",,"https://pbs.twimg.com/profile_banners/25073877/1583212785","http://abs.twimg.com/images/themes/theme1/bg.png","http://pbs.twimg.com/profile_images/874276197357596672/kUuht00m_normal.jpg"
"x25073877","x1267126801186394118",2020-05-31 16:12:26,"realDonaldTrump","Other Democrat run Cities and States should look at the total shutdown of Radical Left Anarchists in Minneapolis last night. The National Guard did a great job, and should be used in other States before it is too late!","Twitter for iPhone",218,,,,FALSE,FALSE,180143,40402,,,,,,,,,,,,,,,,,,"en",,,,,,,,,,,,,,,,,,,,,,,,,,,,,,,,,,,,,"NA NA","NA NA","NA NA NA NA NA NA NA NA","https://twitter.com/realDonaldTrump/status/1267126801186394118","Donald J. Trump","Washington, DC","45th President of the United States of America🇺🇸","https://t.co/OMxB0x7xC5",FALSE,81802785,46,114863,52448,4,2009-03-18 13:46:38,TRUE,"https://t.co/OMxB0x7xC5","http://www.Instagram.com/realDonaldTrump",,"https://pbs.twimg.com/profile_banners/25073877/1583212785","http://abs.twimg.com/images/themes/theme1/bg.png","http://pbs.twimg.com/profile_images/874276197357596672/kUuht00m_normal.jpg"
"x25073877","x1267124501361369091",2020-05-31 16:03:17,"realDonaldTrump","Congratulations to our National Guard for the great job they did immediately upon arriving in Minneapolis, Minnesota, last night. The ANTIFA led anarchists, among others, were shut down quickly. Should have been done by Mayor on first night and there would have been no trouble!","Twitter for iPhone",278,,,,FALSE,FALSE,234026,49785,,,,,,,,,,,,,,,,,,"en",,,,,,,,,,,,,,,,,,,,,,,,,,,,,,,,,,,,,"NA NA","NA NA","NA NA NA NA NA NA NA NA","https://twitter.com/realDonaldTrump/status/1267124501361369091","Donald J. Trump","Washington, DC","45th President of the United States of America🇺🇸","https://t.co/OMxB0x7xC5",FALSE,81802785,46,114863,52448,4,2009-03-18 13:46:38,TRUE,"https://t.co/OMxB0x7xC5","http://www.Instagram.com/realDonaldTrump",,"https://pbs.twimg.com/profile_banners/25073877/1583212785","http://abs.twimg.com/images/themes/theme1/bg.png","http://pbs.twimg.com/profile_images/874276197357596672/kUuht00m_normal.jpg"
"x25073877","x1266915358914621440",2020-05-31 02:12:14,"realDonaldTrump","Let New York’s Finest be New York’s Finest. There is nobody better, but they must be allowed to do their job!","Twitter for iPhone",109,,,,FALSE,FALSE,203711,33888,,,,,,,,,,,,,,,,,,"en",,,,,,,,,,,,,,,,,,,,,,,,,,,,,,,,,,,,,"NA NA","NA NA","NA NA NA NA NA NA NA NA","https://twitter.com/realDonaldTrump/status/1266915358914621440","Donald J. Trump","Washington, DC","45th President of the United States of America🇺🇸","https://t.co/OMxB0x7xC5",FALSE,81802785,46,114863,52448,4,2009-03-18 13:46:38,TRUE,"https://t.co/OMxB0x7xC5","http://www.Instagram.com/realDonaldTrump",,"https://pbs.twimg.com/profile_banners/25073877/1583212785","http://abs.twimg.com/images/themes/theme1/bg.png","http://pbs.twimg.com/profile_images/874276197357596672/kUuht00m_normal.jpg"
"x25073877","x1266914470066036736",2020-05-31 02:08:42,"realDonaldTrump","The National Guard has been released in Minneapolis to do the job that the Democrat Mayor couldn’t do. Should have been used 2 days ago &amp; there would not have been damage &amp; Police Headquarters would not have been taken over &amp; ruined. Great job by the National Guard. No games!","Twitter for iPhone",288,,,,FALSE,FALSE,294417,62473,,,,,,,,,,,,,,,,,,"en",,,,,,,,,,,,,,,,,,,,,,,,,,,,,,,,,,,,,"NA NA","NA NA","NA NA NA NA NA NA NA NA","https://twitter.com/realDonaldTrump/status/1266914470066036736","Donald J. Trump","Washington, DC","45th President of the United States of America🇺🇸","https://t.co/OMxB0x7xC5",FALSE,81802785,46,114863,52448,4,2009-03-18 13:46:38,TRUE,"https://t.co/OMxB0x7xC5","http://www.Instagram.com/realDonaldTrump",,"https://pbs.twimg.com/profile_banners/25073877/1583212785","http://abs.twimg.com/images/themes/theme1/bg.png","http://pbs.twimg.com/profile_images/874276197357596672/kUuht00m_normal.jpg"
"x25073877","x1266895821083234304",2020-05-31 00:54:36,"realDonaldTrump","https://t.co/qD52HYuvpH","Twitter for iPhone",23,,,,FALSE,FALSE,87609,27951,,,,,,,,"http://pbs.twimg.com/amplify_video_thumb/1266794022376480768/img/zrmwBJtDfYDUlDdi.jpg","https://t.co/qD52HYuvpH","https://twitter.com/CBSNews/status/1266794084225687556/video/1","photo","http://pbs.twimg.com/amplify_video_thumb/1266794022376480768/img/zrmwBJtDfYDUlDdi.jpg","https://t.co/qD52HYuvpH","https://twitter.com/CBSNews/status/1266794084225687556/video/1",,,,"und",,,,,,,,,,,,,,,,,,,,,,,,,,,,,,,,,,,,,"NA NA","NA NA","NA NA NA NA NA NA NA NA","https://twitter.com/realDonaldTrump/status/1266895821083234304","Donald J. Trump","Washington, DC","45th President of the United States of America🇺🇸","https://t.co/OMxB0x7xC5",FALSE,81802785,46,114863,52448,4,2009-03-18 13:46:38,TRUE,"https://t.co/OMxB0x7xC5","http://www.Instagram.com/realDonaldTrump",,"https://pbs.twimg.com/profile_banners/25073877/1583212785","http://abs.twimg.com/images/themes/theme1/bg.png","http://pbs.twimg.com/profile_images/874276197357596672/kUuht00m_normal.jpg"
"x25073877","x1266887324505382912",2020-05-31 00:20:50,"realDonaldTrump","MN Gov. Walz: We Estimate 80% of the Rioters Are from out of State https://t.co/WNRFjZA2Lu via @BreitbartNews","Twitter for iPhone",109,,,,FALSE,FALSE,59322,20754,,,,,"breitbart.com/clips/2020/05/…","https://t.co/WNRFjZA2Lu","https://www.breitbart.com/clips/2020/05/30/mn-gov-walz-we-estimate-80-of-the-rioters-are-from-out-of-state/",,,,,,,,,"x457984599","BreitbartNews","en",,,,,,,,,,,,,,,,,,,,,,,,,,,,,,,,,,,,,"NA NA","NA NA","NA NA NA NA NA NA NA NA","https://twitter.com/realDonaldTrump/status/1266887324505382912","Donald J. Trump","Washington, DC","45th President of the United States of America🇺🇸","https://t.co/OMxB0x7xC5",FALSE,81802785,46,114863,52448,4,2009-03-18 13:46:38,TRUE,"https://t.co/OMxB0x7xC5","http://www.Instagram.com/realDonaldTrump",,"https://pbs.twimg.com/profile_banners/25073877/1583212785","http://abs.twimg.com/images/themes/theme1/bg.png","http://pbs.twimg.com/profile_images/874276197357596672/kUuht00m_normal.jpg"
"x25073877","x1266800827621990400",2020-05-30 18:37:07,"realDonaldTrump","Hopefully a great, successful and safe ROCKET LAUNCH. Lifting off soon!?!?  @FoxNews  @OANN","Twitter for iPhone",91,,,,FALSE,FALSE,143749,19295,,,,,,,,,,,,,,,,"x1367531 x1209936918","FoxNews OANN","en",,,,,,,,,,,,,,,,,,,,,,,,,,,,,,,,,,,,,"NA NA","NA NA","NA NA NA NA NA NA NA NA","https://twitter.com/realDonaldTrump/status/1266800827621990400","Donald J. Trump","Washington, DC","45th President of the United States of America🇺🇸","https://t.co/OMxB0x7xC5",FALSE,81802785,46,114863,52448,4,2009-03-18 13:46:38,TRUE,"https://t.co/OMxB0x7xC5","http://www.Instagram.com/realDonaldTrump",,"https://pbs.twimg.com/profile_banners/25073877/1583212785","http://abs.twimg.com/images/themes/theme1/bg.png","http://pbs.twimg.com/profile_images/874276197357596672/kUuht00m_normal.jpg"
"x25073877","x1266800113260703744",2020-05-30 18:34:17,"realDonaldTrump","80% of the RIOTERS in Minneapolis last night were from OUT OF STATE. They are harming businesses (especially African American small businesses), homes, and the community of good, hardworking Minneapolis residents who want peace, equality, and to provide for their families.","Twitter for iPhone",273,,,,FALSE,FALSE,205088,53737,,,,,,,,,,,,,,,,,,"en",,,,,,,,,,,,,,,,,,,,,,,,,,,,,,,,,,,,,"NA NA","NA NA","NA NA NA NA NA NA NA NA","https://twitter.com/realDonaldTrump/status/1266800113260703744","Donald J. Trump","Washington, DC","45th President of the United States of America🇺🇸","https://t.co/OMxB0x7xC5",FALSE,81802785,46,114863,52448,4,2009-03-18 13:46:38,TRUE,"https://t.co/OMxB0x7xC5","http://www.Instagram.com/realDonaldTrump",,"https://pbs.twimg.com/profile_banners/25073877/1583212785","http://abs.twimg.com/images/themes/theme1/bg.png","http://pbs.twimg.com/profile_images/874276197357596672/kUuht00m_normal.jpg"
"x25073877","x1266799941273350145",2020-05-30 18:33:36,"realDonaldTrump","Much more “disinformation” coming out of CNN, MSDNC, @nytimes and @washingtonpost, by far, than coming out of any foreign country, even combined. Fake News is the Enemy of the People!","Twitter for iPhone",183,,,,FALSE,FALSE,153167,40812,,,,,,,,,,,,,,,,"x807095 x2467791","nytimes washingtonpost","en",,,,,,,,,,,,,,,,,,,,,,,,,,,,,,,,,,,,,"NA NA","NA NA","NA NA NA NA NA NA NA NA","https://twitter.com/realDonaldTrump/status/1266799941273350145","Donald J. Trump","Washington, DC","45th President of the United States of America🇺🇸","https://t.co/OMxB0x7xC5",FALSE,81802785,46,114863,52448,4,2009-03-18 13:46:38,TRUE,"https://t.co/OMxB0x7xC5","http://www.Instagram.com/realDonaldTrump",,"https://pbs.twimg.com/profile_banners/25073877/1583212785","http://abs.twimg.com/images/themes/theme1/bg.png","http://pbs.twimg.com/profile_images/874276197357596672/kUuht00m_normal.jpg"
"x25073877","x1266796670609588225",2020-05-30 18:20:36,"realDonaldTrump","Crossing State lines to incite violence is a FEDERAL CRIME! Liberal Governors and Mayors must get MUCH tougher or the Federal Government will step in and do what has to be done, and that includes using the unlimited power of our Military and many arrests. Thank you!","Twitter for iPhone",266,,,,FALSE,FALSE,261920,67386,,,,,,,,,,,,,,,,,,"en",,,,,,,,,,,,,,,,,,,,,,,,,,,,,,,,,,,,,"NA NA","NA NA","NA NA NA NA NA NA NA NA","https://twitter.com/realDonaldTrump/status/1266796670609588225","Donald J. Trump","Washington, DC","45th President of the United States of America🇺🇸","https://t.co/OMxB0x7xC5",FALSE,81802785,46,114863,52448,4,2009-03-18 13:46:38,TRUE,"https://t.co/OMxB0x7xC5","http://www.Instagram.com/realDonaldTrump",,"https://pbs.twimg.com/profile_banners/25073877/1583212785","http://abs.twimg.com/images/themes/theme1/bg.png","http://pbs.twimg.com/profile_images/874276197357596672/kUuht00m_normal.jpg"
"x25073877","x1266777430016102403",2020-05-30 17:04:09,"realDonaldTrump","Here we go again. Fake News @CNN is blaming RUSSIA, RUSSIA, RUSSIA. They are sick losers with VERY bad ratings! P.S. Can’t blame China because they need the cash?","Twitter for iPhone",162,,,,FALSE,FALSE,197653,45156,,,,,,,,,,,,,,,,"x759251","CNN","en",,,,,,,,,,,,,,,,,,,,,,,,,,,,,,,,,,,,,"NA NA","NA NA","NA NA NA NA NA NA NA NA","https://twitter.com/realDonaldTrump/status/1266777430016102403","Donald J. Trump","Washington, DC","45th President of the United States of America🇺🇸","https://t.co/OMxB0x7xC5",FALSE,81802785,46,114863,52448,4,2009-03-18 13:46:38,TRUE,"https://t.co/OMxB0x7xC5","http://www.Instagram.com/realDonaldTrump",,"https://pbs.twimg.com/profile_banners/25073877/1583212785","http://abs.twimg.com/images/themes/theme1/bg.png","http://pbs.twimg.com/profile_images/874276197357596672/kUuht00m_normal.jpg"
"x25073877","x1266760009872007171",2020-05-30 15:54:56,"realDonaldTrump","It’s ANTIFA and the Radical Left. Don’t lay the blame on others!","Twitter for iPhone",64,,,,FALSE,FALSE,365649,89229,,,,,,,,,,,,,,,,,,"en",,,,,,,,,,,,,,,,,,,,,,,,,,,,,,,,,,,,,"NA NA","NA NA","NA NA NA NA NA NA NA NA","https://twitter.com/realDonaldTrump/status/1266760009872007171","Donald J. Trump","Washington, DC","45th President of the United States of America🇺🇸","https://t.co/OMxB0x7xC5",FALSE,81802785,46,114863,52448,4,2009-03-18 13:46:38,TRUE,"https://t.co/OMxB0x7xC5","http://www.Instagram.com/realDonaldTrump",,"https://pbs.twimg.com/profile_banners/25073877/1583212785","http://abs.twimg.com/images/themes/theme1/bg.png","http://pbs.twimg.com/profile_images/874276197357596672/kUuht00m_normal.jpg"
"x25073877","x1266737385120960515",2020-05-30 14:25:02,"realDonaldTrump","Mayor Jacob Frey of Minneapolis will never be mistaken for the late, great General Douglas McArthur or great fighter General George Patton. How come all of these places that defend so poorly are run by Liberal Democrats? Get tough and fight (and arrest the bad ones). STRENGTH!","Twitter for iPhone",277,,,,FALSE,FALSE,160909,37008,,,,,,,,,,,,,,,,,,"en",,,,,,,,,,,,,,,,,,,,,,,,,,,,,,,,,,,,,"NA NA","NA NA","NA NA NA NA NA NA NA NA","https://twitter.com/realDonaldTrump/status/1266737385120960515","Donald J. Trump","Washington, DC","45th President of the United States of America🇺🇸","https://t.co/OMxB0x7xC5",FALSE,81802785,46,114863,52448,4,2009-03-18 13:46:38,TRUE,"https://t.co/OMxB0x7xC5","http://www.Instagram.com/realDonaldTrump",,"https://pbs.twimg.com/profile_banners/25073877/1583212785","http://abs.twimg.com/images/themes/theme1/bg.png","http://pbs.twimg.com/profile_images/874276197357596672/kUuht00m_normal.jpg"
"x25073877","x1266731291917062145",2020-05-30 14:00:49,"realDonaldTrump","These are “Organized Groups” that have nothing to do with George Floyd. Sad!","Twitter for iPhone",76,,,,FALSE,FALSE,315647,66738,,,,,,,,,,,,,,,,,,"en",,,,,,,,,,,,,,,,,,,,,,,,,,,,,,,,,,,,,"NA NA","NA NA","NA NA NA NA NA NA NA NA","https://twitter.com/realDonaldTrump/status/1266731291917062145","Donald J. Trump","Washington, DC","45th President of the United States of America🇺🇸","https://t.co/OMxB0x7xC5",FALSE,81802785,46,114863,52448,4,2009-03-18 13:46:38,TRUE,"https://t.co/OMxB0x7xC5","http://www.Instagram.com/realDonaldTrump",,"https://pbs.twimg.com/profile_banners/25073877/1583212785","http://abs.twimg.com/images/themes/theme1/bg.png","http://pbs.twimg.com/profile_images/874276197357596672/kUuht00m_normal.jpg"
"x25073877","x1266724553620930561",2020-05-30 13:34:02,"realDonaldTrump","The professionally managed so-called “protesters” at the White House had little to do with the memory of George Floyd. They were just there to cause trouble. The @SecretService handled them easily. Tonight, I understand, is MAGA NIGHT AT THE WHITE HOUSE???","Twitter for iPhone",256,,,,FALSE,FALSE,163405,38819,,,,,,,,,,,,,,,,"x115749048","SecretService","en",,,,,,,,,,,,,,,,,,,,,,,,,,,,,,,,,,,,,"NA NA","NA NA","NA NA NA NA NA NA NA NA","https://twitter.com/realDonaldTrump/status/1266724553620930561","Donald J. Trump","Washington, DC","45th President of the United States of America🇺🇸","https://t.co/OMxB0x7xC5",FALSE,81802785,46,114863,52448,4,2009-03-18 13:46:38,TRUE,"https://t.co/OMxB0x7xC5","http://www.Instagram.com/realDonaldTrump",,"https://pbs.twimg.com/profile_banners/25073877/1583212785","http://abs.twimg.com/images/themes/theme1/bg.png","http://pbs.twimg.com/profile_images/874276197357596672/kUuht00m_normal.jpg"
"x25073877","x1266711224391213056",2020-05-30 12:41:04,"realDonaldTrump","....good practice.” As you saw last night, they were very cool &amp; very professional. Never let it get out of hand. Thank you! On the bad side, the D.C. Mayor, @MurielBowser, who is always looking for money &amp; help, wouldn’t let the D.C. Police get involved. “Not their job.” Nice!","Twitter for iPhone",286,"x1266711223657205763","x25073877","realDonaldTrump",FALSE,FALSE,93868,20734,,,,,,,,,,,,,,,,"x245571881","MurielBowser","en",,,,,,,,,,,,,,,,,,,,,,,,,,,,,,,,,,,,,"NA NA","NA NA","NA NA NA NA NA NA NA NA","https://twitter.com/realDonaldTrump/status/1266711224391213056","Donald J. Trump","Washington, DC","45th President of the United States of America🇺🇸","https://t.co/OMxB0x7xC5",FALSE,81802785,46,114863,52448,4,2009-03-18 13:46:38,TRUE,"https://t.co/OMxB0x7xC5","http://www.Instagram.com/realDonaldTrump",,"https://pbs.twimg.com/profile_banners/25073877/1583212785","http://abs.twimg.com/images/themes/theme1/bg.png","http://pbs.twimg.com/profile_images/874276197357596672/kUuht00m_normal.jpg"
"x25073877","x1266711223657205763",2020-05-30 12:41:04,"realDonaldTrump","....have been greeted with the most vicious dogs, and most ominous weapons, I have ever seen. That’s when people would have been really badly hurt, at least. Many Secret Service agents just waiting for action. “We put the young ones on the front line, sir, they love it, and....","Twitter for iPhone",278,"x1266711221836931072","x25073877","realDonaldTrump",FALSE,FALSE,87031,17927,,,,,,,,,,,,,,,,,,"en",,,,,,,,,,,,,,,,,,,,,,,,,,,,,,,,,,,,,"NA NA","NA NA","NA NA NA NA NA NA NA NA","https://twitter.com/realDonaldTrump/status/1266711223657205763","Donald J. Trump","Washington, DC","45th President of the United States of America🇺🇸","https://t.co/OMxB0x7xC5",FALSE,81802785,46,114863,52448,4,2009-03-18 13:46:38,TRUE,"https://t.co/OMxB0x7xC5","http://www.Instagram.com/realDonaldTrump",,"https://pbs.twimg.com/profile_banners/25073877/1583212785","http://abs.twimg.com/images/themes/theme1/bg.png","http://pbs.twimg.com/profile_images/874276197357596672/kUuht00m_normal.jpg"
"x25073877","x1266711221836931072",2020-05-30 12:41:04,"realDonaldTrump","....got too frisky or out of line, they would quickly come down on them, hard - didn’t know what hit them. The front line was replaced with fresh agents, like magic. Big crowd, professionally organized, but nobody came close to breaching the fence. If they had they would....","Twitter for iPhone",275,"x1266711221191020544","x25073877","realDonaldTrump",FALSE,FALSE,59134,12080,,,,,,,,,,,,,,,,,,"en",,,,,,,,,,,,,,,,,,,,,,,,,,,,,,,,,,,,,"NA NA","NA NA","NA NA NA NA NA NA NA NA","https://twitter.com/realDonaldTrump/status/1266711221836931072","Donald J. Trump","Washington, DC","45th President of the United States of America🇺🇸","https://t.co/OMxB0x7xC5",FALSE,81802785,46,114863,52448,4,2009-03-18 13:46:38,TRUE,"https://t.co/OMxB0x7xC5","http://www.Instagram.com/realDonaldTrump",,"https://pbs.twimg.com/profile_banners/25073877/1583212785","http://abs.twimg.com/images/themes/theme1/bg.png","http://pbs.twimg.com/profile_images/874276197357596672/kUuht00m_normal.jpg"
"x25073877","x1266711221191020544",2020-05-30 12:41:04,"realDonaldTrump","Great job last night at the White House by the U.S. @SecretService. They were not only totally professional, but very cool. I was inside, watched every move, and couldn’t have felt more safe. They let the “protesters” scream &amp; rant as much as they wanted, but whenever someone....","Twitter for iPhone",284,,,,FALSE,FALSE,156483,32713,,,,,,,,,,,,,,,,"x115749048","SecretService","en",,,,,,,,,,,,,,,,,,,,,,,,,,,,,,,,,,,,,"NA NA","NA NA","NA NA NA NA NA NA NA NA","https://twitter.com/realDonaldTrump/status/1266711221191020544","Donald J. Trump","Washington, DC","45th President of the United States of America🇺🇸","https://t.co/OMxB0x7xC5",FALSE,81802785,46,114863,52448,4,2009-03-18 13:46:38,TRUE,"https://t.co/OMxB0x7xC5","http://www.Instagram.com/realDonaldTrump",,"https://pbs.twimg.com/profile_banners/25073877/1583212785","http://abs.twimg.com/images/themes/theme1/bg.png","http://pbs.twimg.com/profile_images/874276197357596672/kUuht00m_normal.jpg"
"x25073877","x1266570099454103553",2020-05-30 03:20:18,"realDonaldTrump","Time for a change! #2020 https://t.co/AECy2GBfys","Twitter for iPhone",24,,,,TRUE,FALSE,179913,46462,,,,,"twitter.com/YoungDems4Trum…","https://t.co/AECy2GBfys","https://twitter.com/YoungDems4Trump/status/1266245715824525313",,,,,,,,,,,"en","x1266245715824525313","Minneapolis:

Democrat governor.
Democrat Secretary of State.
Democrat State Auditor.
Democrat Sr US Senator
Democrat Jr US Senator
Democrat Reps 5 / Republicans 3
Democrat Mayor.
Democrat AG.
Democrat Police Chief.
2016 General Elections - Voted Democrat.

#MinneapolisRiot",2020-05-29 05:51:19,"Twitter for iPhone",30755,12725,"x3498448812","YoungDems4Trump","Former Democrats for Trump",200997,837,19019,"#YoungDemocratsForTrump","Endorsed by @GenFlynn and thanked by President @realDonaldTrump himself for helping young Democrats find the truth. Everyone needs to come together to #MAGA.",FALSE,,,,,,,,,,,,,,,,,,,,,,"NA NA","NA NA","NA NA NA NA NA NA NA NA","https://twitter.com/realDonaldTrump/status/1266570099454103553","Donald J. Trump","Washington, DC","45th President of the United States of America🇺🇸","https://t.co/OMxB0x7xC5",FALSE,81802785,46,114863,52448,4,2009-03-18 13:46:38,TRUE,"https://t.co/OMxB0x7xC5","http://www.Instagram.com/realDonaldTrump",,"https://pbs.twimg.com/profile_banners/25073877/1583212785","http://abs.twimg.com/images/themes/theme1/bg.png","http://pbs.twimg.com/profile_images/874276197357596672/kUuht00m_normal.jpg"
"x25073877","x1266455834457968640",2020-05-29 19:46:15,"realDonaldTrump","https://t.co/mljmx2o0G7","Twitter for iPhone",23,,,,FALSE,FALSE,184818,50509,,,,,,,,"http://pbs.twimg.com/amplify_video_thumb/1266447560949919744/img/qEysNXz_Xik19k65.jpg","https://t.co/mljmx2o0G7","https://twitter.com/TeamTrump/status/1266448368261230592/video/1","photo","http://pbs.twimg.com/amplify_video_thumb/1266447560949919744/img/qEysNXz_Xik19k65.jpg","https://t.co/mljmx2o0G7","https://twitter.com/TeamTrump/status/1266448368261230592/video/1",,,,"und",,,,,,,,,,,,,,,,,,,,,,,,,,,,,,,,,,,,,"NA NA","NA NA","NA NA NA NA NA NA NA NA","https://twitter.com/realDonaldTrump/status/1266455834457968640","Donald J. Trump","Washington, DC","45th President of the United States of America🇺🇸","https://t.co/OMxB0x7xC5",FALSE,81802785,46,114863,52448,4,2009-03-18 13:46:38,TRUE,"https://t.co/OMxB0x7xC5","http://www.Instagram.com/realDonaldTrump",,"https://pbs.twimg.com/profile_banners/25073877/1583212785","http://abs.twimg.com/images/themes/theme1/bg.png","http://pbs.twimg.com/profile_images/874276197357596672/kUuht00m_normal.jpg"
"x25073877","x1266434155543506945",2020-05-29 18:20:06,"realDonaldTrump","....It was spoken as a fact, not as a statement. It’s very simple, nobody should have any problem with this other than the haters, and those looking to cause trouble on social media. Honor the memory of George Floyd!","Twitter for iPhone",216,"x1266434153932894208","x25073877","realDonaldTrump",FALSE,FALSE,165151,32129,,,,,,,,,,,,,,,,,,"en",,,,,,,,,,,,,,,,,,,,,,,,,,,,,,,,,,,,,"NA NA","NA NA","NA NA NA NA NA NA NA NA","https://twitter.com/realDonaldTrump/status/1266434155543506945","Donald J. Trump","Washington, DC","45th President of the United States of America🇺🇸","https://t.co/OMxB0x7xC5",FALSE,81802785,46,114863,52448,4,2009-03-18 13:46:38,TRUE,"https://t.co/OMxB0x7xC5","http://www.Instagram.com/realDonaldTrump",,"https://pbs.twimg.com/profile_banners/25073877/1583212785","http://abs.twimg.com/images/themes/theme1/bg.png","http://pbs.twimg.com/profile_images/874276197357596672/kUuht00m_normal.jpg"
"x25073877","x1266434153932894208",2020-05-29 18:20:06,"realDonaldTrump","Looting leads to shooting, and that’s why a man was shot and killed in Minneapolis on Wednesday night - or look at what just happened in Louisville with 7 people shot. I don’t want this to happen, and that’s what the expression put out last night means....","Twitter for iPhone",256,,,,FALSE,FALSE,254159,54222,,,,,,,,,,,,,,,,,,"en",,,,,,,,,,,,,,,,,,,,,,,,,,,,,,,,,,,,,"NA NA","NA NA","NA NA NA NA NA NA NA NA","https://twitter.com/realDonaldTrump/status/1266434153932894208","Donald J. Trump","Washington, DC","45th President of the United States of America🇺🇸","https://t.co/OMxB0x7xC5",FALSE,81802785,46,114863,52448,4,2009-03-18 13:46:38,TRUE,"https://t.co/OMxB0x7xC5","http://www.Instagram.com/realDonaldTrump",,"https://pbs.twimg.com/profile_banners/25073877/1583212785","http://abs.twimg.com/images/themes/theme1/bg.png","http://pbs.twimg.com/profile_images/874276197357596672/kUuht00m_normal.jpg"
"x25073877","x1266387743996870656",2020-05-29 15:15:41,"realDonaldTrump","REVOKE 230!","Twitter for iPhone",11,,,,FALSE,FALSE,202607,39360,,,,,,,,,,,,,,,,,,"en",,,,,,,,,,,,,,,,,,,,,,,,,,,,,,,,,,,,,"NA NA","NA NA","NA NA NA NA NA NA NA NA","https://twitter.com/realDonaldTrump/status/1266387743996870656","Donald J. Trump","Washington, DC","45th President of the United States of America🇺🇸","https://t.co/OMxB0x7xC5",FALSE,81802785,46,114863,52448,4,2009-03-18 13:46:38,TRUE,"https://t.co/OMxB0x7xC5","http://www.Instagram.com/realDonaldTrump",,"https://pbs.twimg.com/profile_banners/25073877/1583212785","http://abs.twimg.com/images/themes/theme1/bg.png","http://pbs.twimg.com/profile_images/874276197357596672/kUuht00m_normal.jpg"
