"user_id","status_id","created_at","screen_name","text","source","display_text_width","reply_to_status_id","reply_to_user_id","reply_to_screen_name","is_quote","is_retweet","favorite_count","retweet_count","quote_count","reply_count","hashtags","symbols","urls_url","urls_t.co","urls_expanded_url","media_url","media_t.co","media_expanded_url","media_type","ext_media_url","ext_media_t.co","ext_media_expanded_url","ext_media_type","mentions_user_id","mentions_screen_name","lang","quoted_status_id","quoted_text","quoted_created_at","quoted_source","quoted_favorite_count","quoted_retweet_count","quoted_user_id","quoted_screen_name","quoted_name","quoted_followers_count","quoted_friends_count","quoted_statuses_count","quoted_location","quoted_description","quoted_verified","retweet_status_id","retweet_text","retweet_created_at","retweet_source","retweet_favorite_count","retweet_retweet_count","retweet_user_id","retweet_screen_name","retweet_name","retweet_followers_count","retweet_friends_count","retweet_statuses_count","retweet_location","retweet_description","retweet_verified","place_url","place_name","place_full_name","place_type","country","country_code","geo_coords","coords_coords","bbox_coords","status_url","name","location","description","url","protected","followers_count","friends_count","listed_count","statuses_count","favourites_count","account_created_at","verified","profile_url","profile_expanded_url","account_lang","profile_banner_url","profile_background_url","profile_image_url"
"x25073877","x1253541647696179200",2020-04-24 04:29:53,"realDonaldTrump","Important news! https://t.co/4dmVvJ4IM6","Twitter for iPhone",15,,,,TRUE,FALSE,24219,5769,,,,,"twitter.com/whitehouse/sta…","https://t.co/4dmVvJ4IM6","https://twitter.com/whitehouse/status/1253102278971666437",,,,,,,,,,,"en","x1253102278971666437","President @realDonaldTrump is suspending new immigrant visas to put American communities and workers FIRST as we move toward safely reopening the economy. https://t.co/OkYqOPtN8Y",2020-04-22 23:23:59,"TheWhiteHouse",26316,6027,"x822215673812119553","WhiteHouse","The White House",21871775,20,17636,"Washington, D.C.","Welcome to @WhiteHouse! Follow for the latest from President @realDonaldTrump and his Administration. Tweets may be archived: https://t.co/IURuMIrzxb",TRUE,,,,,,,,,,,,,,,,,,,,,,"NA NA","NA NA","NA NA NA NA NA NA NA NA","https://twitter.com/realDonaldTrump/status/1253541647696179200","Donald J. Trump","Washington, DC","45th President of the United States of America🇺🇸","https://t.co/OMxB0x7xC5",FALSE,78280539,47,120050,50907,6,2009-03-18 13:46:38,TRUE,"https://t.co/OMxB0x7xC5","http://www.Instagram.com/realDonaldTrump",,"https://pbs.twimg.com/profile_banners/25073877/1583212785","http://abs.twimg.com/images/themes/theme1/bg.png","http://pbs.twimg.com/profile_images/874276197357596672/kUuht00m_normal.jpg"
"x25073877","x1253538626992046080",2020-04-24 04:17:52,"realDonaldTrump","Disgraceful. Should join the Republican Party! https://t.co/HMpXOEdgSA","Twitter for iPhone",46,,,,TRUE,FALSE,26312,7726,,,,,"twitter.com/gopchairwoman/…","https://t.co/HMpXOEdgSA","https://twitter.com/gopchairwoman/status/1253495197805301762",,,,,,,,,,,"en","x1253495197805301762","State Rep. Whitsett nearly died from coronavirus, but because she dared to say something positive about @realDonaldTrump, Michigan Democrat party bosses are effectively kicking her out of the party.

Absolutely appalling.
https://t.co/1H0PD5mEs2",2020-04-24 01:25:18,"Sprout Social",13088,7166,"x2353605901","GOPChairwoman","Ronna McDaniel",599882,2594,14148,"","@GOP Chairwoman | Wife, mother of two",TRUE,,,,,,,,,,,,,,,,,,,,,,"NA NA","NA NA","NA NA NA NA NA NA NA NA","https://twitter.com/realDonaldTrump/status/1253538626992046080","Donald J. Trump","Washington, DC","45th President of the United States of America🇺🇸","https://t.co/OMxB0x7xC5",FALSE,78280539,47,120050,50907,6,2009-03-18 13:46:38,TRUE,"https://t.co/OMxB0x7xC5","http://www.Instagram.com/realDonaldTrump",,"https://pbs.twimg.com/profile_banners/25073877/1583212785","http://abs.twimg.com/images/themes/theme1/bg.png","http://pbs.twimg.com/profile_images/874276197357596672/kUuht00m_normal.jpg"
"x25073877","x1253472446377873409",2020-04-23 23:54:54,"realDonaldTrump","Governor @JimJusticeWV is a tremendous fighter for the incredible people of West Virginia. Big Jim is strong on Life, the Second Amendment, and Building the Wall! With Governors like Jim, America will recover and get back to business. Jim has my Complete and Total Endorsement!","Twitter for iPhone",277,,,,FALSE,FALSE,45021,10730,,,,,,,,,,,,,,,,"x3167789983","JimJusticeWV","en",,,,,,,,,,,,,,,,,,,,,,,,,,,,,,,,,,,,,"NA NA","NA NA","NA NA NA NA NA NA NA NA","https://twitter.com/realDonaldTrump/status/1253472446377873409","Donald J. Trump","Washington, DC","45th President of the United States of America🇺🇸","https://t.co/OMxB0x7xC5",FALSE,78280539,47,120050,50907,6,2009-03-18 13:46:38,TRUE,"https://t.co/OMxB0x7xC5","http://www.Instagram.com/realDonaldTrump",,"https://pbs.twimg.com/profile_banners/25073877/1583212785","http://abs.twimg.com/images/themes/theme1/bg.png","http://pbs.twimg.com/profile_images/874276197357596672/kUuht00m_normal.jpg"
"x25073877","x1253467642431705091",2020-04-23 23:35:48,"realDonaldTrump","Congressman @SteveStivers is doing a terrific job for the People of Ohio! He defends our Borders, Supports our Veterans, Strong on Crime, and the Second Amendment. Steve has my Complete and Total Endorsement!
https://t.co/iX0VBJ44sT","Twitter for iPhone",232,,,,FALSE,FALSE,21091,5837,,,,,"secure.winred.com/stivers-for-co…","https://t.co/iX0VBJ44sT","https://secure.winred.com/stivers-for-congress/donate",,,,,,,,,"x59536644","stevestivers","en",,,,,,,,,,,,,,,,,,,,,,,,,,,,,,,,,,,,,"NA NA","NA NA","NA NA NA NA NA NA NA NA","https://twitter.com/realDonaldTrump/status/1253467642431705091","Donald J. Trump","Washington, DC","45th President of the United States of America🇺🇸","https://t.co/OMxB0x7xC5",FALSE,78280539,47,120050,50907,6,2009-03-18 13:46:38,TRUE,"https://t.co/OMxB0x7xC5","http://www.Instagram.com/realDonaldTrump",,"https://pbs.twimg.com/profile_banners/25073877/1583212785","http://abs.twimg.com/images/themes/theme1/bg.png","http://pbs.twimg.com/profile_images/874276197357596672/kUuht00m_normal.jpg"
"x25073877","x1253467417482801154",2020-04-23 23:34:55,"realDonaldTrump","Congressman Bill Posey is a tremendous fighter for the Great State of Florida. He is a big supporter of our #MAGA Agenda – Strong on Crime, the Second Amendment, and Loves our Veterans and Law Enforcement. Bill has my Complete and Total Endorsement!","Twitter for iPhone",249,,,,FALSE,FALSE,47385,11043,,,"MAGA",,,,,,,,,,,,,,,"en",,,,,,,,,,,,,,,,,,,,,,,,,,,,,,,,,,,,,"NA NA","NA NA","NA NA NA NA NA NA NA NA","https://twitter.com/realDonaldTrump/status/1253467417482801154","Donald J. Trump","Washington, DC","45th President of the United States of America🇺🇸","https://t.co/OMxB0x7xC5",FALSE,78280539,47,120050,50907,6,2009-03-18 13:46:38,TRUE,"https://t.co/OMxB0x7xC5","http://www.Instagram.com/realDonaldTrump",,"https://pbs.twimg.com/profile_banners/25073877/1583212785","http://abs.twimg.com/images/themes/theme1/bg.png","http://pbs.twimg.com/profile_images/874276197357596672/kUuht00m_normal.jpg"
"x25073877","x1253466787829735425",2020-04-23 23:32:25,"realDonaldTrump","Congressman @MikeTurnerOH is a strong supporter and fighter for the People of Ohio! He will help us #MAGA! He’s Strong on the Border, Tough on Crime, will Protect our Vets, and our GREAT Second Amendment. Mike has my Complete and Total Endorsement! https://t.co/tIKPOJmZR7","Twitter for iPhone",272,,,,FALSE,FALSE,19287,5530,,,"MAGA",,"secure.winred.com/turner/donate","https://t.co/tIKPOJmZR7","https://secure.winred.com/turner/donate",,,,,,,,,"x380498919","MikeTurnerOH","en",,,,,,,,,,,,,,,,,,,,,,,,,,,,,,,,,,,,,"NA NA","NA NA","NA NA NA NA NA NA NA NA","https://twitter.com/realDonaldTrump/status/1253466787829735425","Donald J. Trump","Washington, DC","45th President of the United States of America🇺🇸","https://t.co/OMxB0x7xC5",FALSE,78280539,47,120050,50907,6,2009-03-18 13:46:38,TRUE,"https://t.co/OMxB0x7xC5","http://www.Instagram.com/realDonaldTrump",,"https://pbs.twimg.com/profile_banners/25073877/1583212785","http://abs.twimg.com/images/themes/theme1/bg.png","http://pbs.twimg.com/profile_images/874276197357596672/kUuht00m_normal.jpg"
"x25073877","x1253465846376280066",2020-04-23 23:28:40,"realDonaldTrump","Congressman @Troy_Balderson is doing a GREAT job for the People of Ohio! He will always Protect your #2A, Defend our Borders, and Support Small Business – a great supporter of the #MAGA Agenda. Troy has my Complete and Total Endorsement! https://t.co/ybcfR5rOOd","Twitter for iPhone",261,,,,FALSE,FALSE,17784,5080,,,"2A MAGA",,"secure.winred.com/balderson-for-…","https://t.co/ybcfR5rOOd","https://secure.winred.com/balderson-for-congress/donate",,,,,,,,,"x603083228","Troy_Balderson","en",,,,,,,,,,,,,,,,,,,,,,,,,,,,,,,,,,,,,"NA NA","NA NA","NA NA NA NA NA NA NA NA","https://twitter.com/realDonaldTrump/status/1253465846376280066","Donald J. Trump","Washington, DC","45th President of the United States of America🇺🇸","https://t.co/OMxB0x7xC5",FALSE,78280539,47,120050,50907,6,2009-03-18 13:46:38,TRUE,"https://t.co/OMxB0x7xC5","http://www.Instagram.com/realDonaldTrump",,"https://pbs.twimg.com/profile_banners/25073877/1583212785","http://abs.twimg.com/images/themes/theme1/bg.png","http://pbs.twimg.com/profile_images/874276197357596672/kUuht00m_normal.jpg"
"x25073877","x1253465581413597184",2020-04-23 23:27:37,"realDonaldTrump","Congressman @DaveJoyceOH14 is a tremendous fighter for the Great State of Ohio! He is Tough on Crime, our Border, Second Amendment, and helps us Combat Illegal Drugs! David has my Complete and Total Endorsement! https://t.co/ODAEpPur3W","Twitter for iPhone",235,,,,FALSE,FALSE,18032,5058,,,,,"secure.winred.com/davejoyce/dona…","https://t.co/ODAEpPur3W","https://secure.winred.com/davejoyce/donate",,,,,,,,,"x727242919","DaveJoyceOH14","en",,,,,,,,,,,,,,,,,,,,,,,,,,,,,,,,,,,,,"NA NA","NA NA","NA NA NA NA NA NA NA NA","https://twitter.com/realDonaldTrump/status/1253465581413597184","Donald J. Trump","Washington, DC","45th President of the United States of America🇺🇸","https://t.co/OMxB0x7xC5",FALSE,78280539,47,120050,50907,6,2009-03-18 13:46:38,TRUE,"https://t.co/OMxB0x7xC5","http://www.Instagram.com/realDonaldTrump",,"https://pbs.twimg.com/profile_banners/25073877/1583212785","http://abs.twimg.com/images/themes/theme1/bg.png","http://pbs.twimg.com/profile_images/874276197357596672/kUuht00m_normal.jpg"
"x25073877","x1253465418263605249",2020-04-23 23:26:58,"realDonaldTrump","Congressman @BradWenstrup is doing a tremendous job for the People of Ohio! He’s a proud Veteran and is Strong on the Border, Tough on Crime, the Second Amendment, and Supports Small Business. Brad has my Complete and Total Endorsement!
https://t.co/ZyXELSEZeA","Twitter for iPhone",260,,,,FALSE,FALSE,17880,5051,,,,,"secure.winred.com/usabrad/donate","https://t.co/ZyXELSEZeA","https://secure.winred.com/usabrad/donate",,,,,,,,,"x313719282","bradwenstrup","en",,,,,,,,,,,,,,,,,,,,,,,,,,,,,,,,,,,,,"NA NA","NA NA","NA NA NA NA NA NA NA NA","https://twitter.com/realDonaldTrump/status/1253465418263605249","Donald J. Trump","Washington, DC","45th President of the United States of America🇺🇸","https://t.co/OMxB0x7xC5",FALSE,78280539,47,120050,50907,6,2009-03-18 13:46:38,TRUE,"https://t.co/OMxB0x7xC5","http://www.Instagram.com/realDonaldTrump",,"https://pbs.twimg.com/profile_banners/25073877/1583212785","http://abs.twimg.com/images/themes/theme1/bg.png","http://pbs.twimg.com/profile_images/874276197357596672/kUuht00m_normal.jpg"
"x25073877","x1253464153530011650",2020-04-23 23:21:57,"realDonaldTrump","....My co-chair in Utah and a really great guy. Sean has my Complete and Total Endorsement!","Twitter for iPhone",91,"x1253464152233906178","x25073877","realDonaldTrump",FALSE,FALSE,20525,4392,,,,,,,,,,,,,,,,,,"en",,,,,,,,,,,,,,,,,,,,,,,,,,,,,,,,,,,,,"NA NA","NA NA","NA NA NA NA NA NA NA NA","https://twitter.com/realDonaldTrump/status/1253464153530011650","Donald J. Trump","Washington, DC","45th President of the United States of America🇺🇸","https://t.co/OMxB0x7xC5",FALSE,78280539,47,120050,50907,6,2009-03-18 13:46:38,TRUE,"https://t.co/OMxB0x7xC5","http://www.Instagram.com/realDonaldTrump",,"https://pbs.twimg.com/profile_banners/25073877/1583212785","http://abs.twimg.com/images/themes/theme1/bg.png","http://pbs.twimg.com/profile_images/874276197357596672/kUuht00m_normal.jpg"
"x25073877","x1253464152233906178",2020-04-23 23:21:56,"realDonaldTrump","Utah Attorney General Sean Reyes (@SeanReyesUT) is a fighter and hard worker for the Great State of Utah. He is a big supporter of our #MAGA Agenda – Strong on Crime, the Second Amendment, and Loves our Law Enforcement....","Twitter for iPhone",222,,,,FALSE,FALSE,29875,6913,,,"MAGA",,,,,,,,,,,,,"x23136027","SeanReyesUT","en",,,,,,,,,,,,,,,,,,,,,,,,,,,,,,,,,,,,,"NA NA","NA NA","NA NA NA NA NA NA NA NA","https://twitter.com/realDonaldTrump/status/1253464152233906178","Donald J. Trump","Washington, DC","45th President of the United States of America🇺🇸","https://t.co/OMxB0x7xC5",FALSE,78280539,47,120050,50907,6,2009-03-18 13:46:38,TRUE,"https://t.co/OMxB0x7xC5","http://www.Instagram.com/realDonaldTrump",,"https://pbs.twimg.com/profile_banners/25073877/1583212785","http://abs.twimg.com/images/themes/theme1/bg.png","http://pbs.twimg.com/profile_images/874276197357596672/kUuht00m_normal.jpg"
"x25073877","x1253463853645606918",2020-04-23 23:20:45,"realDonaldTrump","Congressman John Curtis (@CurtisUT) gets things done for Utah! John fights for Small Businesses, will Lower your Taxes, and will protect your Second Amendment. He has my Complete and Total Endorsement!","Twitter for iPhone",201,,,,FALSE,FALSE,27137,6740,,,,,,,,,,,,,,,,"x26057209","CurtisUT","en",,,,,,,,,,,,,,,,,,,,,,,,,,,,,,,,,,,,,"NA NA","NA NA","NA NA NA NA NA NA NA NA","https://twitter.com/realDonaldTrump/status/1253463853645606918","Donald J. Trump","Washington, DC","45th President of the United States of America🇺🇸","https://t.co/OMxB0x7xC5",FALSE,78280539,47,120050,50907,6,2009-03-18 13:46:38,TRUE,"https://t.co/OMxB0x7xC5","http://www.Instagram.com/realDonaldTrump",,"https://pbs.twimg.com/profile_banners/25073877/1583212785","http://abs.twimg.com/images/themes/theme1/bg.png","http://pbs.twimg.com/profile_images/874276197357596672/kUuht00m_normal.jpg"
"x25073877","x1253463521876217856",2020-04-23 23:19:26,"realDonaldTrump","....He’s 100% pro-life, strong on #2A and Loves our Military and Vets. Chris has my Complete and Total Endorsement! https://t.co/7w8Ayt5Bsq","Twitter for iPhone",139,"x1253463520940822538","x25073877","realDonaldTrump",FALSE,FALSE,16092,4229,,,"2A",,"secure.winred.com/chrisstewart/d…","https://t.co/7w8Ayt5Bsq","https://secure.winred.com/chrisstewart/donate",,,,,,,,,,,"en",,,,,,,,,,,,,,,,,,,,,,,,,,,,,,,,,,,,,"NA NA","NA NA","NA NA NA NA NA NA NA NA","https://twitter.com/realDonaldTrump/status/1253463521876217856","Donald J. Trump","Washington, DC","45th President of the United States of America🇺🇸","https://t.co/OMxB0x7xC5",FALSE,78280539,47,120050,50907,6,2009-03-18 13:46:38,TRUE,"https://t.co/OMxB0x7xC5","http://www.Instagram.com/realDonaldTrump",,"https://pbs.twimg.com/profile_banners/25073877/1583212785","http://abs.twimg.com/images/themes/theme1/bg.png","http://pbs.twimg.com/profile_images/874276197357596672/kUuht00m_normal.jpg"
"x25073877","x1253463520940822538",2020-04-23 23:19:26,"realDonaldTrump","Congressman Chris Stewart (@StewartforUtah) is a tremendous fighter for Utah. He served our Country in the U.S. Air Force, and has been a strong supporter of our #MAGA Agenda....","Twitter for iPhone",178,,,,FALSE,FALSE,22743,5723,,,"MAGA",,,,,,,,,,,,,"x395419988","StewartforUtah","en",,,,,,,,,,,,,,,,,,,,,,,,,,,,,,,,,,,,,"NA NA","NA NA","NA NA NA NA NA NA NA NA","https://twitter.com/realDonaldTrump/status/1253463520940822538","Donald J. Trump","Washington, DC","45th President of the United States of America🇺🇸","https://t.co/OMxB0x7xC5",FALSE,78280539,47,120050,50907,6,2009-03-18 13:46:38,TRUE,"https://t.co/OMxB0x7xC5","http://www.Instagram.com/realDonaldTrump",,"https://pbs.twimg.com/profile_banners/25073877/1583212785","http://abs.twimg.com/images/themes/theme1/bg.png","http://pbs.twimg.com/profile_images/874276197357596672/kUuht00m_normal.jpg"
"x25073877","x1253463098050129923",2020-04-23 23:17:45,"realDonaldTrump","Congressman Warren Davidson (@Vote_Davidson) is working very hard for the people of Ohio! He’s a strong supporter of our Military, Vets, Second Amendment, and #MAGA Agenda. Warren has my Complete and Total Endorsement! https://t.co/HxdSylWL2c","Twitter for iPhone",242,,,,FALSE,FALSE,17437,4834,,,"MAGA",,"secure.winred.com/davidson/donate","https://t.co/HxdSylWL2c","https://secure.winred.com/davidson/donate",,,,,,,,,"x4624539143","Vote_Davidson","en",,,,,,,,,,,,,,,,,,,,,,,,,,,,,,,,,,,,,"NA NA","NA NA","NA NA NA NA NA NA NA NA","https://twitter.com/realDonaldTrump/status/1253463098050129923","Donald J. Trump","Washington, DC","45th President of the United States of America🇺🇸","https://t.co/OMxB0x7xC5",FALSE,78280539,47,120050,50907,6,2009-03-18 13:46:38,TRUE,"https://t.co/OMxB0x7xC5","http://www.Instagram.com/realDonaldTrump",,"https://pbs.twimg.com/profile_banners/25073877/1583212785","http://abs.twimg.com/images/themes/theme1/bg.png","http://pbs.twimg.com/profile_images/874276197357596672/kUuht00m_normal.jpg"
"x25073877","x1253462557010124807",2020-04-23 23:15:36,"realDonaldTrump","....Bill has my Complete and Total Endorsement! https://t.co/Dmso0XmeYl","Twitter for iPhone",71,"x1253462554803920902","x25073877","realDonaldTrump",FALSE,FALSE,13337,3550,,,,,"secure.winred.com/johnson-for-co…","https://t.co/Dmso0XmeYl","https://secure.winred.com/johnson-for-congress/donate",,,,,,,,,,,"en",,,,,,,,,,,,,,,,,,,,,,,,,,,,,,,,,,,,,"NA NA","NA NA","NA NA NA NA NA NA NA NA","https://twitter.com/realDonaldTrump/status/1253462557010124807","Donald J. Trump","Washington, DC","45th President of the United States of America🇺🇸","https://t.co/OMxB0x7xC5",FALSE,78280539,47,120050,50907,6,2009-03-18 13:46:38,TRUE,"https://t.co/OMxB0x7xC5","http://www.Instagram.com/realDonaldTrump",,"https://pbs.twimg.com/profile_banners/25073877/1583212785","http://abs.twimg.com/images/themes/theme1/bg.png","http://pbs.twimg.com/profile_images/874276197357596672/kUuht00m_normal.jpg"
"x25073877","x1253462554803920902",2020-04-23 23:15:35,"realDonaldTrump","Congressman Bill Johnson (@JohnsonLeads) is an incredible fighter for the Great State of Ohio! He’s a proud Veteran and a hard worker who Cares for our Veterans, Supports Small Business, and is Strong on the Border and Second Amendment....","Twitter for iPhone",239,,,,FALSE,FALSE,29120,7079,,,,,,,,,,,,,,,,"x81207735","JohnsonLeads","en",,,,,,,,,,,,,,,,,,,,,,,,,,,,,,,,,,,,,"NA NA","NA NA","NA NA NA NA NA NA NA NA","https://twitter.com/realDonaldTrump/status/1253462554803920902","Donald J. Trump","Washington, DC","45th President of the United States of America🇺🇸","https://t.co/OMxB0x7xC5",FALSE,78280539,47,120050,50907,6,2009-03-18 13:46:38,TRUE,"https://t.co/OMxB0x7xC5","http://www.Instagram.com/realDonaldTrump",,"https://pbs.twimg.com/profile_banners/25073877/1583212785","http://abs.twimg.com/images/themes/theme1/bg.png","http://pbs.twimg.com/profile_images/874276197357596672/kUuht00m_normal.jpg"
"x25073877","x1253426762928668678",2020-04-23 20:53:22,"realDonaldTrump","I will be having a White House Press Conference today at 5:45 P.M. Thank you!","Twitter for iPhone",77,,,,FALSE,FALSE,80732,11917,,,,,,,,,,,,,,,,,,"en",,,,,,,,,,,,,,,,,,,,,,,,,,,,,,,,,,,,,"NA NA","NA NA","NA NA NA NA NA NA NA NA","https://twitter.com/realDonaldTrump/status/1253426762928668678","Donald J. Trump","Washington, DC","45th President of the United States of America🇺🇸","https://t.co/OMxB0x7xC5",FALSE,78280539,47,120050,50907,6,2009-03-18 13:46:38,TRUE,"https://t.co/OMxB0x7xC5","http://www.Instagram.com/realDonaldTrump",,"https://pbs.twimg.com/profile_banners/25073877/1583212785","http://abs.twimg.com/images/themes/theme1/bg.png","http://pbs.twimg.com/profile_images/874276197357596672/kUuht00m_normal.jpg"
"x25073877","x1253341575280656385",2020-04-23 15:14:52,"realDonaldTrump","https://t.co/iPon70Z1yW","Twitter for iPhone",23,,,,FALSE,FALSE,33123,8563,,,,,"whitehouse.gov/articles/with-…","https://t.co/iPon70Z1yW","https://www.whitehouse.gov/articles/with-excess-national-supply-exchanges-will-allow-u-s-hospitals-to-continue-meeting-ventilator-demand/",,,,,,,,,,,"und",,,,,,,,,,,,,,,,,,,,,,,,,,,,,,,,,,,,,"NA NA","NA NA","NA NA NA NA NA NA NA NA","https://twitter.com/realDonaldTrump/status/1253341575280656385","Donald J. Trump","Washington, DC","45th President of the United States of America🇺🇸","https://t.co/OMxB0x7xC5",FALSE,78280539,47,120050,50907,6,2009-03-18 13:46:38,TRUE,"https://t.co/OMxB0x7xC5","http://www.Instagram.com/realDonaldTrump",,"https://pbs.twimg.com/profile_banners/25073877/1583212785","http://abs.twimg.com/images/themes/theme1/bg.png","http://pbs.twimg.com/profile_images/874276197357596672/kUuht00m_normal.jpg"
"x25073877","x1253341461401096193",2020-04-23 15:14:25,"realDonaldTrump","https://t.co/cT7EDnDUYo","Twitter for iPhone",23,,,,FALSE,FALSE,42888,10765,,,,,"whitehouse.gov/briefings-stat…","https://t.co/cT7EDnDUYo","https://www.whitehouse.gov/briefings-statements/president-donald-j-trump-honoring-commitment-protect-american-workers-temporarily-pausing-immigration/",,,,,,,,,,,"und",,,,,,,,,,,,,,,,,,,,,,,,,,,,,,,,,,,,,"NA NA","NA NA","NA NA NA NA NA NA NA NA","https://twitter.com/realDonaldTrump/status/1253341461401096193","Donald J. Trump","Washington, DC","45th President of the United States of America🇺🇸","https://t.co/OMxB0x7xC5",FALSE,78280539,47,120050,50907,6,2009-03-18 13:46:38,TRUE,"https://t.co/OMxB0x7xC5","http://www.Instagram.com/realDonaldTrump",,"https://pbs.twimg.com/profile_banners/25073877/1583212785","http://abs.twimg.com/images/themes/theme1/bg.png","http://pbs.twimg.com/profile_images/874276197357596672/kUuht00m_normal.jpg"
"x25073877","x1253341318329315328",2020-04-23 15:13:50,"realDonaldTrump","https://t.co/R3mSfNIeC6","Twitter for iPhone",23,,,,FALSE,FALSE,81265,18269,,,,,"foxnews.com/politics/trump…","https://t.co/R3mSfNIeC6","https://www.foxnews.com/politics/trump-says-thunderbirds-blue-angels-will-do-flyovers-to-honor-medical-workers",,,,,,,,,,,"und",,,,,,,,,,,,,,,,,,,,,,,,,,,,,,,,,,,,,"NA NA","NA NA","NA NA NA NA NA NA NA NA","https://twitter.com/realDonaldTrump/status/1253341318329315328","Donald J. Trump","Washington, DC","45th President of the United States of America🇺🇸","https://t.co/OMxB0x7xC5",FALSE,78280539,47,120050,50907,6,2009-03-18 13:46:38,TRUE,"https://t.co/OMxB0x7xC5","http://www.Instagram.com/realDonaldTrump",,"https://pbs.twimg.com/profile_banners/25073877/1583212785","http://abs.twimg.com/images/themes/theme1/bg.png","http://pbs.twimg.com/profile_images/874276197357596672/kUuht00m_normal.jpg"
"x25073877","x1253297383414390788",2020-04-23 12:19:16,"realDonaldTrump","Fully signed and ready to go! https://t.co/MdpgII3kuq","Twitter for iPhone",29,,,,TRUE,FALSE,83167,18527,,,,,"twitter.com/realDonaldTrum…","https://t.co/MdpgII3kuq","https://twitter.com/realDonaldTrump/status/1252418369170501639",,,,,,,,,,,"en","x1252418369170501639","In light of the attack from the Invisible Enemy, as well as the need to protect the jobs of our GREAT American Citizens, I will be signing an Executive Order to temporarily suspend immigration into the United States!",2020-04-21 02:06:22,"Twitter for iPhone",405911,92852,"x25073877","realDonaldTrump","Donald J. Trump",78280539,47,50907,"Washington, DC","45th President of the United States of America🇺🇸",TRUE,,,,,,,,,,,,,,,,,,,,,,"NA NA","NA NA","NA NA NA NA NA NA NA NA","https://twitter.com/realDonaldTrump/status/1253297383414390788","Donald J. Trump","Washington, DC","45th President of the United States of America🇺🇸","https://t.co/OMxB0x7xC5",FALSE,78280539,47,120050,50907,6,2009-03-18 13:46:38,TRUE,"https://t.co/OMxB0x7xC5","http://www.Instagram.com/realDonaldTrump",,"https://pbs.twimg.com/profile_banners/25073877/1583212785","http://abs.twimg.com/images/themes/theme1/bg.png","http://pbs.twimg.com/profile_images/874276197357596672/kUuht00m_normal.jpg"
"x25073877","x1253296736589807619",2020-04-23 12:16:41,"realDonaldTrump","Please study this closely. We saved many lives with our fast action on CoronaVirus! https://t.co/IKtkciXEEO","Twitter for iPhone",83,,,,TRUE,FALSE,78014,24086,,,,,"twitter.com/realdonaldtrum…","https://t.co/IKtkciXEEO","https://twitter.com/realdonaldtrump/status/1252046878314770432",,,,,,,,,,,"en","x1252046878314770432","BRILLIANT, A MUST WATCH! @RepDanCrenshaw https://t.co/W6pGsJQ2ua",2020-04-20 01:30:12,"Twitter Media Studio",246248,92720,"x25073877","realDonaldTrump","Donald J. Trump",78280539,47,50907,"Washington, DC","45th President of the United States of America🇺🇸",TRUE,,,,,,,,,,,,,,,,,,,,,,"NA NA","NA NA","NA NA NA NA NA NA NA NA","https://twitter.com/realDonaldTrump/status/1253296736589807619","Donald J. Trump","Washington, DC","45th President of the United States of America🇺🇸","https://t.co/OMxB0x7xC5",FALSE,78280539,47,120050,50907,6,2009-03-18 13:46:38,TRUE,"https://t.co/OMxB0x7xC5","http://www.Instagram.com/realDonaldTrump",,"https://pbs.twimg.com/profile_banners/25073877/1583212785","http://abs.twimg.com/images/themes/theme1/bg.png","http://pbs.twimg.com/profile_images/874276197357596672/kUuht00m_normal.jpg"
